start,end,text
1476580,1487140," and see, uh, what kind of stuff memory in megabytes. Okay. Uh, so that's what it is. What if I actually"
1487140,1495220," give you two megabytes, right? Um, yeah, let's actually give you two megabytes and see, maybe that will"
1495220,1503620," increase it, uh, price. There's also primary drive, right? So this is some sort of a primary drive"
1503620,1511300," and I suppose this is not a memory. So memory MB is probably like a RAM. Um, yeah. Okay. So we'll just save it."
1511300,1518580," And let's try to run it one more time. Is there any way to just run it without rebuilding it? Uh, it looks"
1518580,1524580," like it just always run it. Uh, so because it feels like it's always build it. Yeah. It feels like it's"
1524580,1532020," always build. Just in case, um, more RAM than a hard drive. Yeah, exactly. I hope it's not going to kill"
1532020,1542340," my entire stream by the way. I really hope so. Uh, it may, it actually may. All right. Um, isn't it"
1542340,1550180," megabytes? So would be two giga? Yeah. So I give it two gigabytes. Why not? Um, so why not give it"
1550180,1556180," two megabytes? I think we can afford two gigabytes of RAM in 2024. Why not?"
1559700,1567300," Have you ever tried to extend CLang? Yes, I did. I did that with TCC specifically. I added, uh, basically"
1567300,1573620," downloading of the headers when you include them. So one of the things I did, uh, I did that if you"
1573620,1579620," include with HTTPS, it will actually download that header and include it. So this is one of the things"
1579620,1585860," I did long time ago. There's even a video about that, but I forgot where it's, where is the link for"
1585860,1593620," that video? So I really apologize for that. Uh, please check the script console, uh, the script"
1593620,1600420," console. Okay. So I will check it out. Um, I saw a PSEX folder in application. Maybe it has apps in there."
1600420,1606340," Yeah. Well, I mean the applications that I was running 200, 2048 and file manager, they are"
1606340,1610180," the, this application, they are located in the application folder."
1611380,1619060," Yeah. Lip curl stream. It's a loop curl stream. Um, I thought you were actually avoiding it. No,"
1619060,1623780," it's because I know this is the applications, right? So that you run for in the, in essence."
1623780,1633620," Based next stream. Exactly. So I think we're ready. Uh, fuck. Shit. Fuck. Damn."
1635940,1643140," All right. So, uh, let's go into the metrics. What do we have? So people ask me to check the script console."
1643140,1654340," Uh, what the fuck is this shit? Couldn't find inside its scope. Can I?"
1657140,1659700," How do I use that? What is the script console?"
1659700,1671940," You broke it. I don't know how to use it. So int x10. Okay."
1671940,1681940," Uh, no, none of this work. This is actually really bad. I think at least the help command should work."
1682500,1688500," At least the help command should, when you are designing like a prompt, uh, application, right?"
1688500,1693140," When you design a prompt application, you have to make sure that some sort of a help command works"
1693140,1699940," and prints you something like h, uh, help. None of that work. Because again, I tried different thing."
1699940,1704980," Uh, it's impossible to get some help that will explain you how to use this thing. So it's like,"
1704980,1710100," unfortunately, this is a bad design. Uh, I'll like subtract points from that. I'll definitely subtract"
1710100,1717060," point for that. Anyways. So if I try to do this kind of stuff, so what if I do CC still out of memory,"
1717060,1723700," still out of memory. So, uh, yeah, maybe it just reports a thing incorrectly. What I'm thinking is"
1723700,1730980," that maybe the command is missing. I think the command is missing. I think it is using a wrong"
1730980,1736420," error, no code to describe it. Yeah. So I think it's a wrong message. So that's what's going on in here."
1736420,1742340," It's not really out of memory is that it's using, uh, you know, a wrong error message that happened"
1742340,1749220," to me way too often. Honestly, when I was developing and see that happened to me way too often anyway."
1749220,1753380," So let's actually try to write some stuff for the separating system. I don't know. Uh, I think that"
1753380,1759060," would be interesting. So all of the applications, right? So all of the applications, they are located"
1759060,1767140," in the apps folder and here are their source code. So as you can see, 2048, uh, is basically two files"
1767140,1774340," CPP and any file, I suppose any file contains metadata. Yeah, it is metadata. So name, uh, use a single"
1774340,1780100," instance. So you can have several instances. I have no idea what is an instance. Then you specify the path"
1780100,1785940," to the source code and you have embed. So you can actually have some resources and stuff like that. So how"
1785940,1791460," an application for an essence operating system looks like. This file is a part of the essence"
1791460,1796180," operating system. This is licensed under a term of MAT license. C license written by next. Okay. That's"
1796180,1802900," cool. So you include essence.h. I suppose it's kind of similar to windows.h, right? Uh, shared string. So it"
1802900,1812020," has like its own standard library and stuff like that. Tile course. Damn. Right. Damn. And people tell me,"
1812020,1818660," brah, you need to run Raylib in this thing. Look, this thing has its own shed that doesn't require Raylib or"
1818660,1826820," anything like that. So where is the main? Does it have a main, uh, oh, it has a start. Okay. So this is"
1826820,1832980," probably, I'm going to just assume that this is probably the entry point for, uh, for the application. So you"
1832980,1843860," have to initialize it. You have ES buffers. Uh, so then you can, damn. So settings file, you read an"
1843860,1852100," entirety of the settings file into the buffer, into the bytes of the buffer. And then you're probably"
1852100,1858340," parsing it or something like that. And the settings file, is it defined somewhere? Where is it defined? Okay."
1858340,1865540," Okay. This is the path schema. Oh yeah. It's, it's inside its own operating system. It probably has"
1865540,1871780," its own path schema, right? So you, you have some, something called bar and I suppose like this is a"
1871780,1877940," settings and within the settings you have like a default dot that. And this is kind of interesting,"
1877940,1885300," actually do like all of the applications have their own sort of like a file system, like a virtual file"
1885300,1890740," system, because like this is hard coded, right? So when I say settings, it's probably settings for that"
1890740,1894980," specific application or something like that. That's probably what it is. It's kind of, it's kind of"
1894980,1902740," interesting. I really like that. Um, so then you, you have specific functions for the buffers that reads"
1903300,1911540," chunk of the, of the buffer. You read high score, you read the score, uh, then you read the buffer into"
1911540,1919380," some grid and stuff like that. Then you free it. And then you have a loop. Oh my God, it's event-based."
1919380,1923700," I mean, I mean, what did they expect? Like all of the Google applications have been best, I suppose."
1923700,1931060," Right. So you have an infinite loop and you receive messages, you receive messages and you process those"
1931060,1938020," messages and then, yeah, it's, it's kind of windows. Uh, right. So it's kind of, it's kind of like a"
1938020,1944820," windows. Okay. Okay. Okay. Okay. Okay. So you set an icon. Yeah. There you go. Uh, you create a panel"
1944820,1950340," and yeah, so this is a manual GUI, right? And it's not an immediate UI, right? So it's not the immediate"
1950340,1957540," UI. As you can see, we are creating the tree. We are creating the tree. So it's retained. So we first"
1957540,1962020," create the tree of this thing and then we give it to event loop. Well, I mean, we are organizing the"
1962020,1967940," event loop effectively. Uh, right. So, but we then let the system to send that messages and process them."
1967940,1972340," And what kind of messages you have, you also have an application exit, uh, save configuration,"
1972340,1976020," right? So you can save the configuration. This is pretty straightforward. Like I can just read that."
1976020,1980260," I don't even need documentation or anything like that. It's like, yeah, it's, it's very much"
1980260,1988180," straightforward. Uh, that's so fucking cool. Uh, anyways, so do you have, uh, like some sort of a"
1988180,1995380," example? So there's samples. Um, so game loop. Hello. Okay. So let's actually take, and hello is written"
1995380,2003220," in C. Look at that. So you can actually write in C++ and C, which makes sense, right? Why not? So, uh, here,"
2003220,2010660," um, you have a hello and stuff like that. So hello. Okay. Let's see. Um, we're not using the C standard"
2010660,2015540," libraries, so we need to initialize global constructors manually. Oh, so that's why we do that."
2015540,2022420," Global. Aha. Okay. So that's, that's very interesting. Okay. Okay. So you have an infinite loop."
2022420,2028340," And what's funny is that you don't really have an exit condition. Well, in reality, you kind of do."
2028340,2035140," So weren't we receiving the exit message somewhere? Uh, I think we were receiving the exit message."
2035140,2041380," Let me actually take a look super quick. So in, in here, when we were processing application messages,"
2041380,2047940," one of the messages was, um, application exit, but the only thing we did is just save configuration"
2047940,2053380," and nothing else. So where's the safe configuration? Yeah. So we just save configuration. I suppose,"
2054980,2062180," um, the applications are killed forcefully. I think that's what it is, right? It usually in,"
2062180,2068420," in POSIX, right? In UNIX, it's the application that says, okay, I'm going to exit. And that's why they"
2068420,2077060," calling the exit Cisco. So here, I suppose it's the user who closes the application and the message is"
2077060,2084900," sent as just a notification is just a notification, bro. You're about to get killed. Do all of your"
2084900,2090660," stuff, save all of your configs and get the out of here. So you don't even have to do anything,"
2090660,2095860," right? So it will kill you automatically. It will just unload you anyway. It just basically tells you"
2095860,2102260," the user requested to kill you. I'm sorry. Here's some time. Do some stuff, right? So this is actually"
2102260,2108420," pretty cool. I really appreciate that. Uh, well, I mean, application can probably try to exit. Maybe"
2108420,2116420," there is some sort of like an exit call. I'm pretty sure. Hmm. In this model, how the system knows when"
2116420,2123460," to do the kill? When the user pressed the, the X on the window, when the user pressed the X, this is how"
2123460,2128420," operating system knows, okay, this application has to go. This application has to go."
2128420,2136420," So, Yusu, Yusu, Yusu. Alrighty."
2136420,2145060," So how does it actually know when it's ready to be killed? That's a very interesting question. Maybe"
2145060,2151220," receive message. This is my hypothesis, by the way, I don't really know how essence work. But if I were to"
2151220,2157380," make this system, how would I do that? I probably would make message receive kind of block a little bit,"
2157380,2165380," or I would use it as a essentially an indicator that the application waits for the next message,"
2165380,2171940," and that's when it is time for me to kill the application. Probably. So essentially, when I received"
2171940,2180020," message exit, when I sent to the application message exit, I would wait for its next message receive,"
2180500,2187140," and upon receiving its message receive request, only then I would kill them, which has a very"
2187140,2193460," interesting implication. What if I never call message receive after receiving message application exit?"
2193460,2200900," I don't know. Like, what would you do in that case?"
2202820,2207460," Maybe after some timeout? Who freaking knows? Like, I don't really know."
2207460,2215620," But to be fair, like, what would you even do? So what if you exit out of stuff? There's so many"
2215620,2218420," questions, like, and we don't even know how to develop for this yet. So,"
2219140,2229380," right, so let me let me see. So this is a hello, right? So this is a hello. And yeah, so here we receive"
2229380,2234180," the message, then we do create, we don't even handle message exit, right? So because again,"
2234180,2242660," we have nothing to save or like to do after we are done with this endeavor. So the system wants us to"
2242660,2249940," create an instance of our application. Call instance create with a message and application name. Instance"
2249940,2257140," of our application. I remember hearing that word before. In the configuration, at least in the"
2257140,2263220," configuration of this thing, it was saying use a single instance. So that means there are applications"
2263220,2268980," with several instances, and instance is something that you create yourself manually, apparently. I"
2268980,2275780," wonder if it is basically a window. Maybe the application that can have, maybe there are applications"
2275780,2282340," that can have several windows over several tabs or something like that. I can see that. Why not call"
2282340,2288420," it window then? Because maybe it's not really a window, right? It could be also a tab. I don't know,"
2288420,2293140," we'll see, we'll see. I think we're going to discover that at some point. So create a text"
2293140,2300100," display with the hello world message, right? So you do text create. Okay, so an instance has a window,"
2300100,2305620," right? So window is a part of the instance. Because of that, instance is not necessarily a window."
2305620,2315220," I wonder if instance is sort of like a process. What if the multiprocessing in this operating system is"
2315220,2319860," just like several instances? Like, I don't know. I'm just speaking out of my ass. I'm just, you know,"
2319860,2325380," confabulating shit like a crazy chat GPT model. That's what I'm doing. So add the text display to the"
2325380,2331860," instance. The text display should fill the window, right? So you specify that. Use the window background"
2331860,2344180," style. Okay, so pass minus one as a zero terminated string. Ah, okay. So this is a pointer to the string,"
2344180,2349540," and this is the size of the string. But if you have a string that is null terminated, you pass minus one,"
2349540,2354980," and it just assumes that the string is null terminated. It supports both guides. An operating"
2354980,2361220," system that supports both styles of strings. I think WinAPI also does support like both styles of strings"
2361220,2367220," for some like WinAPI calls. Right, but I don't quite remember. I'm not a Windows developer. Honestly,"
2367220,2372500," I would take this kind of operating system over Windows anytime. I want to install it like on actual"
2372500,2379540," hardware on some old laptop or something like that. If I can develop from this operating system without the"
2379540,2384980," host operating system, I wouldn't mind using it for recreation programming. Imagine having a simplistic"
2384980,2391780," operating system like that somewhere in the woods in a cabin and only have a compiler and do recreation"
2391780,2398420," programming for yourself. Something like an OpenBSD Carmack style. I think Carmack actually did this"
2398420,2404980," session where he went to like completely isolated himself with the OpenBSD source code and just like"
2404980,2412980," did OpenBSD development or something like that. I think it was Carmack, right? So I think it was him."
2412980,2418100," Right, so and yeah, so I'd like to do something like that with the essence. That would be kind of cool."
2418100,2423620," Right, right, right, right, right. Okay, so all that looks pretty straightforward, but the question is"
2423620,2429860," how do I even fucking create this thing? Because I didn't think I have... I didn't see hello application"
2429860,2436500," in there. I wonder if I can do something like this. Right, so I'm going to do hello. But the thing about"
2436500,2442820," this application is that it says that source is in the sample, so maybe I will have to change it"
2442820,2448580," like that. And the question is, will it pick it up? Will it actually pick it up? So let's actually see."
2448580,2452100," Let's actually see."
2452100,2458660," So what we need is an OS that you can recompile while running."
2458660,2466900," I think it is possible in TapOS. I think you can basically recompile parts of the operating system"
2466900,2474420," while it is running. So technically, nothing really stops you except your own skill to recompile the"
2474420,2480260," entirety of TempleOS while you're running it, right? So if you can't do that, that is obviously skill issue,"
2480260,2485540," right? So you probably don't know how to do that. Where's the progress bar? You don't need the progress"
2485540,2490980," bar, you have a spinning thingy. Who needs a progress bar if you have a spinning thingy?"
2490980,2504260," You can do this with PreBSD too? Yeah, probably. I don't know. I don't really know anything about PreBSD."
2506260,2514420," Progress bar is bloat, mate. It's a bloat. Why it stops spinning in a zoom? Because the zoom utility"
2514420,2519940," doesn't really update in real time. What it does, it makes a screenshot and zooms in on a screenshot."
2519940,2527300," I actually kind of prefer it like that because I sometimes use it to stop some specific animation"
2527300,2532820," and look at specific pixels and stuff like that. So it's not really zooming in, it's actually taking a"
2532820,2541700," picture and zooming in on the picture. That's what it is. That's what it is."
2541700,2551300," So that's a pretty interesting development loop. You know what I'm talking about, right? So the usual"
2551300,2556740," development loop is modify the source code, then recompile and then test the changes, right? So here"
2557860,2561860," we're going to have a great time, honestly. So that means we will have to keep that in mind"
2561860,2567940," that we don't really have a super short development loop, unless we figure out how to compile things"
2567940,2572740," on the operating system. But as far as I know, it's not really supported yet, right? So it isn't..."
2572740,2576660," Here is hello. That's not bad. Look at that."
2576660,2583380," That is easier than I expected. Like, what the fuck? So yeah, hello world."
2587060,2595540," Okay. So this is cool. That is fucking cool. All right. So I think like you guys know what we need"
2595540,2605460," to do. You guys know what we need to do, right? We must create game of life on this thing to assert"
2605460,2612580," our dominance. That's how I assert the dominance in the project. I come in and implement game of life."
2612580,2619140," That's what we need to do. We need to implement the game of life. But I'm already saving for almost"
2619140,2624420," one hour, right? And I ran out of tea. So I think the time has come to make a small break"
2624420,2629300," and make a cup of tea. And after I have a cup of tea, I'm going to be ready to rock and roll and"
2629300,2637700," implement the game of life. All right. So let's create game of life application. So let's go into"
2637700,2643460," apps. And I wonder if there is already maybe game of life. I didn't think so. So if we take a look at the"
2643460,2649220," samples, there's game loop. I mean, this is something that we're interested in rather than hello world,"
2649220,2657300," honestly. Right. So there's a game loop. And if we take a look inside of the game loop. So this is the"
2657300,2665940," thing. We are creating the instance, right? We're just creating the instance. And what else do we do in"
2665940,2674980," here? Oh, this one is interesting. We create a canvas, first of all. Okay, so I think I did actually"
2674980,2680420," very good thing that they decided to check this specific example. You custom create element windows,"
2680420,2686660," fill, you fill the whole thing. It's focusable, panel, and so on and so forth. So you created some"
2686660,2692820," sort of a canvas. And if you take a look at the, what is the canvas? Yeah. Okay. So it's a canvas is"
2692820,2702020," just the ES element. All right. So ES, I suppose, stands for ECMAScript. So we have a message user and"
2702820,2712900," canvas message. Okay. So you can actually assign callbacks to different messages that this element"
2712900,2718420," receives. Okay. That's very interesting. So you can send messages to specific elements and you can"
2718420,2725540," actually receive them through callbacks. All right. So you can have some other stuff in here. All right."
2725540,2733860," That's very cool. Then you start animating. All right. So send animation messages to the canvas."
2733860,2741460," Start animating. Focus the canvas to receive the keyboard messages. That is very interesting."
2741460,2749540," And then you... So you actually do this thing once. Because I suppose you do that when you receive the"
2750180,2755540," instance create message and you receive it once at the beginning of the application. So I assume, because"
2755540,2762660," it makes sense. So afterwards, I suppose you just keep looping and receiving messages and you don't"
2762660,2768580," really handle them. Right. So that's basically how it works. That's basically how it works. That's actually"
2768580,2777620," kind of cool. Okay. So and within the canvas message, within the canvas message, if we receive message paint,"
2778340,2787460," you get the boundaries of your entire thing. And you render the game within that thing. So and..."
2787460,2790420," Yes, paint!"
2790420,2807700," Oh my God. And I swear to God, I think I saw a similar API idea in SerenityOS as well. So yeah, in Qt there is a..."
2807700,2814180," It tries to mimic this classical UI libraries, right? So it's actually quite common paradigm in this"
2814180,2821940," retain UI things. It is actually very common paradigm. So okay, so there is a paint and you can draw blocks."
2821940,2828100," Then you draw rectangle and stuff like that. Okay, so that makes sense. That makes sense. Okay."
2828100,2832580," So then you receive an animate. Keep sending animation messages."
2833700,2840180," Oh, okay. So you also have to say that the animation is not complete. So it keeps receiving messages."
2840180,2846420," This is some sort of like an inner knowledge that you have to have about this animation system. But okay,"
2846420,2852180," so I think we'll gain that knowledge over time. So we'll update the game using the time delta provided."
2852180,2858660," And then we repaint the whole thing. This is like a very old-school style UI programming."
2858660,2864900," Like a very old-school style. Not really all I mean. Whatever I'm doing, people would say that it's"
2864900,2871060," probably old-school. But it's kind of like a renaissance, right? It's more of like a renaissance"
2871060,2876580," programming. So before that, we were doing that. And before that, we were doing whatever I do today, right?"
2876580,2884180," So something like that. Something like that. It's sort of an alternative way. I would say it's a GUI"
2884180,2891860," programming from 2000s and 2010s. Let's put it this way. Or maybe a little bit from 90s, right? A"
2891860,2899140," little bit from 90s. It's the GUI programming for that era, roughly. Yeah, okay. So this is basically the"
2899140,2904180," game loop. Within the game loop, you have different things in here. You're drawing blocks and stuff like"
2904180,2909300," that. Looks cool. Looks GUCI. Looks at Tamaguchi. It would be kind of cool to actually find the definitions"
2909300,2914020," for all of these functions somewhere, just to have a list of them, right? Because that's how I like to"
2914020,2923780," learn about APIs, right? So let's actually go ahead and do that. So I want to go and just grep for this"
2923780,2928740," entire stuff, right? So where... I suppose this is a structure. So let's actually just go ahead and assume"
2929220,2935620," that there is a structure like that, like aselement pane. And I wonder where it's going to be. So it"
2935620,2941140," would be maybe better to exclude certain folders, right? So there's a problem with grep. Maybe I can"
2941140,2947060," use just a rib grep. I don't remember. Do I have a rib grep? RG? I don't even have a rib grep."
2947060,2953540," All right, so rib grep. Maybe we can install that. I hope we don't have to install it from cargo,"
2953540,2958340," because cargo usually builds things from scratch. Okay, so there is a rib grep in here. So let me actually"
2958340,2976260," quickly do that. My mouse keeps dying at a very inconvenient moment. And only when I'm streaming,"
2976260,2981220," by the way. When I'm not streaming, my mouse does not die. So something with streaming. I think it's"
2981220,2983380," hackers that are trying to hack my stream."
2983380,2995540," Okay, so I have a rib grep. So I should be able to maybe do some stuff like this RG."
2995540,3000980," And it should... No, I didn't find it. So that means it's probably defined slightly differently. It's"
3000980,3008660," probably defined like this. Okay. So is it not? It's... Oh, it's a function. Why did I think it's a"
