start,end,text
1578860,1585180," So essentially, if you want to load 64, we're just iterate eight times. And we just like, you know,"
1585180,1591420," build a 64 bit number out of bytes. And we do the same for the store, right? I just want you to see"
1591420,1598620," how slow is it going to be. And I expected low key that this was the bottleneck of the execution. And"
1598620,1604620," I was hoping that like, I'm going to just like make these things intrinsic, and I'm going to gain a huge"
1604620,1613900," speed up. But in reality, the memory access, the memory access is like less than a second. Like, yeah,"
1613900,1620780," so the the program was actually waiting primarily on swapping, dropping and doing over basically the stack"
1620780,1629100," operations, something that should be insanely fast. So I'm actually, yeah, this is really weird."
1629100,1635340," Like, and essentially, what swap, drop and over means is that swap swaps elements on the stack,"
1635340,1641340," drop removes the element from the stack and over copies the element below the top, right,"
1641340,1646780," it's just like a stack operations. And what do we do? What do we use for the stack is actually just"
1646780,1653820," list list, like I would expect lists, the the most common data structure in Python to be very fast,"
1653820,1659020," right, it should be the most optimized, optimized data structure. But why is it so slow? Right,"
1659020,1667340," so stack is the is the least. All right. So it's kind of sus. No, I'm gonna lie. Let me actually do"
1667340,1676620," something. Let's create a file something like stack stress. Let's actually stress test the stack."
1676620,1685180," Right, so I'm going to do user bin environment, Python three, and let's just create a stack,"
1685180,1693420," nothing special. So like this. And how many times this instruction is executed? So swap is executed. I want to"
1693420,1702780," three more to 15 million times. Okay, so let's do the following thing. For I in the range, 15 million,"
1702780,1709980," right, like so 15 million. And what we're going to do within this loop is just basically push 69 and pop."
1709980,1717820," There we go. So and also maybe we are going to time this entire thing. So let's do something like start"
1718380,1727100," time, time, time. And in here, we're going to print f six. Haha, time, time minus start. There we go."
1727100,1733820," So and let's just go ahead and execute the this entire thing. So let's see how like a pure pushing"
1733820,1740700," and popping on and from the stack is going to perform. So 15 million times is actually shouldn't be that"
1741260,1747100," many, you know, many, you know, operations. So it should be relatively fast in any say saying language,"
1747100,1753660," this should be like below one second, it must be below one second. And let's see. So,"
1753660,1760860," so we can put out it's a pen. I keep forgetting that it's a pen. In fact, are you serious?"
1763020,1771660," I really, five, wait a freaking second, just such a simple thing that has to be optimized because it's"
1771660,1781580," so common. Is that slow? I can't even properly, you know, print this entire thing. I'm so in shock"
1781580,1791980," that I forgot how to use Python. It shouldn't be that slow. Seriously? 15 million times pushing and"
1791980,1800700," popping on the stack is 6.5 seconds. Really? So just to just to show you why I'm in such a shock,"
1800700,1806700," let's take a look at C++ or okay. So I know that comparing C++ and Python is kind of like unfair"
1806700,1810140," game, but I'm going to disable all of the optimizations, right? So I'm going to tell the"
1810140,1817020," competitor it generate the most dumb assembly that you can generate, right? And let's write a similar"
1817020,1825740," program in C++, right? So we're going to use a vector, right? So we're going to allocate the vector"
1825740,1833020," on the stack. So this is going to be our stack. So what I'm going to do in here, I'm going to just do"
1833020,1839740," 15 million times. Does 15 million even fit into the integer? I think it does. I think there should be"
1839740,1848460," be fine. Right. So this is 15 million, right? So that I think in C++, oh, my C++ mode cannot support"
1848460,1854220," that. So I have to use a proper C++ mode, unfortunately, but it's extremely slow in my Emacs."
1854940,1863900," Anyway, so and in here, I'm going to do stack, push back, right? So I'm going to do 69 and then stack."
1863900,1870060," What the fuck was that? I think it was trying to out complete something, but then it just like turned"
1870060,1876060," into a horrible mess. Okay, so let's try to compile this entire thing. And I'm going to tell the compiler,"
1876060,1883660," oh, zero, you see, I'm disabling all of the possible optimizations, right? So it's not going to like do"
1883660,1889340," any trickery. It will generate like very dumb assembly, right? And we're going to do something"
1889340,1895820," like main, main CPP, right? And let's just try to compile this entire thing and see how much time"
1895820,1904220," it will take to push and pop from the stack using C++. It was less than a second. Less than a second"
1904220,1915820," with all the optimizations turned on. Really? It's like magnitude faster, magnitude faster. And I'm"
1915820,1921980," really not sure what Python is doing. So if we take a look with optimizations, right? If we crank up"
1921980,1926300," optimizations, I think it could be even faster. I think it would be even illuminated. I'm pretty sure"
1926300,1930940," the compiler just saw that I'm not even using the result for anything. And it's just like straight up,"
1930940,1936940," like stripped it off. But yeah, without optimizations, it has no rights to actually"
1936940,1942140," strip it off. So it was like less than a second, right? It's just like almost a second, but it's not"
1942140,1950140," six seconds. Come on. You can do so much within six seconds. It's insane. So I don't know. I don't"
1950140,1956940," like the conclusion to which we're coming so far. And the conclusion which we're coming so far is that"
1956940,1963260," it's the problem with the language, right? And it's just like, how can you optimize that?"
1963260,1971100," Right. So if we take a look, so this is the most basic operation and there's nothing to optimize in"
1971100,1982300," here. You're just pushing and popping. So I don't really like this conclusion. Though there's one thing,"
1982300,1992780," one last thing we can try to do. We can't fix the language, but we can try to change the implementation,"
1992780,1998380," if you know what I'm talking about. So here we get heard about PyPy. This is actually a very interesting"
1998380,2007180," thing. PyPy. Well, it's kind of advertised to be a Python implemented in Python. But it's not necessarily"
2007180,2014620," true Python. PyPy is implemented not in Python, but in something called RPython, which is a restricted"
2014620,2023500," subset of Python. It's so restricted that it's translatable to C, right? And that's why it's"
2023500,2029900," faster than the CPython implementation, because essentially it's implemented in C, but in the"
2029900,2035740," restricted Python that is translated to C. I looked briefly into this entire thing, so I might be wrong."
2035740,2045020," But it's claimed to be faster than Python and also it has a JIT compilation. And even Guidovan Rossum said"
2045020,2051180," that if you want your code to run faster, you should probably just use PyPy, right? So he said it"
2051180,2060860," himself, creator of Python. Excuse me. And maybe that's what we should try to do. So maybe we should just"
2060860,2067660," see if using PyPy instead of C Python would make it faster. So let's actually go ahead and download. So"
2067660,2074220," maybe we're going to take the third one. I can't right click because my Chromium is dumb. So I have to"
2074220,2080540," fix it yet again. Just a second. I'm sorry. All right. So I'm going to copy link address and I'm going to"
2080540,2088780," download this thing right inside of my port. And it's going to take some time apparently. Maybe I have a slow"
2088780,2098060," internet. Maybe the internet on the server is rather slow. Well, the last time I used PyPy, it was rather"
2098060,2107500," fast. So I don't know if it's still as fast as it used to be. We're about to find out. About to find out."
2107500,2115820," Okay. So let's unpack this thing. So it's just like a regular package. It has a bin folder. I can already"
2115820,2129020," see that. And yes, yes, yes, yes. Okay, cool. Looks good to me. So if I try to run this entire thing,"
2129020,2139580," so this is going to be PyPy. I cannot see shit in this mist. Bin PyPy. All right. So it even has like the,"
2139820,2149420," you know, the shell of Python. So everything looks okay so far. Now, what if we run the"
2149420,2162860," stack stress, stack stress using this thing? Well, it's actually faster than C++ without optimizations."
2162860,2167500," I'm not even fucking joking. C++ without optimizations."
2169420,2183260," Wait, what? Really? So what if we try to use PyPy for the porth? Can we do that?"
2183260,2193500," So PyPy bin PyPy. And I'm going to do porth. And let's actually try to run something that is not very"
2193500,2199340," heavy, but reasonably heavy. Rule 110. And let's see how much time it will take. So I didn't do"
2199340,2208140," that correctly. I should have put a simulation mode in here. It feels faster. It actually,"
2208140,2213820," so the startup is very slow. I presume this is because it maybe compiles something up front."
2213820,2221820," It's kind of similar to JVM to be fair, because JVM also has a very slow startup. But once it warms"
2221820,2229020," up, it can actually JIT compile like hotspots and it runs very, very fast. So maybe the same thing goes for"
2229020,2236140," PyPy. So the startup time of CPython seems to be really fast, but it runs slow, right? It's already"
2236140,2241820," started, but it, you know, you see it runs very slow. But for PyPy, it takes a little bit of time to"
2241820,2248780," start up, but then it actually goes very fast. So if we take a look at the timing, so yeah, it's one"
2248780,2254300," second. So it's actually more reasonable. Yeah. So and it doesn't complain. So it's completely"
2254300,2259100," compatible with our source code. It didn't support the typing. I was, I was actually afraid to use"
2259100,2264780," PyPy for ports because I was thinking maybe it doesn't support the typing and stuff like that."
2264780,2270700," Right. So where's the typing? It's all because we're using like optional typing to check things around."
2271420,2281100," So, okay, let's go ahead and try to use that thing for the Euler, right? Euler problem zero four. Is"
2281100,2286380," it going to be even like reasonably, is it going to be like one minute or how much time it will take?"
2286940,2293100," So it's already taken. Okay. So, I don't know. Maybe we'll have to cut the entire thing,"
2293100,2299260," but maybe we can wait a little bit because it actually speeds up dramatically. Also, maybe we should"
2299260,2304220," should be, we should probably disable the, you know, profiling and stuff like that."
2304220,2310140," Okay. Let's actually cut and wait until it actually finishes this entire thing."
2311660,2316860," All right. That was actually faster than expected 30 seconds, uh, 30, 36 seconds. It's actually,"
2316860,2324300," well, it's way better than 10 minutes. Uh, yeah, it's 20 times better than 10 minutes."
2324300,2331100," Yeah. It's, it's not bad. Um, so what if I disable the, uh, profiling and stuff like that?"
2331100,2336620," Let's actually try to remove the profiling, uh, simulate, and it's also going to be probably faster"
2336620,2344540," without the OPS. Uh, so let me straight up remove the profiling. Right. So, and to check things around,"
2344540,2349660," I'm going to use my pie because it will tell me what other things I have to remove from here. Uh,"
2349660,2359740," so porth, uh, to, to, to, to, uh, well, that's, that's rather slow maybe. Okay. Uh, so we need to remove"
2359740,2367340," that, uh, another one, um, okay. Count and also maybe I should have just commented that. Okay. So"
2367340,2373900," let's not remove this entire stuff because I think it might be actually useful in the future. So I have"
2373900,2379820," a tendency to implement useful stuff and then remove it and then regret it removing it. So let's actually"
2379820,2388060," get out of that habit. Uh, right. So I didn't think it's a very healthy habit. Uh, all right. So I"
2388060,2393420," disabled the, uh, profiling and let's see if it's going to speed up the entire thing. Um,"
2393420,2400940," so let's just wait a little bit. So it should be like half of a minute. So maybe I'm not going to even"
2400940,2411500," cut it. Um, because if it's less than minute, the simulation actually becomes feasible and maybe this"
2411500,2419100," is something, uh, 20 seconds. This is something that we can already kind of run on CI, which is not that"
2419100,2432220," bad. So maybe I should completely switch to PyPy. Because why not? So yeah, so it's pretty good."
2432220,2439020," So why do, why do we need CPython? Why people still use CPython? PyPy is actually way better. Uh, right."
2439020,2449500," So, and sometimes it's even faster than C++. So, all right. I guess from now on, I'm going to switch"
2449500,2454860," all of my development to PyPy. PyPy is actually a very interesting thing. It's highly compatible with,"
2454860,2463740," uh, with CPython. So it's even runs like a popular, um, libraries like Django, uh, and stuff like that."
2463740,2468700," So yeah, if you never heard about this thing, uh, give it a try. Apparently it's actually a pretty cool thing."
2469500,2475580," So maybe that's the future of Python. Maybe that's what everyone should use instead of CPython implementation."
2475580,2485660," You know, it's pretty cool. So I wonder like also it supports typing. Can it actually gather a useful"
2485660,2491980," information out of the typings and just like, yeah, maybe with the help of PyPy in the future,"
2491980,2498300," Python will become like a proper statically typed compiled language, uh, finally. Um, yeah, I don't know."
2499020,2504220," In any case, uh, from now on, I'm going to actually migrate all of my development environment in infrastructure to PyPy."
2504220,2510540," And, uh, we're probably going to run this entire thing on the CI in PyPy. Not, not like it matters,"
2510540,2517580," because we're going to rewrite the whole thing in port, uh, in the future anyway, but, uh, a little bit of a boost up in"
2517580,2523580," execution is going to help us to get that faster. And now I don't even, uh, have to remove the simulation"
2523580,2529340," mode anymore. Right. Because with PyPy, it's kind of feasible. It's still kind of sucks with 20 seconds,"
2529340,2535340," but it's not 10 minutes. And, uh, without OBS, it's probably going to run even faster. And on, uh,"
2535340,2540860," the Microsoft CI, it's probably even faster than that because their, uh, virtual services are faster than"
2540860,2547740," my laptop. So, yeah. Uh, so I hope today's session was interesting for you. It was definitely interesting"
2547740,2554220," for me. So I gained a couple of interesting insights. So thanks everyone for watching, uh,"
2554220,2560060," check stuff in the description. Uh, right. I put some links in here. I think I'm going to put the link"
2560060,2568860," to PyPy, uh, to the description as well. Uh, right. There we go. And, uh, I think I'm going to go,"
2568860,2574380," right. I think I'm going to go. Thanks everyone for watching. Uh, love you."
