start,end,text
1566800,1569360," I love seeing these sort of like small artifacts."
1571920,1578480," Anyways. So, yes, yes, yes, yes. So, let's actually go and try to rebuild it one more time."
1578480,1585200," Okay. So, what do we have? So, error. So, undeclared get time."
1585200,1596480," So, there's like two places. Right. Seconds, seconds since in it. Okay. So, error."
1597600,1606960," And declared us as RGB to linear. Hmm. Okay. So, this function does not actually exist anymore,"
1606960,1611360," which is rather interesting. So, let's go to the changelog."
1623600,1632640," It was not documented. It wasn't documented. And... So, I suppose maybe it's... Maybe it's some sort of,"
1632640,1642800," like, a very obscure thing that John didn't expect anybody would use, but I used it because I was,"
1642800,1647680," like, frantically gripping the entire modules and stuff like that and I just found exactly what I need."
1648240,1653760," Right. So, and it's not available anymore, apparently. It is not available anymore. I don't quite remember."
1653760,1661200," What was the sRGB to linear? Maybe there's some mentioning of this function with the modules."
1661200,1669680," Right. So, grab... Oh. Oh, yeah. This is needed for gamma correction. Yeah. It's some sort of a stuff for"
1669680,1678720," the gamma correction. SRGB to linear. Okay. So, yeah. This is a gamma correction stuff. This is a gamma"
1678720,1686720," correction. And it is available in sRGB, believe it or not. So, this is now a module. So, do you tell me..."
1686720,1695680," So, sRGB is a programming for HSL and stuff like that. So, must. Hmm. Oh, now it accepts, like, a one"
1695680,1703040," single thing. Right. But does it accept, like, a four vectors? sRGB... Yeah. So, there is a vector 3 and"
1703040,1709680," stuff like that. So, in a place where it fails, I need to find... So, this is the game and this is where it"
1709680,1718800," fails. We probably have to import sRGB. So, that's basically what we have to do, I'm sure. Right."
1718800,1725520," So, let's fucking go. Uh-huh. So, error. Procedure call did not match any of the possible... Ooh."
1725520,1732800," This is very cool. So, maybe this is what we have to do. All right. So, this is actually"
1734640,1739840," like a four-dimensional vector. But in sRGB, I only saw three-dimensional vectors. So,"
1739840,1745840," let me actually see. Is there any vector force? Yes, there are. Look at that. Okay. So,"
1745840,1751440," all of that is here. All of that is here. So, nothing... Nothing unfixable so far. So,"
1751440,1757680," far all the problems that we encounter, they are pretty much fixable. Context. Ooh. I remember..."
1758640,1766640," I remember something interesting about the context. So, the context type does not exist anymore."
1766640,1772960," It's context now. All right. So, is it still a pointer though? So, let's actually take a look at"
1772960,1780560," the changelog. So, context. So, change the context. Yeah, yeah, yeah. So, if you think I want to actually"
1780560,1789280," search for the context. Uh-huh. So, only use context. If you say context, I can context instead."
1789280,1794640," The compiler no longer creates a declaration called context in the global namespace. So, any use of this"
1794640,1800240," name by all promise will now cause and then declare the identifier error. Almost all the time, you should"
1800240,1807040," just be able to say hash context instead. If you can use context space in cases where you're storing"
1807040,1813200," information about allocators, loggers and the passing, blah, blah, blah. So, I suppose context by itself is"
1813200,1821440," just a very useful name that John didn't want to squat. Right. You know, Ray-san style. I'm joking."
1821440,1827600," Ray-leap is amazing library and it has a very specific goal in mind when it was designed. So, it's certainly"
1827600,1834000," fine, but I mean... Right. So, he didn't want to squat a very useful name because the context is a very useful"
1834000,1840240," useful name for game development and stuff like that. Context time. Yeah. So, and that's why it was"
1840240,1846960," renamed like that. So, I hope just by doing something like this, this is going to be enough. Right. So, that's"
1846960,1857040," a lot of errors. I'm not gonna lie. Okay. So, what do we have in here? Fatal error. Broken module. Found compilation."
1857040,1866480," Okay. So, that's pretty funny. Okay. So, it tried to actually compile wasm and stuff. Yeah. That's right."
1866480,1873040," So, this is basically what happened. This is basically what happened. It managed to generate bytecode. So,"
1873040,1880880," jaybreak wasm bytecode and then it tried to pass that bytecode to clang and it couldn't do that for whatever"
1880880,1886320," reason. Right. So, it couldn't simply do that. So, this is where it tried to do that and this is"
1886320,1893120," basically part of the first part of the build script. So, let me see. So, build wasm is called"
1893120,1902240," where? It is called somewhere here. Okay. So, you know what? I think I'm gonna command out wasm release."
1902240,1906560," Right. So, the wasm release is completely commented out. We're only building the simp version"
1907120,1913520," for release and debug. Right. So, the game goes in in two sort of versions. The simp one and the wasm one."
1913520,1917520," So, let's actually see if we can compile only only simp."
1917520,1928960," There you go. It's that fucking easy. So, now let's take a look. So, here is the... All right."
1928960,1935920," That's pretty cool. It actually still... Wasm is the module that we already have. Okay. So, let's actually"
1935920,1942160," take a look at the giant debug. It still works. It actually still works. The game still works."
1942160,1953360," So, it's a native version and everything. Right. So, it wasn't that hard to actually port it. Even though"
1953360,1964000," the language is actively changing all the time, I think John didn't break language that much. Right. So, he's really"
1964000,1969520," careful in how he deprecates things. He also documents a lot of majority of the things"
1969520,1975360," in a changelog. sRGB to linear was not documented. So, it was moved to a different module. Right. So,"
1975360,1980480," but I think that was not properly documented. Probably it's such an obscure and subtle case"
1980480,1985840," that he maybe forgot or maybe didn't think about that. So, again, you could just grab modules. Right. So,"
1985840,1994160," there was nothing impossible to actually fix so far, which is great. And it's a three years old code."
1994160,2001600," Three years old. Can you take like a three years old JavaScript code written in a modern at the time"
2001600,2007520," framework and run it after three years? Can you do that? I don't know. I'm not a web developer. You web"
2007520,2012320," developers can tell me. Can you do something like that? With the minimal changes because we didn't make"
2012320,2017760," that many changes. We can even quantify how many changes we made. So, okay, I commented out Wasm. We"
2017760,2022080," haven't finished with Wasm, by the way, but I think Wasm is going to be a little bit easier. So, here"
2023040,2032880," a couple of changes that we made. And by the way, it managed actually infer the type of this string literal"
2032880,2040160," purely from assignment. Who was saying no in the chat when I asked whether the Jai compiler can do that?"
2040160,2048240," Who was doubting the, you know, the love of John for Haskell? Who was saying that?"
2050960,2053600," Haskell can do that. Jai can do that."
2053600,2068560," Honestly, jokes aside, this is actually kind of based. So, how deep the analysis goes?"
2068560,2076320," Right. So, essentially, when it's analyzing, it probably says, okay, I expect this entire expression to be"
2076960,2086320," vector two. Right. And as we're analyzing and trying to infer this struct. Right. So, it actually goes up"
2086320,2094640," in an analysis and kind of infers that it's part of the expression that is expected to be"
2094640,2098240," vector two purely because of the assignment."
2100960,2103760," That is based. That's actually kind of difficult to pull off."
2103760,2111680," If you think about that. Because again, so like when you are down in the recursion, when you're analyzing"
2111680,2119440," and stuff like that. Right. So, when you're looking at this expression, you may not know locally in that"
2119440,2125200," place that you are part of the expression that is expected to be vector two. Right. So, that means you"
2125200,2130160," kind of need to store that information locally available at that specific point of the recursion."
2130160,2132160," So,"
2132160,2138240," Okay. So, maybe there is another thing is involved in here because"
2138240,2147040," besides of expected type, you kind of know from the shape of the literal that it is a structure"
2147040,2153760," with two floats. Right. With two floats. So, you can kind of have additional information without"
2153760,2159200," knowing that the whole expression is expected to be vector two. So, yeah, it looks at the left part of"
2159200,2164320," the assignment. So, the type checker clearly has access to the overall assignment when it analyzes the"
2164320,2170400," right side of it. Yeah. This is cool. That's what I'm saying. This is cool. Really impressive job."
2170400,2174000," Right. Because I developed languages like it's kind of hard to pull off. It's not impossible,"
2174000,2179600," but it's just like kind of annoying. Right. So, good. Really cool job."
2179600,2186240," If this language is changing this much, did you bind Jive with Raylib or something?"
2186240,2191760," It actually comes with its own Raylib. So, it's called simp because it's simple."
2194640,2202080," I really like how childish the names of the modules are. So, things like simp. I think he named this"
2202080,2208480," library at the time when there was a, you know, a lot of noise, a lot of drama around Twitch banning"
2208480,2214160," the word simp. Right. So, he said, ""Fuck you, Twitch. You can't dictate me what to say. I'm going to call"
2214160,2221040," my library simp."" So, yeah. And also, there is a thing, ""GetRacked"". Right. It's also part of the..."
2221040,2228320," It's basically I'm GUI. Right. So, it's Jive's I'm GUI. Oh, Sloppy Math. Right. Sloppy Math. My favorite."
2228320,2235920," I absolutely love the standard library. There's so many funny names in here. It's just..."
2235920,2244720," So good. So good. It's so much worth being in Jive beta. It's freaking insane."
2247680,2254880," GetRacked. Oh, GetRacked left-handed. So, it's like for left-handed people, I suppose. All right."
2254880,2256960," It's pretty cool."
2256960,2263200," So, it's for people who actually hold the mouse in the left-hand. Do left-handed people actually use"
2263200,2268640," the left-hand for the mouse? I think. I think it makes sense. Yeah. So, it means you actually swap the"
2270000,2275760," buttons as well and stuff like that. Telemetry. I think telemetry is the profiler."
2275760,2278800," Telemetry. Where is the telemetry?"
2278800,2289600," I can't find that. Oh, telemetry 3. Yeah. So, it's a profiler as far as I know. It's not what you think it is."
2289600,2304320," Telemetry bindings. No. Yeah. So, I think it's this one. Rad Game Tools."
2304320,2312000," Is there like a bigger screenshot? Yeah. It's this one. John actually used this thing on his streams."
2313600,2318080," So, I think it's like a paid, really hardcore tool for optimizing applications."
2318080,2325760," The backdoor module. I don't know. Let's actually find out."
2325760,2326880," grep."
2326880,2331280," Backdoor. And let's actually do like a case-insensitive thing."
2331280,2340800," So, yeah. As you can see. Jai is safe. Not a single backdoor has been found."
2342720,2349920," Has anyone tried to download the Linux, you know, source code and just grab backdoor in there?"
2349920,2359120," Has anyone checked, anybody checked like Linux for backdoors?"
2359120,2368000," That's a really interesting question. Man, Linux is huge. Oh, it's already, it's already downloaded."
2369440,2374960," Uh. This is, this is source code."
2374960,2383920," How freaking huge Linux source code is? What the fuck?"
2383920,2387520," One gigabyte? I actually doubt that."
2387520,2397600," Looks like blow to me. It doesn't even show. When it sent me, it didn't tell me the sizes. So, the browser"
2397600,2403600," doesn't know the full size of Linux kernel. Is that the whole, is that the whole git repo?"
2403600,2410560," Uh, maybe not. Okay. So, 234 megabytes. So, that's how huge Linux kernel is. Okay."
2411280,2420640," So, let's actually go. Can I unpack this? Should have actually redirected that to stdout, I think."
2420640,2426240," Because it's going to take some time purely because of the output. Because there's too many files in here."
2426240,2434240," Right. So, one of the things you want to do, oh, now it's deleting recursively, um, is that you probably want to"
2434240,2442720," redirect that. So, tar fvx and, like, redirect to def null. Uh, hopefully that will take a little bit less time."
2442720,2444960," Uh-huh."
2444960,2452720," So, are you familiar with cock typing? Yes, I'm doing it right now. Okay. Do you see my keyboard right now?"
2454080,2456320," Why do you think I don't show my keyboard in the stream?"
2456320,2462720," Stop asking silly questions, please. Uh, so, anyway."
2462720,2472400," Okay. So, here's the Linux. And what we can do is a grep ir backdoor."
2479440,2482720," Look how many backdoors there are in Linux. Like, holy f***ing..."
2482720,2495600," How much proof do you need? How much more f***ing proof do you need that"
2495600,2501840," Linux is a CIA project? Look how many backdoors they have. Right, so..."
2503120,2509520," So, register backdoor dbIw data. Uh, so, this is, like, all of the backdoors."
2509520,2514000," Especially in the real tech drivers and stuff. Look at that s***."
2514000,2518400," That's why I don't use Linux. Right, f*** that CIA project."
2518400,2527040," So, yeah. Jai, on the other hand, Jai, on the other hand, doesn't have any backdoors."
2527040,2528720," Right. Look, look."
2530320,2536480," Do you see any back... Not a single backdoor. Jai is more safe than Linux."
2536480,2541200," So, what do I use? Um..."
2541200,2547280," Oh, listen, talk about..."
2547280,2558960," Uh, now, so, let's actually continue. Uh, so, it's sorting, uh, Jai break. Jai break."
2560080,2561840," Uh, alrighty..."
2561840,2571040," So, we also have a Jai release. Okay, so, pretty cool. I really like this tutorial."
2571040,2575760," I really like this tutorial. It's actually super subtle and it looks super simple, but it very"
2575760,2581520," quickly and subtly teaches you how to play this game. Uh, yeah, really like that."
2583040,2589440," And the game actually loops on the, onto itself. When you finish all of the, uh, all of the bars,"
2589440,2594240," it then plays a pretty cool animation, in my opinion, that actually restores the state of the game and lets you"
2594240,2599760," continue playing the game. Um, all right. So, you know what I'm gonna do? Uh, you know what I'm gonna do?"
2599760,2610400," I'm going to update the whole thing. So, now, if I do opt Jai being Jai Linux. So, this is the version."
2610400,2620480," So, this is expected version. Uh, right. And let's do a committee committee and potentially pushy-pushy as usual, as usual."
2622480,2631360," All right. So, upgrade the native version to, uh, Jai, uh, what was the two?"
2631360,2639920," Zero, zero, something, something, to beta, uh, this one. There we go. And I'm gonna push that"
2639920,2644640," right into the repo. If you haven't access to Jai compiler, you should be able to compile the native"
2644640,2650720," version already with the native compiler. So, I just patch up all the places, uh, and stuff like that."
2650720,2656720," So, now, we recovered the source code. We recovered the project at the beginning of the stream. Uh, we"
2656720,2663360," basically had a source code in a language that doesn't exist anymore. Right. But now, we saved the"
2663360,2670960," day. We saved the situation. We recovered everything. When Jai, I don't know. Right. Guys, I'm waiting"
2670960,2677440," for Jai to be public as much as you do, even though I'm in Jai beta. Because, here's the thing, because of the"
2677440,2683520," specifics of my work, I like to share my source code. And I want to make sure that the source code I write"
2683520,2689200," is usable by everybody who's watching me. In case of the Jai, it is impossible. If you're not in Jai"
2689200,2693520," beta, you can't compile my source code, which renders my source code kind of usable for the majority of my"
2693520,2698480," audience. It is annoying. Right. That's why I rarely program in this language. And it's just like,"
2700080,2705920," It is really, really annoying. Like, I'm sorry. I don't know. Maybe at some point, people say there are"
2705920,2713360," some rumors that, uh, John is actively working on getting Jai out. So, he's really committed to that."
2713360,2720400," So, that means maybe in 2025? We don't know. Uh, it's a good language. Right. So,"
2720400,2729680," Ship the LLBM AR. Not a bad idea, honestly. Not a bad idea. I'm already shipping the WASM. Right. So,"
2729680,2734880," that means you can kind of play it. But on top of just being able to play with the executable,"
2734880,2741120," uh, I'm, I'm a programming channel. So, that means all of my audience is programming. Right. And, uh,"
2741120,2745920," because of that, uh, I want people to modify the thing. Right. So, I want people to modify"
2745920,2752000," and, uh, play with it and stuff like that. So, it is what it is. Right. So, I'm sorry. I'm sorry."
2752000,2761040," So, maybe you can modify LLBM AR. Right. Are you that hardcore? Are you that hardcore?"
2765600,2772560," So, one hour in and we're done with this. Can your, the foundation do that? Exactly. The foundation."
2772560,2778000," So, well, I mean, we didn't finish, honestly. Right. So, because now we need to do the WASM support."
2778000,2783760," And WASM support is going to require a little bit more work because here we're doing some unhinged"
2783760,2790960," sheds. Honestly, we're doing some very much unhinged sheds. Uh, so, built WASM platform is only"
2790960,2798240," support on Linux right now. Yeah. Because we were calling like an external, um, clang. Right. So,"
2798240,2809760," and on top of that, we, I think we had, uh, I think we were running WASM 64 to 32. 64 to 32. Oh yeah. It's,"
2809760,2817200," it's in third parties. It's in third parties. And I literally actually have an executable in here."
2818160,2824400," Right. So, the source code of this executable is available at HTTPS. So, the reason why I provided"
2824400,2832000," it in here, so you can just download the thing and build it without building this separate tool."
2832000,2839200," And also, I had to go extra mile and make the executable static. So, it is static, which means"
2839200,2849120," that theoretically it just works on any distro. It works. I built that executable on Debian three years ago."
2849920,2856160," Now, I am on... I forgot about this shit again. This is void. Right. So,"
2856160,2865200," So, I'm on void. So, do I have like any other fetch? Uh, so, I think I need to maybe install some other fetch."
2865200,2874560," Uh, just a second, guys. Uh, xvps query. Uh, so, what other things we have? Uh, I think it's rs and fetch."
2875360,2882720," So, ufetch. Oh, I have ufetch, apparently. Okay. So, we can try to use ufetch. Uh, ufetch. Yeah,"
2882720,2888160," there we go. So, I'm... Today, I'm on void. And, uh, that executable still works."
2890000,2895840," I haven't made any modifications to that executable. Uh, right. Didn't do anything. Just compiled it"
2895840,2901920," statically. Three years. Completely different distro. Still works."
2901920,2912160," Who needs docker? Fucking swift can't work without a docker container. Like, I... Honestly, I feel like"
2912160,2917760," I'm going absolutely insane. It is so obvious for me the benefits of static executables"
2918560,2926000," that I just don't understand. Look. Look. This is like a concrete example. Concrete fucking example."
2926000,2935680," Absolutely different distro. Three years ago. Static executable. Still works. No docker. No"
2935680,2941680," virtualization. Just a static executable. Very useful code. Still works throughout the years"
2941680,2948880," in a different environment. Am I insane? Like, why are people upset with, like, obsessed with, like,"
2948880,2951360," dynamic libraries, virtualization, virtual machine dockers and..."
2951360,2960800," What is going on? Am I... Like, am I the only one who's just, like... You provide them concrete evidence"
2960800,2967280," of the benefit of this thing. They complete... In complete fucking denial. And still obsessed with their stupid dockers."
2970080,2973520," I feel like I'm going insane. So..."
2973520,2977520," Um..."
2977520,2982560," Anyways, I'm sorry."
2982560,2987040," Um... They like ships. Yeah."
2987040,2992960," It's actually surprising this chat still works. Yeah. So I still can use it. It's kind of a little bit"
2992960,3000880," outdated because recently into, uh, wasm 64 to 32, uh, we made a little bit of changes. We added more"
3000880,3008320," instructions, right? So... Ooh. People just made pull requests. Oh, okay. So let's actually take a look at that."
3011520,3024560," So..."
3024560,3031600," And..."
3035280,3035840," Oh, okay."
3035840,3035840," Oh, okay."
3035840,3045200," I said... Okay. They are named in a similar fashion, right? So..."
3045200,3050160," I guess I supposed to ignore this one, right?"
3058720,3062240," Let me know that I have to ignore this pull. Okay."
3062240,3069760," That is funny. And so we haven't updated the base of this utility for, for quite some time, right?"
3069760,3075600," So we haven't updated the base. Um, so I think what we need to do, uh, at some point just, like,"
3075600,3080400," fetch the latest changes and just, like, put the changes on top of the latest changes and wipe it."
3080400,3084480," Uh, I'll try to do that a little bit later, but yeah. So for now, what I'm going to do, I'm going to just"
3084480,3090560," download these latest changes and, uh, simply, uh, simply test if they work on the machine, right?"
3090560,3095680," So I just want to quickly... Because I want you to download and build the latest wasm64-32 anyway."
3095680,3102240," Uh, so might as well do that. Uh, so might as well do that. So this is studying. So do we have wasm64-32?"
3102240,3106800," I think I don't. Okay. So git clone. Uh, git clone. Let's fucking go."
3106800,3110080," Uh, okay, good."
3114480,3122640," Uh, so if I remember correctly. So it uses CMake. Uh, let's try to build it. CMake. I remember"
3122640,3128240," so that they have to build it with specific... Yeah, so there's only, like, a static flag and whatnot,"
3128240,3135200," right? So let's do the static thingy-ma-jingy. Uh-huh. So, yeah, there we go. So any changes?"
3136320,3147280," Ah, so can't find third-party g-test. Um, I forgot to clone it recursively. I'm getting"
3147280,3154800," really weird vibes that I feel like I already experienced before. Uh, so I need to clone recursively."
3157120,3163680," Oh no. It's... It's the foundation all over again. It's the fucking foundation."
3163680,3167440," Please no. Please no."
3167440,3177200," Um, deja vu. Yeah, I'm having a deja vu. They found you. They are foundation after all,"
3177200,3186640," because they always find you. Anyway, so, um, let's fucking go. So this is the build and, uh,"
3186640,3192960," I need to do CMake. Yeah, let's go. So there's a bunch of warnings and stuff like that."
3192960,3199920," Look at that. It needs a locker. Why the fuck does it even check for these, like, things? I mean,"
3199920,3204960," you are in POSIX. It should be available. But anyway, so let's go ahead and try to build the whole thing."
3206000,3210320," So honestly, I don't think we need to build everything, the entirety of the Bobbit. Uh,"
3210320,3216000," so we only need to need to build WASM64-32. But I mean, I'm on a good machine, so we can just build it"
3216000,3228080," super quick. Um, pretty rare to hear someone pronounce deja vu, uh, correctly online. Uh, this is how we"
3228080,3234000," pronounce it in Russia, though. So in Russian language, you also have the word deja vu, uh, and I just"
3234000,3240800," pronounce it in the way we pronounce it in Russian. Um, so. Do, do English speakers pronounce"
3240800,3253040," deja vu incorrectly? Right, so, I don't know. So, uh, I guess it would be better to disable tests because"
3253040,3261520," there's... I have no idea what the fuck is going on and why it just doesn't build the thing"
3261520,3273200," to 32. Like, wait, what? Ah, okay. Well, I mean, it built successfully WASM64-32, right? So,"
3273200,3280000," ah, this is probably because of the... I said to do static, but there's something wrong with"
3280000,3288400," the static when you do with leap tests and stuff like that. Um, English people say ""de-ja-vu""."
3291120,3295920," Okay, in Russia we call it ""de-ja-vu""."
3295920,3301120," So, to be fair, I think ""de-ja-vu"" is just, like, pretty much an"
3301120,3311920," international word at this point, right? So, like, it probably exists in any language."
3311920,3323040," It's like, you know, Russians also have their words in every language, like ""vatka"", right? So, or something like that."
