start,end,text
1404360,1410520," first weights matrix. Uh, right. And let's try to recompile this entire thing and see how it's going to go."
1410520,1417800," So it complains about some stuff. Uh, so wh, uh, too many arguments provided. What?"
1419320,1428040," Um, this is a very useless. Too many arguments provided to function. Oh, okay. I see. Uh,"
1428040,1435480," I see. I see. So the count is supposed to be this one. Uh, I think I've fucked up the argument. So"
1435480,1447240," orientation, rectangle, count, and gap. Uh, right. So I'm confused. This is probably okay. I think I know"
1447240,1456440," what the hell is going on. That's kind of dumb. Uh, if that's the reason, that's kind of sad. Uh,"
1456440,1462200," this is because I actually wrap the arguments with parentheses. Maybe this is something that I should not"
1462200,1469800," do, but I do that just in case, but since you can't really pass commas in here. Yeah. So I think"
1469800,1475880," wrapping that in parentheses is not particularly great idea. So, uh, I was just doing that just in case,"
1475880,1482280," just to be safe. But apparently, yeah, you can't really pass easily a comma into a macro anyway,"
1482280,1489800," because comma is used as a separation of arguments for the macro. So you're not gonna just pass extra stuff"
1489800,1495720," in here. I think that makes sense, actually. I think that makes sense. Uh, int parameter. Right. So this one"
1495720,1502840," goes like this. Right. C macro, basically. C macro. Okay. So as you can see, it actually, uh, allocated a"
1502840,1506680," little bit of space on the right. Right. It allocated a little bit of space on the right. And to demonstrate"
1506680,1513560," that we can actually use that space, I can do something like draw, uh, draw a rectangle. Right."
1514840,1523400," Rectangle. So R, uh, X, R, Y, uh, R, W, R, H. And this is red. Right. So, and we'll try to run this"
1523400,1531800," entirely. So, yeah, as you can see, we basically have two sides in here. Right. So we have two sides in"
1531800,1538760," here. That's pretty boggars. Okay. That's pretty cool. Uh, so how are we gonna be rendering it? So what I'm"
1538760,1545560," thinking is that we can just basically split the whole rectangle into like cells, uh, and the,"
1545560,1550920," the resolution of the cells is going to be the size of the matrix and just like render them with the"
1550920,1555880," rectangles. So that's the first approximation that we want to go with. Right. And because of that,"
1555880,1564440," I'm going to just do simply like size T, uh, right. So, and, uh, we're going to be iterating rows. Right."
1564440,1575000," So this is going to be basically rows, uh, right. For, uh, size T, J, zero J, um, calls, plus, plus J,"
1575000,1584440," plus, plus J. And I'm going to take a matrix at, uh, I, J. Right. And this is the value that I have to visualize."
1585240,1593000," Uh, right. So the value we need to transform that value into a color. Right. So, and how do we do"
1593000,1600360," that? Uh, if I remember correctly in the original visualization, right. So Jim, uh, render and then,"
1600360,1606360," right. So if we take a look at Jim, render and then, so we have two colors, like a low color and high"
1606360,1613080," color. So I think we can, uh, basically copy paste this entire thing. Uh, right. And how do we do all of that?"
1613960,1622200," How do we do all of that? I suppose. So we basically blend them together. Uh, right. We blend them"
1622200,1634280," together. So the low color, but where is the alpha? I don't see the alpha actually. Oh, okay. So we set,"
1634280,1643640," all right. I see. So this is the value of the matrix. We shove it into a segmoid. Right. So, and the segmoid is"
1643640,1649400," actually very interesting because it's a function from zero to one. Right. And the more negative you"
1649400,1656360," function, the, uh, more, the closer it is to zero and the more positive it is, the more it's closer to"
1656360,1661960," one. So it maps the range from minus infinity to plus infinity to the small range, uh, from zero to one."
1661960,1667080," And this is what we're using here. So here we basically transform it to zero one and we use that thing"
1667560,1675240," for the alpha. Right. For the alpha. And we simply blend the colors according to that specific alpha."
1675240,1680840," So that's very dumb way to do that. Uh, but that's how we do that. I'm not sure if it's a good way to do"
1680840,1687400," that either. Right. So, uh, right. So let me quickly do that. So this is more of an alpha,"
1687400,1693320," right? So, and essentially we'll probably want to do that in here. Right. So we probably want to do that"
1693320,1700600," in here. And I'm going to shove it like that. So this is the alpha. So then we set that specific alpha"
1700600,1708760," to the high color. So we set it to high color. And, uh, then essentially we just blend together"
1708760,1716360," two colors, low and high color, and we get the color of the thing. So what we have to do now,"
1716360,1720840," we have to just render the rectangle, right? We have to just render the rectangle. So let's go ahead and do"
1720840,1727320," that. Uh, right. So we need to do draw rect. So, but the position of the rectangle is going to very much"
1727320,1735080," depend on i and j. So, and to do that properly, we need to know the width and height of the cells of i"
1735080,1740840," and j. Right. So that's what we need to do. So essentially what we need to do, we need to take"
1740840,1748440," the width of the rectangle within which we're trying to fit, uh, this entire stuff. And we need to divide"
1748440,1754120," it by the columns of the matrix and we get the cell width, right? So we can even do something like float,"
1754120,1764120," a float cell width and the cell height is going to be correspondingly, uh, h divided by rows. There we go."
1764120,1774520," So h divided by rows. So in here, what we can do, uh, right? So i is actually y and j is actually x because"
1774520,1780520," rows, right? So rows go like that. So that means it is y. So I think it would make sense for me to call this"
1780520,1788360," thing y, right? And columns are this thing. So that means it's x, right? So this is basically x. And we"
1788360,1794840," address the matrix y, x. That's how we do that. So that means now, uh, what I have to do. So x is going"
1794840,1802440," to be x multiplied by cell width, right? Uh, y is going to be, uh, y multiplied by cell height, right? And width and"
1802440,1809080," height of the cell is cell width, uh, and cell height. And what's the color? We already, uh, computed the"
1809080,1816520," color so we can, uh, shove the color in here like this. Uh, and that's basically right. So we split the"
1816520,1822600," whole rectangle into the cells elements of the matrix and we just like render them with their corresponding"
1822600,1827080," color, right? So this is just one single matrix. So let's take a look at how it's going to look like."
1827080,1833800," So this is not really a value. This is more of an alpha. And I wonder if we can just like compress"
1833800,1841240," all of that stuff to this, right? So why not? Why not just compressing that thing to a single stuff?"
1841240,1847160," Uh, I don't see any reason not to do that. There we go. So, and that is very weird because"
1847160,1853480," why did it render in the first slot and not in the second one? So that's a very interesting question."
1853480,1861960," Uh, all right. So because we've got this thing and it would, oh, I know why. I know why. Because"
1861960,1868040," we don't take into account the x and y of the rectangle. We only take into account the width and height."
1868680,1876360," So I forgot to do the following thing. Rx plus, uh, right. And ry plus, right? So that's basically"
1876360,1882440," what we have to do in here. Uh, it's not kind of particularly visible what is going on in here."
1882440,1887480," So maybe I'm going to do the following thing. So width and height and the color. Uh, right. So there"
1887480,1896280," we go. We can finally see this kind of stuff. Uh, and, uh, yes. So there we go. So this is basically"
1896280,1903800," representation, uh, of this entire thing. Right. So this is a representation of this specific layer"
1903800,1910840," of connection. So three, uh, two by three. So three and another three. So, and these are basically the"
1910840,1916680," connections. So this row of connection is this connection. So you can literally see by the colors."
1916680,1922760," And this row of connection is these connections. Right. So that's basically what's going on in here."
1922760,1929800," Basically. Uh, all right. So that's kind of interesting. I wonder if we can"
1929800,1938520," actually do an interesting thing. Uh, right. So this is a very dumb, you know, implementation of this"
1938520,1944120," entire thing. It's kind of stretchy and that's totally fine. We are experimenting. We are trying to see"
1944120,1949960," like what would be the best visualization. Right. So it's kind of difficult to, I would even claim that"
1949960,1956280," it is impossible to just come up with absolutely awesome visualization from scratch in your head,"
1956280,1963480," sit down and call it in one try. Right. So for, at least for me, for me, very dumb developer who"
1963480,1970040," doesn't kind of do shit. It's very important to just try something dumb and see what works and just work out"
1970040,1974920," starting from there. Maybe some of you geniuses can do that in first try in their head. I can't do that."
1974920,1978200," I really apologize for that. Uh, so"
1980360,1991320," All right. So what I'm thinking is that what if, um, we create something like, uh, Jim render. Um,"
1991320,1999080," I want to call it NN, but NN is already taken. Right. So, uh, we need to come up with the name"
2000600,2008440," for this kind of visualization. Right. For, for the name of this kind of visualization. So it's sort of"
2008440,2017320," like, um, you have these layers that you stack on top. Right. Maybe it's a cake. I mean, it's a cake"
2017320,2025720," visualization. Uh, we can do something like, all right, Jim render. And then as cake, I think that's,"
2025720,2029560," that's a good name for this entire thing. So we're going to accept the rectangle within which we're"
2029560,2034680," rendering all that. And we're going to accept the, the neural network. Right. So we're rendering the"
2034680,2041320," neural network as a cake. Right. So, and what's interesting is that since I want to just stack"
2041320,2047240," those things on top, uh, I can just use the layouting system. Who said I can't do that? Why? I can do"
2047240,2055800," something like gym, uh, render actually layout begin. Right. This is the layout begin. Uh, and what I have"
2055800,2060120," to add, I'm going to, we're going to be static, stacking them on top. That means it's going to be"
2060120,2065480," vertical thing. Right. So we're going to use vert, uh, as the slot, we're going to use the R that we've"
2065480,2072360," provided in here. And how many elements we're going to have in here? Basically as many, uh, as many as we"
2072360,2078520," have, uh, uh, like weights, right. And how many, uh, we have weights. I think we have just NM count, but I"
2078520,2090680," don't quite remember. Uh, right. Okay. So count is the amount of weights, right? So, uh, the amount of, uh,"
2090680,2099160," we guess, and BS, uh, matrices. Right. So this is basically what it is. So that's basically how many things we're"
2099160,2104440," going to have in here. And then I'm going to do gym layout end, uh, and, uh, and essentially what we're"
2104440,2113720," going to do, we're going to iterate, uh, right. All of the rows, size T I, uh, right. So, and then rows"
2113720,2125240," plus plus I. And, uh, so what we're going to do gym, um, render weights, right. Gym render weights."
2126120,2133400," So, and here we're going to use the slots, right. So this is going to be gym, uh, layout slot, uh,"
2133400,2142040," and N, uh, W S I, and that's it. Right. So that should do all of that scheisse automatically. So that"
2142040,2146360," didn't work because we also have to provide the gaps, which could be useful for this specific thing."
2146360,2153560," It could be useful for the cake. Uh, right. So, and then, uh, count. Yeah, that's right. So this is NM count."
2153560,2157720," And let's take a look at the visualization of this entire thing. And it didn't work because we never"
2157720,2162520," called this function, right. We never called this function. So here, what we have to do,"
2162520,2169400," we have to do gym render, uh, and then as cake, right. So, and, uh, what do we accept in here?"
2169400,2176200," So first is the slot, right. So first is the slot and then the neural network."
2176200,2185560," Okay. And that's the cake. So the problem with this cake is that like, it's not clear"
2185560,2193320," where things end and start. And this is why we introduced the notion of a gap. We can introduce a"
2193320,2198840," little bit, a little bit of a gap between those things, right? For example, like 10 pixels maybe,"
2198840,2207160," right? Let's actually put 10 pixels in here. Uh, yep. And that is basically it. So there is a, yeah,"
2207160,2214040," there is a three mattresses in here, which is probably interesting, right? So yeah, that's, that's good."
2215000,2221080," Uh, maybe we can even, uh, make it more, uh, gappy, if you know what I mean. Is that even a word in"
2221080,2226760," English? I don't speak English. It's, it's, it's a gap. Uh, that's pretty cool, right? Isn't it?"
2226760,2233080," So there is a little bit of a gap in here within a single layer of the cake. And we had a similar"
2233080,2239400," problem when we were developing a layout and this is because of how we around the elements, right? So this"
2239400,2244040," is because how we're around the elements. So to fix this problem, we have to do seal, right? So we're"
2244040,2253160," going to do a seal. Uh, and so this is a, yeah, so I think doing a seal is actually valuable in here,"
2253160,2258840," right? So now they're not going to have these sort of like gaps that are not supposed to be there."
2258840,2266120," Uh, yep. There we go. So this is this three layer cake, three layer cake. So this is for the,"
2266120,2272760," uh, for the first sort of layer. This is for this layer and this is for this layer. So this is like a first"
2272760,2278840," approximation of how we can visualize all of that. Of course, it would be kind of cool if they were"
2278840,2284680," proportional to their actual actual size, because for instance, here is you have three columns."
2284680,2291720," This is three columns, but here you have four of them, right? So, and I suppose the upper one has to"
2291720,2300040," be smaller than the bottom one. That would make sense, right? And, uh, yeah, this one has even like two"
2300040,2305160," columns. This one should be even smaller than this one. So all of that is kind of disproportional,"
2305160,2310760," but it works. It kind of works. Uh, right. And we can add more layers in here. What if the one of the"
2310760,2319880," layers was like 10, uh, right? So, and I think it would be visible on the visualization, right? So yeah, so that"
2319880,2326920," resulted in this thing having 10 columns, right? And what if we have a lot of layers, uh, like deep neural"
2326920,2337640," network like this, right? Uh, we'll be able to see anything at all. Um, there we go. So here, this is"
2337640,2346040," unreadable mass, but this one already kind of makes sense, right? So yeah, so this one can be actually read"
2346040,2355800," somehow, somehow, right? So, and each pixel pixel, right? So each pixel is basically one single"
2355800,2363800," connection that you're incapable of even seeing in here, right? So it would be kind of cool to, uh, so"
2363800,2368920," of course this is not a final visualization. This is a rough approximation, right? I would like to actually"
2368920,2374280," work a little bit more on this entire thing. And as already said, just adjust different sizes,"
2374280,2380520," make them different sizes. So it's instantly visible which layer is bigger, which layer is smaller,"
2380520,2385400," because it's quite, quite important. It's important to see this sort of architecture, right? But I already"
2385400,2392120," want to see, uh, I already want to battle test it and see how it highlights and dims up as you training"
2392120,2401240," this entire thing, right? So to do that, uh, I think I want to move this entire stuff inside of the"
2401240,2405160," framework, right? We're going to move it inside of the framework and we're going to modify one of the"
2405160,2412600," existing, uh, demos to actually use this visualization instead of the previous one, right? Uh, so let me,"
2412600,2421160," let me see. Okay, cool. I'm going to go to, uh, nn.h, right? So, uh, and then, um, I think it was something"
2421160,2426920," like Jim Aranda and then, yeah, there we go. So this is basically where we're going to have, uh,"
2426920,2433240," all of these things and we're slowly just like moving all of that stuff in there. So I would like"
2433240,2443800," to maybe call this and I think, um, something like cake layer. Is that a good name? Right. So weights,"
2443800,2451160," uh, cake layer, right? So render and then as cake and you render a single, uh, cake layer."
2451160,2458280," Maybe it should be actually called something, uh, something differently, right? So render"
2459000,2464280," matte because we're accepting matrix in here, uh, and like render matte, uh,"
2464280,2469160," as"
2469160,2479400," cake as well. Why not? Why not? That's a good name. So render matte as cake."
2482920,2490120," So, and let's move that stuff into the declarations, right? So here we're going to have declaration and"
2490120,2495960," somewhere down below where we have implementation, we're going to move the implementation. So here is"
2495960,2503640," the entire implementation. It moves, uh, here, right? So let's go back to the declarations and in the"
2503640,2511560," declarations, we're going to have, uh, and then as cake, right? And, uh, in the implementations down there,"
2512200,2518760," we're going to copy paste that entire implementation. Uh, all right. So it's inside"
2518760,2523400," of the framework. So I'm going to try to rebuild simple, right? So I'm going to be rebuilding simple."
2523400,2529640," Uh, and it seems to be working, right? So that's pretty cool. So let's go to ZOR, right? So let's"
2529640,2537560," take a look at the ZOR example. So here we have the layout, right? So here we have a plot and here we"
2537560,2542920," render the neural network, right? So one of the things we can do now, we can start another layout."
2542920,2548200," Uh, so which is going to be vertical this time, right? So this is the vertical. Uh, we're going to be using"
2548200,2552760," the slot, uh, the current slot. How many elements we're going to have in here? We're going to have two"
2552760,2562040," without any gaps, right? So, and one, two, three, four, gym layout end, right? So we rendered the neural"
2562040,2569640," network in a classical sense, and then we try to render and then as, uh, as cake, right? And for some"
2569640,2579640," reason, I did a very stupid mistake, man. Uh, right. Yeah. So render and then accepts and then first and"
2579640,2586520," then rectangle, but here it's the other way around because I'm a dummy dum-dum. Consistency. The"
2586520,2593320," consistency of this API is top notch. Holy shit. I think we need to fix that. I think it needs to be"
2593320,2599800," consistent. We like nowhere in here. We really pass the slot within which you have to render as the"
2599800,2607080," first element. I don't think it makes sense. I didn't think it actually makes sense. So let's actually"
2607080,2615240," quickly fix that. Uh, right. So let's put this stuff in here. Uh, let's put this stuff in here, right?"
2615240,2623000," Okay. Okay. Okay. Okay. Okay. I'm sorry. Uh, so in here we have to do a similar thing."
2623720,2628280," Though I could have just like let the compiler do the work, right? Because we're not programming"
2628280,2635640," in a toy scripting language with dynamic system, uh, where you can't modify shit without unit tests."
2635640,2640440," Here we are programming in the chat statically typed language. And if you modify something,"
2640440,2648760," the compiler is going to be, bro, you need to fix that place. There you go. I helped you, right? So"
2649400,2656840," it's a bro statically typed programming language, not some toy dynamic thing. That's whining all the time"
2656840,2659640," that you need to unit tests to modify anything."
2665800,2672280," there are some, uh, useful things with dynamic languages as well. I'm just joking. Of course. I'm just joking."
2672280,2679320," Of course. Kappa. So, uh, let's actually go through the compilation errors. Uh, so what do we have in here?"
2679320,2685960," So it complains about, yeah, yeah. So now we have to modify all of these places, right? So in the places"
2685960,2695720," where we actually call all of that stuff. So, and also we have to modify that in here, right? Do we have"
2695720,2702760," to modify anything else? Uh, okay. That's pretty poggers. Okay. So let's go here and I'm going to be"
2703720,2706840," uh, working only with Zor. Let's try to compile Zor."
2706840,2713400," So it's taking some time to come. Yeah, there we go. Doesn't it look cool?"
2713400,2723240," That looks cool. This is quite shit. Holy fuck. But I mean, we're going to fix that. So right now,"
2723240,2731640," what I want to see is how those things highlight. It's not that. There we go. So when we can literally see,"
2731640,2737640," I would like to actually, yeah. So there is a obvious problem in here is that when they become"
2737640,2745560," the same color, it's kind of difficult to see that these things are separate, uh, cells, right? Let's"
2745560,2752840," try to fix that. And we have a tool for that in our layouting system. We implemented gaps, right? We"
2752840,2760840," implemented gaps, uh, especially when we are rendering this entire thing as a kick, right? So, oh, this one"
2760840,2768840," is interesting. We're not using layouting system for, uh, the metrics as a kick. What if we, what if we do?"
2768840,2774040," That's interesting. Like, why am I implementing a layouting system in here"
2774040,2781240," when they already have it implemented? You know what I mean? Like, why I just, like,"
2781240,2785240," re-implemented the thing that they implemented in the previous stream? What the hell is wrong with me?"
2788840,2796840," Okay. So, okay. Let's go ahead and try to do that. I don't know. So, uh, we can do, uh, so the vertical"
2796840,2802840," thing, right? So we're doing the vertical thing. So it's going to be Jim, uh, layout, begin. And I keep"
2802840,2808440," forgetting the order of this argument. God damn it. So, and this is going to be the vertical one. So this is the"
2808440,2816440," vertical one. And then we provide the rectangle. Um, then we provide in the count, but this has to be the amount of rows,"
2816440,2822440," right? So this is the amount of rows and the gap. Let's say, let's say gap, right? So, and then we're going to customize"
2822440,2828440," this entire thing. Let's say 10 for now, but maybe then later we're going to modify that. And we won't need this shit. We just"
2828440,2836440," won't need this shit anymore because the layouting system is supposed to do all of that for us. Uh, right? So Jim layout"
2836440,2846440," and yo, uh, and in here we're going to do another one, uh, but this time a horizontal one, right? And here we're going to have columns"
2846440,2854440," also with the same gap, uh, and in here we're going to do this kind of thing. There we go. So, and essentially what we're"
2854440,2861440," doing in here, we're drawing a rectangle, right? But we have to draw the rectangle within the, uh, within the slot."
2861440,2874440," So that means we need to do something like Jim, uh, erect slot, Jim layout slot. Uh, all right. So slot X, slot Y, uh, slot W,"
2874440,2902440," slot H, slot H and then the color. There we go. Cool. Uh, so that way we don't really have to do any math, any layout in math and we get the gaps automatically, hopefully. Uh, right. So, and that makes sense. Does it make sense? It doesn't make sense. Why there's only two."
2902440,2908440," So this is supposed to be four by four. I think I did a fucky-wucky and potentially oopsie-doopsie."
2908440,2917440," Um, so let's try to look at that one more time. So something, something went horribly wrong and I don't really know what exactly."
2917440,2926440," Uh, so we supposed to have two of them, right? So this is two by two. This is straight up two by two, but it doesn't look like two by two."
2926440,2942440," Right. Um, okay. So, uh, uh, uh, uh, uh, so I'm iterating all of the rows. I said the rows. So then the columns."
2942440,2960440," So, and as a cake in here, uh, that is weird. That is weird. Um, so."
2960440,2976440," Maybe, oh, I see what the fuck is going on in here. We have to do slot. So that's pretty, very easy to make a mistake."
2976440,2982440," Maybe we should have a separate begin, but to be fair, I'm not sure how we do that properly. Yeah."
2982440,2991440," Fucky walkie. Oopsie doopsie. Yeah. Now, now that makes sense. Right. So that's actually very cool."
