start,end,text
720,5860," Are we live? Looks like we're live. Hello everyone and welcome to yet another"
5860,11720," recreational programming session with Azuzi. How about that? Let's make a little bit of an"
11720,19960," announcement and officially start the stream. So yeah, let's do the usual red circle, right?"
19960,26240," Red circle live on Twitch. And what are we doing today on twitch.television website?"
26240,33160," Today, we are implementing alternative neural network visualization."
33160,41180," I'm going to give the link where we do know that on twitch.tv slash Azuzi and I'm going to ping"
41180,46760," everyone who's interested in being pinged. And there you go. The stream has officially started."
46760,54040," So today we're going to continue working on our deep learning framework in PRC called nn.h. You can"
54040,59340," find this thing here. I'm going to copy paste it in the chat for people who are watching on YouTube."
59340,64760," It's going to be in the description, hopefully. Where is the description? I didn't even open the"
64760,71360," description file. So here it is. Yeah, it's going to be in the description. Right. So and let's take a"
71360,77560," look at what we have so far. We have a couple of demos you can run, right, that are implemented with"
77560,82680," this deep learning framework. And part of the framework that we have in there is actually"
82680,89640," some sort of like a UI system, right, that allows you to sort of like throw some widgets together"
89640,96820," just to visualize different aspects of the state of your model, right, and stuff like that. So one of the"
96820,103480," models that we have is image to nn, where you have to provide two images. So we have some like subset of"
103480,109160," nice database, we can provide two numbers in here, just a second, I won't be able to see this kind of"
109160,114120," stuff. So training eight. And this is the second one. And if you run it like this, this is basically what"
114120,120440," you have. This is a simple neural network that is trained to behave like, well, I mean, like two images"
120440,126040," in here. So I suppose to actually use six in here instead, there we go. So now we have two separate images,"
126040,132440," right. So this is the images that it's supposed to behave as. And this is its current behavior,"
132440,138360," right. As soon as we start training, as you can see, it starts to like slowly converge towards behaving"
138360,144040," like these two images. And then what you can do is basically, you know, interpolate between these two"
144040,150120," images. So we do that with neural networks, right. And so in the middle, you can see the actual"
150120,156200," visualization of the neural network that we use for that specific thing, right. That's like"
156200,161320," literally the entirety of the state of the neural network that we use for that. It's not really a"
161320,167800," state, but it's specifically visualization of the weights and biases of the neurons for this entire"
167800,176040," thing. And as you can notice, it's fucking useless, actually, right. So essentially, purple means a"
176040,182120," negative value, and green means a positive value, right. And gray obviously means something like in"
182120,188840," between, it's zero, right. So basically, like this bias is dead, right. And because this is a fully"
188840,195160," connected neural network, each neuron is connected to every neuron to the next layer, it becomes a huge"
195160,202200," mess. Like, what the hell is this? Like, how am I supposed to even see anything useful in here? It was"
202200,208680," okay when we had like very small models, right. For example, Zor, right. So this is a very small,"
208680,213400," simple model, and you can clearly see how things are going on in here, right. And it's like, yeah,"
213400,219320," it's useful, right. So these are the inputs, this is like a hidden layer, this is the outputs,"
219320,224920," here are the positive connections, here are the negative connections, and so on and so forth. It makes"
224920,228920," sense. But as soon as you have something more complicated, it's just like, what the hell is that?"
230120,235800," And the more complicated it becomes, the more useless it becomes, actually, right. So if we go"
235800,243240," to image2nm, right, and we add more layers in here, right. So let's actually make it a deep,"
243240,249480," dark neural network, right. And that will require recompilation of this entire stuff, right."
249480,257560," So it becomes deeper, and like, you can't really see anything useful in there. And that's a huge problem"
257560,264680," that I've been ignoring for quite some time, because at least this entire thing serves as a pretty picture"
264680,270040," to show on the stream. And showing pretty pictures on the stream is very important, because that's why"
270040,276120," we are programming. Aren't we? Like, we're not programming to just see some numbers on the screen,"
276120,281960," we want to see some things moving around, because it feels like magic. That's literally the reason we all are"
281960,290200," programming to make, you know, to make our computers do fart noises and whistles and stuff like that."
290200,295400," We feel like magicians and stuff like that. So that's why it's very important to have something cool on the screen."
295400,303080," Right. But here's an interesting thing. This visualization, this visualization is not that useless."
303800,311000," On one of the previous streams, when I was exploring my mistake that I made during the explanation of"
311000,317000," backpropagation, I noticed that this kind of visualization is useful, is useful to demonstrate"
317000,327480," under utilization, under utilization of some parts of the neural network. Right. So as you can see,"
328120,333240," when I'm not using the traditional backpropagation approach, you can instantly see that this part"
333240,338600," of the neural network is underutilized. And this part of the neural network is overutilized."
338600,345000," Right. So, and that's kind of a problem. Right. So that's kind of a problem. And you can instantly see"
345000,353640," that on the visualization. Right. So that means these kind of visualizations are useful. Right. So, and I was"
353640,361000," actually thinking, can I make it, you know, not as much of a mess, not as much of a mess, but still"
361000,367240," retain its usefulness, uh, when it comes to just instantly seeing what parts of the neural network"
367240,375080," are overutilized or underutilized and stuff like that. And I think, I think I came up with a pretty"
375080,381400," interesting idea. So let's actually, let's actually, uh, take a look at this very simple example. Right."
381400,386200," Let's take a look at the very simple example and I'm going to call it simple. I don't know. Right."
386200,393960," So I just want to start like over, uh, right. And here is a simple application in here. Right. So here"
393960,401800," is the simple application. And if I try to print something like, hello, uh, semen, uh, right. And"
401800,407560," then let's just build this entire thing. So this one is going to clank simple, simple.c, and then I'm"
407560,413560," going to run this entire thing. And there you go. It says, hello, semen. So let's plug in our neural"
413560,419720," network, uh, framework. Right. So it's going to be nn.h. Uh, right. And we also have to define"
419720,425320," nn implementation, right. And then implementation. And I'm going to rebuild this into, I think,"
425320,431160," of course, it tries to use, uh, a bunch of, uh, things, uh, which is kind of weird. Um, well,"
431160,436600," I mean, I implemented, oh, I just need to link all of that with the math library. Yeah, that's right."
436600,442680," So I need to link. Yeah, there we go. So now it works. So let's allocate a simple neural network,"
442680,449160," right. So let's do nn. And I'm going to do nn log. And what I have to do here, I have to provide the"
449160,455960," architecture and architecture is basically a sequence of integers. It's a sequence of integers. And these"
455960,462920," integers are the sizes of each individual layer. So we can say that input layer has two neurons,"
462920,468920," right? So we have two inputs. Then the hidden layer may have three neurons. Then the next layer"
468920,475000," can have four neurons, uh, right? Four neurons. And the next layer is going to have a two neurons."
475000,481560," So, and this is the architecture of our neural network, right? So, uh, we described that in,"
481560,488280," in the terms of like, uh, the sizes of the layers, right? So we feed that architecture into an analog."
488280,492840," And also we have to provide how many numbers we have in here. So we have to do array lengths to get the"
492840,497880," length of that specific array. And that thing should, uh, allocate that neural network for us,"
497880,503320," right? So, and we can also print this entire thing, right? And there we go. If we try to run this"
503320,509640," entire thing. So this is a neural network and it consists of a sequence of matrices, right? So it"
509640,517080," consists of a sequence of matrices, which are actually pairs of matrices. So the first matrix is the weights"
517080,522520," of the first layer, right? All of the weights of the first layer. And this one is all of the biases"
522520,528760," of the first layer. And this is basically the, all of the weights of the second layer and so on and so"
528760,533400," forth. So all of that is zero initialized, obviously, right? All of that is zero initialized. We can"
533400,537800," actually randomize this entire thing to make it a little bit prettier, right? Let's actually fill it"
537800,542920," with, uh, values from minus one to one and all of that thing is going to be, you know, randomized and so"
542920,547800," on and so forth, right? So it looks a little bit better. It looks a little bit interesting. So"
547800,556200," essentially, um, what all of that means, right? Uh, what all of that means, uh, maybe it would be nice to"
556200,563880," actually see, uh, this neural network as well, uh, right? Maybe it would be nice to visualize it"
563880,570280," somehow, but I'm not sure if I want to start, uh, RayLib thingy, right? But maybe it's worth actually"
570280,576440," starting the RayLib thingy. So let's actually quickly do that. Uh, right. I'm going to include RayLib, uh, super"
576440,583240," quick, uh, right. And of course it doesn't have a RayLib. Uh, so let's go into the build, right? So this one"
583240,590680," is going to be essentially the build, uh, and let's put a simple in here, right? And, uh, if I try to"
590680,594840," build this entire thing, I think it's, I think it's still going to complain about, no, no, it's actually"
594840,600840," fine because I'm, I run everything in the correct environment, right? So which is super nice. All right."
600840,609720," So in here, what we can do, uh, we can, uh, initialize the window, right? We need to window, um, so 800 by 600."
609720,615080," So this is a simple thing. Uh, and do I want to do anything else? I think no, right? So let's actually"
615080,622760," start, uh, the event loop. Should a window, uh, should close. I don't quite remember. Image to an end."
622760,631160," Uh, yeah. Window should close. Window should close. While window should not close, we begin drawing,"
631160,637560," we begin drawing, and then ending drawing, right? And also let's actually clean the background with"
637560,644120," maybe black color, right? So this is going to be black color. And let's actually render our neural"
644120,649960," network, right? So I'm going to go to nn.h, and I think it was something like gym, uh, render, yeah,"
649960,656760," gym, render, and then, and, uh, this thing accepts the neural network that we just allocated, and the"
656760,661320," rectangle within which we want to render all of that. So what I want to do, I probably want to render"
661320,666760," within, uh, the window itself. So let's actually factor out, uh, the width and height of the window,"
666760,672920," right? So something like this. So this is going to be height. So this is width. This is height. Uh,"
672920,679800," right. And let's actually use the collateral, right? Uh, and let's put the following thing. So we're going to"
679800,685240," start at 0, 0, which is like the, the left top corner, and then wh, and there we go. So that thing"
685240,691880," should basically, uh, render the neural, the neural network that we just allocated, uh, right, on the"
691880,697240," screen. So we're going to have a window, uh, gym erect, and this is because we need to enable gym,"
697240,704840," right? Enable, uh, gym. So this is basically how you can start working with our, uh, basically framework,"
704840,709560," right? So all of these things are part of our framework. You can just allocate the neural network,"
709880,715320," then using RayLib, you can create a window, and then using the gym widgets, you can render this"
715320,720200," entire thing, and we're going to have a lot of these kind of widgets that allow you to visualize different"
720200,724920," parts of the state of your model and stuff like that. So this is basically like a sort of like a"
724920,731320," quick tour of the, uh, of the framework, right? So it's a quick tour of the framework, uh, if that makes"
731320,737160," any sense. And there we go. You should get this kind of thing. So this is the neural network that we just"
737160,742760," allocated, right? And as you can see, it's basically the widget that we used in, uh, in the previous"
742760,748280," models, in previous demos. So it's literally the same widget. So the idea that I'm going for actually"
748280,754440," is that you have a lot of these small little widgets that you can throw into the own window,"
754440,759400," right, in different orders, right, depending on the needs of your model, right? And then when you're"
759400,764040," done with your model, you can basically quickly assemble another application that uses different kinds of"
764040,769640," uh, visualizations because depending on what exactly you're doing, you may not want to visualize certain"
769640,774760," things in a certain way, right? So that's basically the whole idea. So here I need to quickly just"
774760,780280," visualize some, uh, neural network, right? So, and I just use this standard visualization and this is the"
780280,788360," thing I got, right? Uh, this is the thing I got. So, and also we are simultaneously printing the weights and"
788360,793640," biases, the weights and biases of the neural network and also rendering its visual state. I just want to"
793640,798600," have these two things side by side. So this is basically why I was spending some time doing all"
798600,806360," right. So here is the input layer, right? As I already said, we have 2, 3, 4, 2, right? So if you just count"
806360,815960," them, uh, so this is a 2, 3, 4, 2, 2, 3, 4, 2, precisely. So if you put something like, uh, 10 in"
815960,820760," here, uh, right, obviously it's going to be completely different. So as you can see, it actually affects"
820760,827960," things, uh, right? So as you can see here on the previous, uh, layer we have 10 of them, right? So it"
827960,834600," automatically does all of that stuff for us, uh, right? So let's actually go back to 4. Um, okay."
834600,843560," Okay. So essentially you can see that we have two elements, uh, two neurons in here and three neurons"
843560,851880," in here and each neuron is connected to each of the next one. So this one is, uh, has three connections"
851880,861000," like this. And this one has three connections like this, right? So, and this entire mass of connections"
861000,873160," is described with this matrix. So this connection has, uh, a weight this, this connection has weight this,"
873160,881240," and this connection has weight this, right? And as I already said, green is positive and purple is negative."
881240,886520," So as you can see, these two are positive. And because of that, these two are green and this one"
886520,891240," is negative. And that's why it's purplish, right? So you can clearly see that it's actually closer to"
891240,896360," gray because it's not that strong, right? So the more the negative, the more purple they become,"
896360,901720," the more they're positive, the more green they become. So it also shows the intensity of these connections."
901720,909640," And correspondingly, this connection is this one, this one is this one, and this one is this one. And as you can"
909640,917080," see the signs also preserved, right? So, and this mass of connections is described by this matrix, right?"
917080,923800," So we have three and four. So that means the matrix is three by four, uh, right? So, and, uh, this mass of"
923800,930360," connection four, uh, by two, right, is described by this one, right? And these are biases. These are"
930360,935960," additional things that are added to the activation of the neurons, right? Nothing special. So as you can see,"
935960,942920," right, uh, this is basically side-by-side comparison of the actual representation in the memory and how we"
942920,949480," visualize it, how we as humans think about these neural networks. Uh, right. So, and here is an"
949480,956520," interesting thing. So you can think about connections between neighboring, um, neighboring layers"
956520,965080," as sort of like a rectangular image. You can think of it as sort of rectangular image, right? And you can"
965080,973480," literally see all of that. So this is the image two by three. And this is an image three by four. This is an"
973480,985320," image four by two, right? So what if we take these matrices and turn them into texture, right? Where each pixel,"
985320,989640," where each pixel corresponds to the weight of the connection."
989640,997080," And that way, and then we take all of these, uh, textures and we stack them, uh, top to bottom,"
997080,1004360," right? We literally stack them top to bottom, right? And each pixel in that texture represents"
1004360,1010280," one single connection. And as the neural network learns, each pixel is going to basically highlight"
1010280,1014600," either green, purple, they're going to change and so on and so forth. And we're going to literally see"
1015320,1020440," what parts are underutilized, uh, what parts are overutilized and stuff like that. But we're not"
1020440,1027240," going to have this mass that obscures each individual connection. We actually sort of taking all of this"
1027240,1034120," mass and we're rotating it facing forward, right? So at us and each pixel is the connection. We actually"
1034120,1041000," see more, right? So we'll be able to actually see more connection in their values and it's going to be"
1041000,1045960," actually way better. I think this is hypothesis. I never implemented visualization like that,"
1045960,1051400," but this is my hypothesis, right? And it's going to be very valuable when your neural network is going to"
1051400,1058200," become something like this, right? So, right. If you have something like this, uh, each sort of like"
1058200,1062440," interconnection matrix is going to be like very valuable. Like how are you supposed to read that"
1062440,1070920," shit? Like how is it like, you need to like take this entire stuff and turn it into image, right? And if"
1070920,1075400," we take a look at, uh, how it actually printed all of that, yeah, there you go. So these are the"
1075400,1082280," mattresses of each individual layer in here. These are literally the mattresses. They're begging to be"
1082280,1090040," turned into a texture and displayed as a texture, right? So, and that's what I want you to do today,"
1090040,1095000," right? So I'm not going to remove the current visualization because I think the current visualization"
1095000,1102280," is very useful, again, when you have very small models like XOR. In XOR, it's actually extremely"
1102280,1107400," valuable. It is extremely valuable because like you can literally see that, but as it becomes more and"
1107400,1113720," more, uh, complicated, like we have adder in here and here in adder, I'm sorry, you've seen a secret"
1113720,1119640," terminal that you're not supposed to see. Uh, right. So it's already kind of complicated, right? So it's"
1119640,1126680," already kind of complicated. So this is basically a table that contains numbers 0, 1, 2, 3, 4, 5. And"
1126680,1131240," basically this is the sum of these numbers on the intersection of row and column. And it just like"
1131240,1137800," verifies that the adder, uh, works correctly, right? So the adder works correctly. So as you can see,"
1137800,1142920," you can literally see how the, the results rearrange, uh, right? And purple, by the way,"
1142920,1147880," means overflow, right? Because it can add only four-bit numbers, right? So I think it's not four,"
1147880,1154680," it's, it's actually five bits, right? It's not four, it's five bits. Uh, right. So, but that's basically"
1154680,1161240," the idea. That's basically the intro. That's the plan for today. Sounds good. Sounds Gucci. Sounds"
1161240,1166360," at Hamaguchi. Okay. So let me take a look at it. Anyone actually subscribed while I was doing the"
1166360,1175640," intro, right? So it was 20 minutes intro. God damn it. Uh, 20 minutes intro. Like, uh, I think I'm gonna"
1175640,1182120," start doing the, like, one hour intro at some point. Uh, so, all right. Thank you so much, uh, horizon,"
1182120,1186280," uh, horizon. Uh, I hope I'm pronouncing your name correctly. Thank you so much for Twitch Prime."
1186280,1192360," And for decking, uh, thank you so much for Twitch Prime as well. A thank you. A thank you. A thank you."
1192360,1199720," Okay. So, uh, let's go. So let's actually go back to our original smaller neural network,"
1199720,1207160," right? So, and I'm gonna try to rebuild this entire thing. So this is the simple, uh, and when we're"
1207160,1213400," building, we're only building the simple, right? So, okay. That's cool. That's pretty freaking cool."
1214840,1220920," So one of the things I want to do, I suppose, uh, I think I want to have a function which is going to"
1220920,1228200," accept the gym rect, uh, gym rect, and it's going to render the neural network within this entire thing."
1228200,1235240," Right. Maybe for now, maybe for now, I actually going to accept only one matrix, right? Only one"
1235240,1240200," weight matrix. And I'm going to try to render only one weight matrix. I think that sounds like an"
1240200,1247880," interesting idea, right? So gym, uh, render, uh, weights, gym render weights. We're going to accept"
1247880,1253800," the slot within which we are rendering this entire stuff. And we're going to accept the matrix, the"
1253800,1259320," single matrix, and we're going to try to render all of that stuff within that matrix and see how all of"
1259320,1266120," that goes. Uh, right. So this is going to be render. This is going to be M. And you know, what's interesting"
1266120,1273480," is that I can now use our layouting system that we implemented on the previous stream to actually,"
1273480,1279640," uh, display the previous visualization of neural network and new visualizations side by side"
1279640,1286360," without compromising anything. Right. So, and it should be super easy. So essentially one of the things I did"
1286360,1295080," of screen, right? So on the previous stream, you had to create gym, uh, layout stack, right? And, uh, it was"
1295080,1299080," using like dynamic allocation and stuff like that. And you would have to pass it every time you push"
1299080,1305880," something into that stack. What I did, I noticed that you probably never going to have more than one,"
1305880,1312760," uh, layout stack in your entire application. So what I did, uh, in the, uh, in the framework,"
1312760,1320280," I just created a global static, uh, layout stack called default gym layout stack. And I created a"
1320280,1326600," bunch of macros, like layout, begin, layout, end, which basically push layouts to that default thing."
1326600,1331240," So you never have to like create your own thing. You, you just do the following thing. You just say,"
1331240,1338920," okay, gym layout begin, right? Gym layout begin. And I'm going to basically allocate layout on the"
1338920,1344840," entirety of the screen in here. Uh, right. So then I have to provide, uh, the orientation, right? So"
1344840,1350840," gym layout orientation, and let's say the orientation is going to be horizontal, right? So this is that,"
1350840,1354920," then the rectangle, then I have to decide like how many elements I'm going to have there. I'm going to"
1354920,1361000," have two of them and let's not put any gaps in here, right? So, and when I'm rendering the neural network,"
1361000,1366440," I'm going to be taking a layout slot out of the current layout, and I'm going to render this thing there."
1366440,1377160," Uh, right. And here I'm going to do, uh, layout end, there we go. And then here I'm going to do, uh,"
1377160,1387400," render weights, right? Gym, uh, render weights. So, and in here I have to provide the gym layout slot,"
1387400,1392200," right? So this is the slot and the matrix, a single matrix. So we're not going to render the whole thing,"
1392200,1398680," only the, the current matrix. Excuse me. So, and essentially what we can do, we can just take,"
1398680,1404360," uh, one of the matrix in here. In fact, yeah. So basically the first weights matrix, just, just the"
