start,end,text
160,5680," Hello everyone, and welcome to yet another recreation programming session with Amistazozin."
5680,12880," So here we have a simple online game, multiplayer online game. So essentially, if I open this game in"
12880,17840," a second tab, we have a second player joined. Right, so I can control this player and I can"
17840,25680," control this player. Right, and it doesn't really support that many players, even locally. So I'm"
25680,32320," running it locally right now, but even locally it is kind of slow, honestly. So we can actually test"
32320,38320," it out. So I have a sort of like a test suite that allows me to spawn a bunch of bots, right, so I can"
38320,43600," do something like that. So here is, I think it's going to spawn like 30 bots. And the thing about"
43600,48800," these bots is that, oh, this is not how we do that. So yeah, I'm using wrong commands, I'm sorry about"
48800,54000," that. There we go, we spawned a bot and here they are, here they are running around and stuff like"
54000,59440," that. And it's fine because it's around 30 bots, I think. So let me actually maybe increase the"
59440,65040," amount of bots a little bit. So yeah, this is a 30 bots. But there's also on the server, there's a"
65040,71520," little bit of a limitation how many connections we accept. So I accept 69. So I kind of want to get rid"
71520,75600," of this limitation. So let's actually put something like 1000, right, so effectively it will get rid of"
75600,82240," the limitation. At least for now, right. So we can't really do 1000 of the players, but maybe in the"
82240,91280," future we'll be able to do more. Okay, so I need to restart the server, right. And for the bots, let's"
91280,97760," actually spawn like maybe 100 of them. I think it's going to be very interesting to try. So here is the"
97760,108560," player and I'm spawning 100 bots. Here they are. And look at that! At 100 bots, the ping actually becomes,"
108560,118560," like, it jumps to almost 100. Right. So something grows in here non-linearly. Right. So let me go to"
118560,126800," 50. Right. So I'm actually going to cut it in half. So what about 50? Right. So this is 50 bots and the ping,"
126800,133280," look at the ping. Sometimes it jumps to very high values, but when the GC doesn't kick in, it's like around"
133280,140160," 6 milliseconds or something like that. Right. But as soon as you like put 100, it jumps like dramatically."
140160,146560," Like, holy fucking shit. So let's go. There's some sort of a non-linear algorithm happening in here."
146560,155120," Look at that shit. Right. And maybe we can now increase the amount of bots even more. So 150. And I think it's"
155120,161200," going to be, it's not going to work like at all. Right. So yeah, it's going to be so super laggy."
161200,167920," Look at that. So one second. Look at the ping of one second. Holy shit. Right. And again,"
167920,175520," all of that is locally. Right. All of that is locally. So there is non-linear algorithm somewhere"
175520,181200," in the server or something like that. So this is bad. Right. I mean, it's local shit."
181200,189440," So and one of the places I think I can identify where we have non-linear algorithms"
189440,198720," is when we process in the tick. Right. So this one is rather interesting. So there's like several stages"
198720,208000," where we do things. Right. So essentially, before tick is being processed. Right. So this is a callback"
208000,213520," that is called periodically. Right. So it's just basically called periodically and it loops itself"
213520,219840," through set timeout. Right. And the amount of timeout is actually dependent on how much time it took"
219840,225680," for the tick to process itself. Right. So and it just like waits a little bit less if it took too long."
226400,233120," So that's basically how it works. And since it's like a set timeout callback, while it is being waited,"
233120,240080," we receive different events from the WebSocket and we're basically accumulating those events"
240080,248320," in different sets and maps and stuff like that. And as soon as tick kicks in, as soon as tick kicks in,"
248320,254480," we're processing everything we received while we were waiting. So that's basically how it works. Right."
254480,262240," So basically in the server, we have our code split into parts, the part that receives events and just like puts them"
262240,268480," somewhere in some sort of like data structures and stuff like that. And the tick code, then when it kicks in,"
268480,274800," it takes everything that's been collected while we were waiting and then processes that as the tick."
275440,283200," So and we have the first thing that we do, we look at the set. Right. So it's a set of joint"
283200,289920," players. Right. So it's a joint IDs. This is the IDs of the joint players. And we process them and we send"
289920,295920," out different, you know, different events and stuff like that. And here already we have"
296880,305520," a square algorithm. So look at that. So it's not even even square algorithms. So we iterate through each joint IDs."
305520,310960," And for each joint ID, we iterate all of the players."
310960,315200," Right. So we have a hash map of all of the players."
315600,323360," And for each ID, we iterate each player. So it's basically the joint amount of the amount of joint IDs"
323360,328640," multiplied by the amount of players. Right. So it's not really like a square. It's like a rectangle."
328640,335920," So this is one basically source of nonlinearity. It's not really square. Right. So it's more like n by m."
335920,344000," Right. So where n is the amount of joint players and m is the total amount of players. Right. So it's not"
344000,351200," exactly square, but at some situations it could become square. At some situations it could become square."
352240,358560," So for the left players, it's also kind of like repeating itself. Right. So it's a left players"
358560,366640," multiplied by all of the players. And the most slow part, I think, is actually this one. So this is"
366640,377920," straight up square. Look at that. For each players. For each players. Straight up. So this is basically"
377920,383040," what we have. So this is probably one of the places we would like to optimize in here."
383040,390560," So and how can we even optimize this entire stuff? So essentially for each player. Right. So this is"
390560,398960," basically movements. We are updating all nightmare. Yeah, exactly. So this is all nightmare. So"
398960,406160," essentially we're notifying about change of the state of the player. For example, the player starts to"
406160,412000," move in a particular direction and stuff like that. Right. So we notifying every player about basically"
412000,418480," every player in the worst case scenario. Right. We're not notifying the player when the player hasn't"
418480,424480," changed its state. Right. So as you can see, there is a check in here. So new moving mask is basically,"
424480,429680," if it's equal to the current moving mask, nothing changed, nothing to notify about. Right. But if"
430240,437280," everyone is like very rapidly changing their direction and stuff like that, this can, in worst case scenario,"
437280,446880," can become quadratic or square. So the idea that I had, I think we can try to combat that with batching."
446880,455200," So essentially for each sort of player in here, we send in one single message that contains the state of one"
455200,464720," single player. Right. So what we could do in here, what we could do, we could basically, in a linear sort"
464720,472480," of time, iterate all of the players once, iterate all of them once and collect each individual player that"
472480,480880," changed its state. And we could pack all of them into a single event that contains multiple states,"
480880,487360," multiple states of multiple players. Right. So, and we just basically collect that buffer once"
487360,494880," in a linear time. And then in a linear time, on the next loop, we could send out that bigger batched"
494880,503360," message to all of them. It is all n squared. Yes, it is all n squared. But I feel like it's more like"
504480,513600," it's more like this. It's n and some constant a multiplied by some constant b multiplied by n."
513600,523200," So, and obviously it is still n squared, but you can dramatically reduce that specific constant."
523200,531360," Right. Because now, instead of doing this heavy operation of sending small message, you're actually"
532160,539200," reducing the amount of send messages. Right. So, you basically, the algorithm itself,"
539200,547920," right. So, the algorithm itself is still square, but the amount of sent messages becomes linear, actually."
547920,555200," The amount of sent messages becomes linear. Right. So, it still can provide some improvement in speed."
559200,567360," So, yeah. Technically, technically, I do agree. It stays to be n squared."
567360,575040," It stays to be n squared. But the second inner loop iterates, it doesn't even iterate in the"
575040,582320," JavaScript part. It will be iterating through the bytes when it sends out the bytes over the socket."
582320,587520," And that iteration over the bytes is not going to even happen probably in a user space, because we will"
587520,593520," just take the buffer that contains the bytes, and we'll probably pass them to the right syscall."
593520,597440," So, the actual iteration over that byte is going to happen in a kernel space."
597440,606320," So, okay. So, if you think about this way, right. So, you have two n's in here. So, the first n is going to be this outer n,"
606960,609840," and that inner n is going to be in a kernel space."
609840,618480," So, yeah. That's the kind of, you know, optimization we can do. So, yeah. Technically,"
618480,624640," it is still n squared, but that constant that is responsible for that inner n, like, it's going to"
624640,630160," be dramatically smaller. It's like so much dramatically that, well, you can basically think it's going to be"
630160,634480," linear. So, that's my hypothesis, right. So, that's my hypothesis."
634480,645120," Yeah. So, by the way, thank you so much for all of the subs and resubs and recommitments."
645120,650640," Thank you so much, Gregors, for five months. And TuringComplete, thank you so much for 200 bits."
653200,657680," With the message, finally, EU stream. Yeah, yeah. So, we're streaming at very unusual time."
657680,661760," And thank you, anonymous gifter, for gifting this up to Trump's bathwater."
661760,665920," All right. So,"
665920,670720," AdamD1008, thank you so much for the message,"
670720,682800," So, how are we going to be batching? How are we going to be batching this shit?"
683760,689200," So, let's find out. Let me see. So, we need to take a look at the player moving"
689200,693520," structure. All right. So, we need to do a player moving structure. And it's basically..."
693520,700720," So, it has a kind, which indicates what kind of structure it is. It's just a single byte,"
700720,705440," and nothing particularly special. And we basically have a message kind. So,"
705440,708880," where can I find the message kind definition? I just want to go there."
708880,712800," So, yeah. So, this is basically the kind of messages we can have. And the kind takes only one"
712800,718000," byte, because we don't really have that many kinds of the messages. So, then we have an idea that"
718000,723600," identifies the player, then the position of the player, then its moving mask, and then we just"
723600,729600," have the size of the entirety of the structure. So, what I'm thinking is that, what if instead of like"
729600,737200," a single player events that we have right now? Things like player moving struct, player join struct,"
737200,745280," player left struct. What if this single sort of message could actually accommodate several players?"
746160,752080," Right. So, essentially, let me demonstrate. So, you have a kind, and then the next thing, instead of a"
752080,761360," single player, you would have something like count, which indicates how many players you have in that"
761360,768560," single sort of message, in a single batched message. Right. Big fan of the proper mod function."
771120,776880," Right. It's that one. Right. So, I didn't call it like, I didn't remember the name of this mode."
776880,782720," It's sort of like a Euclidean mode or something. I think Rust calls it Euclidean mode. But for me,"
782720,787840," it's a proper mode. Right. So, usually, if you do like a modular arithmetics, this is the mode that you"
787840,794480," want. Right. So, this is the mode that you want. Okay. So, here you have a count, and this is where you"
795280,800160," start to have like a fields of the player. Right. So, this is where you have the fields of the player."
800160,808560," ID, X, Y, moving, and so on and so forth. And you have like a sequence of them now. Right. And the"
808560,815760," amount of these players is equal to the count. So, it's... Before we worked with structures of the fixed"
815760,823840," size. Now, I propose to introduce the structures of a variable size. Right. Allocator in JS. This is not"
823840,831440," really a memory allocator. It's a structure allocator. We're defining a C structure in JavaScript. Right."
831440,836320," And to keep track of the size of the structure, we have this simple thing called allocator. Every"
836320,843600," time I allocate a new field, it just increments its size and it uses its current size as an offset within"
843600,852560," the bytes. Right. So, we're not doing memory allocation. We're just like denoting the offsets"
852560,858720," for the fields of the structure because we're parsing bytes directly in JavaScript. So, that's basically"
858720,866480," what's happening in here. So, that's basically what's happening in here. Okay. This one is going to be"
866480,874080," rather interesting. So, we probably... Yeah, let's actually start doing that. So, this is going to be the"
874080,880880," kind. And let's introduce the count. How many things we want to have in the single batched message?"
880880,891520," So, 8 will allow us to have 255, which is maybe fine for now. We can't even handle 200 of the"
891520,898080," of the players. But once we start batching, I think we could, you know, support more. So, I don't really"
898080,905680," know. Let's actually have like maybe two bytes. And I think I don't even have the two bytes fields in"
905680,912320," here. So, let me enable fly check mode. So, and I'm pretty sure it is going to fail. So, it's a fly"
912320,918240," make. Fly check mode, please. Yeah, there we go. Yeah, there we go. We don't have a UIN16. So, let me"
918240,925840," let me quickly introduce it. So, where's the definition of this thing? I think I'm going to just copy-paste this entire"
925840,934800," field. All right. And simply query replace 8 to 16. Who needs your stinky templates? If you can just"
934800,941360," copy-paste the code. All right. So, we also need to define the size of the UIN16. Let's actually put it"
941360,950560," in here. So, and suppose it's two bytes. UIN16. There we go. And there we go. We allocated this kind of stuff."
950560,958640," Who needs protobuf? Who needs protobuf if you can parse bytes directly in JavaScript? Only people who"
958640,966000," are afraid of bytes use protobuf. And Google. I suppose Google people are just afraid of bytes."
967520,979360," Anyway. So, this one is rather interesting. How can we, how can we even do that? Right. So,"
979360,987360," essentially, we, after count, we don't really know how many players we have. So, maybe count is going to be"
987360,993520," equal to zero. So, that means you have none of the fields in here. None of them are going to be here at"
993520,1002640," all. So, we could probably allocate that into a separate structure. So, essentially, we could"
1003440,1011760," basically, we could basically treat that not as the structure of itself, but more like a player moving"
1011760,1018880," header. Right. So, it's a player emacs. Could you just please shut up? Okay. Thank you so much. So,"
1018880,1027440," it's a player header. And then, you're supposed to essentially use that header to parse this part of the"
1027440,1035120," blob. And then, using the size of that header, you're supposed to offset it and start parsing from here."
1035120,1041200," Right. And you parse basically separate structures. Right. So, that's basically the idea that I have."
1041200,1047920," Right. So, this is just a header. And then, it's basically a variable array of these structures."
1047920,1051520," So, we need to introduce them. So, let's say it's going to be player"
1053120,1059600," moving. It's more like a moving player. Or maybe just player struct. Right. So, let's call it player"
1059600,1065040," struct or something. Right. I'm really sure how to call this entire thing, but it doesn't really matter"
1065040,1069840," how we call it right now. We can always rename it to something else. Right. So, we need the allocator"
1069840,1076800," header. Right. So, and in here, we also need to introduce the size. Right. So, it's going to be allocator."
1078160,1085600," We need a local pointer field. I mean, pointer is just a number. So, just allocate a number, bro."
1085600,1092640," Just allocate a number. Okay. So, we're going to have this kind of stuff in here. So, we're going to do"
1092640,1099040," return. We're not going to have a kind. Right. So, because it's not an event. Right. So, kind basically"
1099040,1105120," emulates like tagged unions. Right. That's what it is. It's just basically a tagged union. So, here we have"
1105120,1113120," id, x, y, moving and the size. Right. So, essentially, once you parse the header, you're supposed to use"
1113120,1119920," the player struct to parse the rest of the stuff. So, in here, we have to specify like account and size."
1119920,1124800," Okay. So, the verify is going to be rather interesting, honestly. Right. So, verify is going to be rather"
1124800,1135280," interesting. Because it checks for a specific fixed size. Right. It checks for a specific fixed size."
1135280,1143680," But now, the size in here is kind of variable. So, we'll have to have our own custom verifier. Right. That"
1143680,1150800," is not this sort of like predefined verifier. Right. So, because we're having like a different kind of"
1150800,1155920," things. Right. We're having different kind of things. So, let me actually see. Might as well"
1155920,1163760," just, you know, assign this entire thing like that. Right. So, let's do it like that."
1164800,1172800," So, it accepts the view. We take the view by length. And you know what we can do. Right. So, here is the"
1172800,1177520," size of the entirety of the structure. Right. So, and it doesn't like that. It doesn't know what it is."
1178560,1195680," We can subtract actually. Yeah. We can try to. Yeah. We subtract the size of the structure"
1195680,1204000," and then see if the size of the structure divisible by the size of the element."
1204000,1208240," You know what I'm talking about? You know what I'm talking about? Right. So, essentially,"
1208240,1212880," you just remove this entire thing. You just remove this entire thing. And then you have"
1212880,1219760," this thing. And you see if it is divisible by a single element that you have in here. And that's"
1219760,1225760," how you can verify that the blob at least resembles the message that you want. So, what we did before,"
1225760,1231360," we just checked the kind. We just checked that the kind is equal to something. And then you checked the"
1231360,1236240," and then checked the entirety of the size of the structure and made sure that it's equal to that"
1236240,1242080," structure. But now it's variable. So, we have to be also variable. So, we need to become variable as well."
1242080,1245760," If you know what I mean. Right. So, we have to be agile."
1248080,1254640," You know what I mean. You know what I mean. So, but anyway. So, here I think we have to do slightly"
1254640,1263040," different stuff. So, first of all, byte length has to be at least greater or equal to the entirety of the"
1263040,1273520," size of the structure. Right. So, the byte length has to be at least that. Okay. And then, right. So, we take"
1274640,1279920," this entire size. We subtract the size of this header. Right. So, we subtract the size of the"
1279920,1288480," header. And then, we check that the mod of what was this called? Right. So, we have this player struct."
1288480,1297040," You have this player struct, which is size, as I forgot to put it, equal to zero. Right. So, that's what we're doing here."
1297600,1304640," Okay. That's pretty cool. So, here's the field kind. Then, we read that field kind from the view."
1304640,1314320," And then, we make sure that it's equal to, I suppose, message kind player moving. Player moving."
1314320,1321440," Is it... Emacs, could you just out a complete shit properly? Thank you very much. Sorry. Emacs is dummy"
1321440,1326400," dum-dum sometimes. Okay. So, I forgot to call this and type in. Okay. So, that's basically the new verify."
1327200,1332000," And I think... Yeah. I think that makes sense. Does it make sense? Chat. Look at this thing."
1332000,1336800," Does it make sense? I think it does. All right. So, because I feel like it's very easy to make a"
1336800,1345360," mistake anywhere in here. So, we have to be super careful. We have to be super careful. All right."
1345360,1352320," All right. All right. All right. So, everything seems to be okie dokie. Okay. Okay. So, fly make."
1352320,1356960," Fly make. I should probably disable fly make. So, it doesn't show this like exclamation mark or anything."
1356960,1364000," So, I think I don't have any errors in here. So, fly make next error. Yeah. So, let's go to maybe..."
1364000,1373760," Let's try to handle the client. Right. So, obviously, right now, both client and server are broken. Right. So,"
1373760,1379840," and probably both as well. So, we need to go through all of the components of the system and fix them."
1379840,1386000," Right. So, do compiler assistive refactoring. So, let's go ahead and open the client and fix the client."
1386960,1394880," So, let me see. So, this is a fly check mod. Not fly make, fly check. So, I have the auto-completion"
1394880,1401680," poisoning. Right. So, I already talked about it. So, essentially, you typed an incorrect command and it"
1401680,1407920," got saved in the auto-completion check. And now, every time you try to type something, it's the incorrect"
1407920,1414240," thing that pops up the first and you keep hitting that. So, it's an auto-complete poisoning."
1415200,1420960," It's kind of annoying when it happens on the phone. And since you keep hitting it,"
1420960,1426080," since you keep hitting it, the cache system thinks, oh, that's what you want because you keep hitting it."
1426080,1431200," Right. So, that's what you want. So, it keeps ranking it higher and higher and higher. So,"
1431200,1437520," it completely poisons the auto-completion and becomes useless. So, it's not only in Emacs. It's just like,"
1437520,1443280," generally. Right. Poison the auto-completion supply. Yeah, exactly. Poison the model,"
1443440,1452240," the statistical model that is responsible for all that. Okay. So, no, fly check, fly check next. Yeah,"
1452240,1457200," next error. There we go. So, here, this is the client. Right. So, we already updated the model."
1457200,1463040," We're looking into the client. So, what do we have in here? Player moving struct. So, we're verifying the"
1463040,1468640," view. So, we don't really have a player moving struct. We have the header. Right. So, we're verifying that the"
1468640,1476320," header is correct. So, an verification consists of making sure that the size of the blob is as big as"
1476320,1481520," the size of the header. So, the header at least fits there. And then, the rest of the tail of the blob"
1481520,1489120," is divisible by the size of the element. And then, we read the kind of the syntactic and making sure that"
1489120,1494240," it's a player moving. Okay. So, everything seems to be fine. So, and then here, all right. So, what we have"
1494240,1499280," to do, we have to actually read the count. Right. So, how many elements we have in there. So, I'm going"
1499280,1506000," to take a common player moving header struct and I'm going to take the count and I'm going to read"
1506000,1511840," that out of the view. All right. So, then, I will just have to iterate through each individual element"
1511840,1520080," in here. So, it's going to be from zero up until the count plus plus i. And, right. So, instead of like"
1520960,1529280," handling player moving one by one, we received a batch of player moving. Right. So, we're now like"
1529280,1534320," batch processing this entire stuff. So, here's an idea. And this one is rather interesting."
1534320,1542000," This one is rather interesting. So, now, I actually have to create a completely new data view"
1542800,1551120," for my player. Right. So, this data view is based on the event data. Right. And event data, as far as I"
1551120,1556800," can tell, it's an array buffer. So, what I have to do in here. So, I'm pretty sure data view constructor"
1556800,1565920," data view constructor has byte offset and byte length. I can utilize them to, for example, skip the header."
1566640,1573120," Right. To skip the header. So, what I can do. I can essentially say, okay. So, we're starting from"
