start,end,text
1573120,1581840," the moving header struct size. Right. So, we're skipping the header. But then, we also have to skip all of"
1581840,1589040," the elements in here. So, we'll basically do i multiplied by the size of the element which is the player struct"
1590000,1597440," size. And there we go. So, here we have a view that basically views only one element, that one single"
1597440,1603600," player struct. Right. So, that's what it does. So, maybe I'm gonna do something like player viewing here."
1603600,1611280," Right. So, and now I should be able to read different fields out of that thing. Right. So, I can do player"
1612400,1620960," struct id read from the player view. All right. And that's about it. So, I then take the id of the player."
1620960,1629360," And in here, I can probably do like a batch replacing in here. So, this is a player struct. And in here,"
1629360,1637680," player view. There we go. Player view. All right. So, do we have any other errors in here? Okay."
1637680,1643200," Everything seems to be fine. Everything seems to be fine. Didn't make any. So, this is actually super"
1643200,1652080," scary. This is actually super scary. You can, if I make any mistake like in here. Right. So, if I skip"
1652080,1657040," the bytes incorrectly or something like that, like I may end up in a situation that is very difficult to"
1657040,1666160," debug. Right. Because we're not like parsing JSON or anything like that. We're parsing bytes. So, set byte"
1666160,1673360," length. I'm not sure if it's a, if it's possible. So, let me, let me see. I don't, I don't think it"
1673360,1684720," allows to do that. The last time I checked, it was, yeah. That's a bit annoying, honestly. So,"
1684720,1692240," it basically, JavaScript wants you to create a ton of small, useless objects. Right. In the constructor,"
1692240,1700080," in the constructor, what... How constructor doesn't do anything? Right. So, I didn't really know. I"
1700080,1704400," don't really know what you're talking about. Also, I would like to maybe specify the size of the element"
1704400,1710240," in here. Right. So, let's actually do the size of the element. Right. So, I don't see any errors here"
1710240,1716320," anymore. Right. So, that seems to be fine. So, let's go into the bots. Right. So, bots kind of have a similar"
1716320,1725040," situation. Fly check mod. Yeah. Fly check next ever. There we go. So, this is literally like the same"
1725040,1732160," situation. It's just, the bots don't process all of the player moving. It only focuses on its own,"
1732160,1738720," because bots ignore each other. Right. So, bots basically ignore each other. They only care about"
1738720,1746880," their own states. So, they're only listening to their own IDs. Anyway. So, I think we can copy-paste"
1746880,1753760," some of the stuff from the client in here. Right. So, first of all, we're checking that player moving"
1753760,1760800," header. So, that's the correct thing in here. And then, we're just... Yeah. So, we're reading the count."
1760800,1768560," Right. So, we're reading count and then iterating through all of these things. Right. And we don't"
1768560,1773760," really get the player. Right. So, we don't care about the players whatsoever. The only thing we're"
1773760,1781280," trying to do in here is we're trying to see if the ID is us. Right. If the player is that thing."
1781280,1786640," And if it's that thing, we're updating our own state. So, we're only listening for the emacs."
1786640,1794400," Could you just shut the fuck up? We're just listening to our own state. I'm sorry. Emacs just"
1794400,1799680," being like extra annoying today. So, it's just like having a stroke with all of the auto-completions."
1799680,1804640," Look, I can show you the type of the thing. Just shut the fuck up. All right. So, I don't even care"
1804640,1810000," about the auto-completion that much. The only thing I want to see is the errors in here. Right. So, here's"
1810000,1817520," the player moving. And like, could you just not show that shit at the bottom? For fuck's sake. Anyway,"
1817520,1827680," player view. All right. Okay. So, yeah. Everything seems to be Gucci and Tamaguchi. So, let's actually"
1827680,1837520," now update the server. All right. So, let me enable flight check mode. Holy fuck. Right. So, let's"
1838160,1843760," jump to the first. Okay. So, this one is rather interesting. Right. It failed precisely where I"
1843760,1851520," would expect it to fail. Right. So, in here we would like to... Oh, this one is very interesting. This one"
1851520,1856560," is very interesting. So, first of all, I would like to maybe separate the sending out of the messages."
1856560,1862640," Right. So, here we were basically sending out the messages. Now, first thing I want to do, I want to first"
1862640,1871040," construct the batch once that I'm going to be sending out to each individual player. Right. So, I'm trying"
1871040,1876880," to construct the batch that I'm going to be sending out to everybody. Okay. So, this one is rather"
1876880,1886880," interesting. Whether the player is going to be in that batch depends whether its new moving mask is equal to"
1886880,1893680," its current moving mask. So, right now, like at this particular point, we don't know how many players are"
1893680,1901520," going to be in the batch. So, we can't pre-allocate array buffer. We could try to maybe do some sort of"
1901520,1909440," like a stretchy buffer, like a C-style thingy or I'm kind of lazy to write it right now. So, what I'm thinking"
1909440,1921600," is that maybe I could do something like count zero. Right. So, and then essentially just count how many"
1921600,1928400," of them I have in here. It's kind of dumb, but I mean, it's just like that's the easiest thing to do."
1928400,1933920," So, I want to just like count how many players are going to be, I'm going to be notifying about the rest"
1933920,1941280," of the players. And then that enables me to allocate enough memory for the batch. Pick code. I know. So,"
1941280,1946400," but I mean, it's just like the easiest to do right now. Like I'm too lazy to do something, something smart,"
1946400,1952640," like a stretchy buffers and everything. It's just like, yes, iterate it once. That does not increase the"
1952640,1958880," asymptotic, right? So, because we're not like nesting the loops, right? It's still linear,"
1958880,1963120," right? So, it's still kind of linear in a sense. So, it doesn't ruin any asymptotics."
1963120,1969440," Okay. So, we need to allocate some shit. So, let's do array buffer, array buffer. So,"
1969440,1976720," first we need to allocate the header. Is player just an array? It's a hash map. It's a hash map."
1977840,1984880," So, it maps a number to the player server, right? So, a number is an ID. So, this is because we"
1984880,1989520," basically receive a connection and then people get disconnected. So, it's not a linear array. So,"
1989520,1993760," if it's not a hash map, there are going to be holes in there, right? So, because we're constantly"
1993760,1999840," inserting things and removing things from the hash map. So, it's not that easy actually. Well, I mean,"
1999840,2012480," I could have maybe... So, the thing here is that in the staging moment of the tick, right? So, basically,"
2012480,2016960," the moment when we're just receiving some events and the tick is not processed. I'm going to call it"
2016960,2022720," staging of the tick, right? So, we're just receiving events and stuff like that. At that staging moment,"
2022720,2028720," we are updating new moving every time we receive a notification from the player that the player is"
2028720,2034400," moving, right? I'm a moving event, right? And we're just updating that specific mask. And"
2034400,2043920," what's interesting is that within a single tick, the new mask can be updated to the point that it sort"
2043920,2050320," of circles around and become equal to the old mask again. And in that case, we don't have to notify"
2050320,2059840," anything about this player. So, basically, that can happen when a player just sends rapidly a bunch of"
2059840,2066720," I'm a moving events and then stops. So, within a single tick, the moving mask was changing a lot"
2066720,2072560," and then circled back into the original mask. So, nothing changed, right? So, nothing to notify about,"
2072560,2079600," right? So, because of that, we can't really know up front whether the player needs to be notified about"
2079600,2085440," until we start processing the tick. So, it's kind of an interesting situation. So, I kind of must do this"
2085440,2094400," weird loop to figure out how many players I need to notify about. But anyway, so, let's first allocate"
2094400,2102560," the header, right? So, it's going to be player moving struct and this is going to be the size,"
2102560,2111120," all right? So, then I can do count multiply by the player. So, it's just the player struct. So, I think"
2111120,2118000," it's a player struct size. So, and then I'm going to do data view, right? So, here's the data view and"
2118000,2125280," there we go. So, this is the thing that now we have to fit everything in, right? So, now we have to fit"
2125280,2132480," everything in. Okay, so, first let's set the kind of this message, right? So, to let the clients know"
2132480,2142160," what it is. So, we're going to do kind write view and this is a message message kind player. It's a common"
2143200,2155760," common message kind player moving. Okay, so, and then we have to say player moving header struct count,"
2155760,2161520," right? Now we have to write down the count that we just computed in here, that we just conveniently"
2161520,2170960," computed. There we go. Interestingly, now it's going to be kind of similar, I think, to how we process it"
2170960,2178560," on the client. But instead of reading the elements, we have to be writing them, right? We have to be"
2178560,2185440," writing them. But we kind of need to have an access to the buffer in here and we already shoved that buffer"
2185440,2191760," into the view. So, I feel like I need to maybe separate that. So, let's call it something like buffer."
2191760,2199280," So, let's actually separate them because I want to be able to set views on each individual element."
2200560,2205360," So, because of that in here, since I'm updating only the header, maybe it makes sense for me to"
2205360,2211760," set the view equal to the size of the header, right? So, I'm setting this sort of like windows,"
2211760,2216640," like views and stuff like that. And maybe I'm going to call it something like, I don't know, header view"
2216640,2222880," to distinguish it from the player view that I'm going to be viewing in there. It's actually not that"
2222880,2228240," inconvenient. It's actually not that inconvenient. So, now, yeah, I need to know the index of the player."
2228240,2234160," And the player has already said it's a hash map. So, can I enter for each hash? I can't."
2234160,2239840," Look, I don't have, I can't have an index. I can have a key,"
2239840,2244080," but I can't have an index. Like, I need the linear index."
2248400,2259520," Java. You know, fuck you, index zero."
2259520,2266240," What are you going to do? What are you going to do?"
2266240,2274720," This is my channel. This is my project. I can write whatever shitty code I want."
2275680,2279920," So, I don't think it's going to be working like that. I don't think it's going to be working,"
2279920,2285440," because if you take a look at the signature of for each, like, there's no index in here. You can only"
2285440,2292080," have value and key and then map. So, I don't see it working like that. I'm sorry."
2294320,2300480," So, yeah. So, I'm going to be using that. Like, you can gaslight me into thinking, oh,"
2300480,2304400," you can have an index here. No, no, no, no. I'm going to be writing it like that. I'm going to be"
2304400,2310560," actually writing it like that. So, anyway. Count minus one. I don't want to lose count because I think"
2310560,2316400," it's going to be useful later. Can it be? I'm not sure. Like, I don't want to lose count, right? So, I think"
2316400,2321680," it comes kind of useful. Like, I need an index. And like, I need the index from zero to one, actually."
2321680,2329760," Uh, right. So, chat is triggered. Good. Good. It is very, very good that the chat is triggered."
2329760,2338160," Anyway. So, uh, we don't really have to set the kind in here because we already set the kind, uh, in the,"
2338160,2346880," in the header. So, I can actually get rid of that. So, in here, I can just do the buffer. And the offset"
2346880,2353680," for the buffer is basically going to this. Would not? I think it's going to be that, basically."
2353680,2359040," Uh, right. So, it's a size. And then, instead of count, we're going to be using the index, right? So,"
2359040,2368080," we're just using the index. And here, uh, what are we doing? We are using a player, a struct."
2368800,2378800," A trap, a trap, a trap, a trap, a trap, a trap. Player's struct to the plot. Sorry. So, here, we're going to be writing into the player view."
2378800,2387520," Uh, it's a player view. Yeah, boy. Okay."
2387520,2396240," Damn. Like, I, I'm a little bit scared that I'm going to make a mistake somewhere. So, I need to first test that it"
2396240,2402720," serializes into something. But, I have no idea how to test that. So, the code is already kind of"
2402720,2408640," integrated into the whole system. So, to test that code, I need to, uh, sort of take it out of the code"
2408640,2415280," and just, like, run it separately. But, setting up this sort of staging thing to test it out is too much"
2415280,2421920," time. So, I don't want to do that. So, maybe, maybe YOLO it. Like, let's actually YOLO it. So, if it's,"
2421920,2427040," if it fails, I don't know. I don't know how we're going to be debugging them. Debugging. Well, I mean,"
2427040,2434560," if it's going to fail, we can just print the blob that we got on the player side, right? So, in the browser,"
2434560,2439760," and just, like, parse it visually there or something. So, we can always figure it out. Whatever. Let's just YOLO it."
2439760,2447680," YOLO it. Test in prod. Exactly. Test in fucking prod, mate. Test in fucking prod. We can even do something"
2447680,2454720," like, I don't fucking know, like a console assert that index at this point is going to be good to count, right?"
2455600,2461280," Because, I mean, it's not going to change between... So, the player is probably not going to change"
2461280,2466800," between these two loops, right? Because there is no multi-threading in JavaScript. Well, I mean,"
2466800,2470960," there is some kind of multi-threading, but we're not using it in here, right? So, but I mean,"
2470960,2479440," it doesn't really matter. So, whatever. Okay. So, now, look, we have a linear loop in here. We have a"
2479440,2486720," linear loop in here, and once we prepared that single buffer, the only thing that is left to do in here"
2486720,2494400," is to just send that single buffer to each and individual thing in here. So, we don't even have"
2494400,2501680," to call it other player, so we can just call it a player. So, now it looks like, it looks like a linear"
2501680,2511280," algorithm. Well, at least there is no nested for itches in here. So, bitches get for itches!"
2511280,2526160," So, right, so there is no nested for itches in here. So, but it's still kind of square, because the size"
2526160,2534240," of that blob, the size of the buffer is growing linear proportionally to the amount of players."
2534240,2540640," So, essentially, the amount of bytes that we're sending, it's still square,"
2540640,2547280," but the amount of messages that we're sending now is linear relative to the players."
2547280,2555760," So, great to see no nested WS spam. Yeah, so that already kind of looks better, right? So,"
2555760,2561120," technically it is still square, technically it is still square, because the buffer grows"
2561120,2566800," linearly to the amount of players, and then we're just sort of sending it for each player. But"
2566800,2574480," there's no nested in here. So, TexasJack666, thank you so much for a tier one subscription. Thank you,"
2574480,2578160," thank you, thank you, thank you. Oh, shit!"
2582880,2587280," Okay, everything seems to be compiling. I don't know if it's going to work or not, but we'll see, we'll see."
2587280,2593440," Damn, that's some ugly-ass code! That's some ugly-ass code."
2594800,2598560," Um, yeah. Interesting."
2598560,2604000," Let's give it a try, maybe. Let's give it a try. So, let's actually restart this."
2604000,2611360," So, does the server... server works? I think it's... okay, so that seems to be working. So, let's actually"
2611360,2612720," go here."
2615520,2623440," I can move around. So, I'm going to actually open DevTools, just in case. I'm going to open DevTools"
2623440,2633040," and refresh it one more time. All right. So, it's teleporting a little bit, but not that much, I think."
2633600,2639840," Okay. I don't know why. Let me go to the client. One of the things I want to do..."
2639840,2649840," I want to do console. Hola! So, let's actually put this kind of thing so we can see the message and I want to"
2649840,2655040," basically print the amount of accounts. Like, how many of these things do we receive? Do we receive this"
2655040,2670400," thing at all? Okay. Wait. Is it getting... It's getting spammed, brother. What the fuck? Wait. That is..."
2670400,2682000," That is sus. Why is it getting spammed? I think I know why. Bro. Okay. Listen. So, let's do the following thing."
2683760,2686480," if count is greater than zero."
2686480,2698480," Okay. Technically, we can send a batch with the size zero. Right. So, technically we can do that."
2698480,2704080," So, we probably want to do something like this. Okay. Okay. Okay. So, good. Good. So, we're finally"
2704080,2709280," testing something. We're finally testing something. So, it's going somewhere. It's going places. I'm happy."
2709280,2718480," I'm really happy about that. All right. Let's go. Let's go, brev. Okay. So, it's not spamming them"
2718480,2724960," anymore and it just says that there is one player updated in here. Okay. That's cool. So, now let's go ahead"
2724960,2731440," and open the second player. Right. So, there's still one player being updated in here. So,"
2732640,2741440," I can't remove them simultaneously. There's something bizarre going on, but whatever."
2741440,2748640," So, let me get rid of that login. Let me get rid of that login and maybe, hopefully,"
2749360,2755440," we'll be able to... So, the ping is kind of sus, honestly, but I mean, it's fine."
2755440,2762560," I wonder if ping also depends on the server's FPS. Right. So, what's the server's FPS? It's actually 60."
2762560,2772560," What if I make it like 120? Right. Because, look, the server actually synchronizes with the FPS. So,"
2772560,2780560," and it responds to the pings within a single tick. So, if the target FPS of the server is actually"
2780560,2786960," very small, so it also will affect the ping. So, technically, the ping is kind of artificial. Right."
2786960,2792800," So, if I said FPS higher, the ping is going to be actually much better. Yes. Look at that. Well, I mean,"
2796560,2806080," is it improved? Nah, it's still kind of bad. But anyway. So, let's try to send some bots. Right. Let's"
2806080,2812880," try to send some bots. And let's actually start with maybe a small amount of bots. Let's start with 30 bots."
2812880,2818080," 30 bots. And see if it's going to survive 30 bots."
2820560,2831600," Uh, okay. That looks okay. The bots are moving. The bots are working. The bots are working. Uh-huh. So,"
2831600,2838800," something is lagging, but the ping is fine. That's what's weird about that. Right. So, something like,"
2838800,2845920," it's probably my laptop. Ping is fine. Ping is totally fine. Okay. So, let's actually kill all of that. And"
2845920,2863440," let's increase this entire thing by 100. Uh, let's start with 100. All right."
2863440,2872400," Okay. So, the first connection was kind of difficult. The first connection was kind of difficult because the"
2872400,2878480," player joint is not batched. So, we have to kind of batch the player joint as well."
2878480,2884880," Uh, I think JIT just kicked in. I think JIT just kicked in. It's actually became faster."
2884880,2893840," All right. So, what about 150? So, we'll be able to process the 150. Player joint. Yeah, player joint."
2894480,2903200," Okay. Yeah. So, when it's processing player joints, wait. What the fuck with this ping? Are you telling"
2903200,2911520," me that it's... Yo, it is better. So, I mean, at 150, it was unbearable. It was one second. Now, it's..."
2911520,2917520," Yeah. So, it's actually handling them. So, it was the square algorithm. It was actually the square"
2917520,2925840," algorithm. Holy shit. Joining is still very painful because the joining is not batched. But, uh, moving"
2925840,2932160," around is actually fine. All right. So, let's actually kill... I think left is... No, left is actually super"
2932160,2944160," fast. So, what about 200? Uh, 200 of these focus. Okay. So, yeah. It's... So, because it sends joined"
2944160,2954800," one by one very, very slowly and only then once the... It handles 200. Yeah. Currently player 200 in..."
2954800,2964960," So, it was the square algorithm, actually. It was the square. So, my hypothesis was correct. So,"
2964960,2972000," it can actually handle the 200. 1000. Let's actually ramp it up a little bit slower. To be fair,"
2972000,2978960," I would like to first maybe batch player joint. Because right now, like, look at these joints."
2978960,2986160," Look at these joints. Like, they're unbearable. Like, player basically... Like, the servers get stuck"
2986160,2992160," until it processes all of them. All right. So, it kind of gets stuck. And only then, once it processes all"
2992160,3000320," the player joints and it continues working properly. All right. So, let me... Control-C this entire stuff."
3000320,3005440," Uh, TexasJack666. Thank you so much for five community gifting subs. Thank you. Thank you. Thank you."
3005440,3009600," I don't get any money from that, but I mean, some people will now have the access to the server,"
3009600,3019680," to the Disco server. Hmm. Okay. So, batching events is actually a good idea. I really like that. So, it is,"
3019680,3027600," in fact, a good idea. Damn. So, and this is on my, like, shady laptop. When we deploy that to your mom. Hmm."
3027600,3033680," So, batching player joints makes sense. I just like seeing it fall over before fixing."
3035440,3039680," Uh, all right. So, I already assume for one hour. Let's actually make a small break."
3039680,3046640," And after the break, we're gonna batch the, uh, joints and see if it just improves the, like, you know,"
3046640,3052800," the, the stat of the, uh, of the bots. Right. So, and then we're gonna try to deploy it to your mom and"
3052800,3058000," see how it will withstand the, the viewers. I suspect we don't really have that many viewers right now."
3058000,3062960," Actually, we have a relatively decent amount of viewers. Right. So, maybe, yeah, maybe we'll,"
3062960,3071840," uh, have at least 200, uh, you know, players, uh, in this entire thing. So, uh, so, urcgod,"
3071840,3076720," thank you for the stream. But I'm, but I'm programming in JavaScript right now. How?"
3076720,3087680," I, like, I really appreciate, uh, people admiring what I do, but I do not affiliate myself with any of the"
3087680,3093360," languages. Right. So, like, intentionally, actually, I do not affiliate myself with any of the languages."
3093360,3098880," Uh, so, I consider myself, uh, a computer programmer. Right. So, I program computers. Right. So, I program"
3098880,3106160," computers. Right. Regardless of the language or anything like that. Uh, okay. So, Sora Kadatsuma,"
3106160,3112080," thank you so much for, uh, 400 bits with the message. Finally, I caught the stream. You do awesome, awesome"
3112080,3117360," work. Uh, excited to see how the multiplayer game turns out. I'm also excited to see, right. So, because I'm not sure,"
3117360,3123360," um, I never done anything like that before, and I'm honestly a little bit scared because one of the"
3123360,3130480," things I want to do is to make it, like, public, like, uh, deployed somewhere so people can just"
3130480,3136640," play it at any time. Uh, right. So, I never really maintain these kind of things, uh, myself, uh, right."
3136640,3142320," So, as an individual. So, I'll see how it will work out. So, I'll probably have to learn how to use, like,"
3142320,3147920," cloudflare for, you know, for security and stuff like that. So, we'll see, we'll see. Ormas Baxter,"
3147920,3151760," thank you so much for telling us the question with the message. Hello, hello, hello. All right. So,"
3151760,3159600," let's make a small break. And, um, okay. So, we batched the player moving, uh, messages. So, we need to now"
3159600,3164640," batch the player joined. So, what's interesting is that if I'm going to start, uh, batching the other"
3164640,3170480," messages, the, the headers of those messages are going to have basically the same structure. They"
3170480,3175760," all going to have, uh, kind, they all going to have count, and the only difference is going to be is"
3175760,3181120," that they're going to have different, uh, you know, sizes of the elements. So, what I'm thinking is that"
