start,end,text
1503880,1510280," bleep. That's pretty cool. Honestly, that is actually pretty cool. Uh, right. So I suppose now, uh, what we have"
1510280,1515160," to do, we have to organize the sort of like a loop, uh, right. So it's actually going to have some sort"
1515160,1520520," of a variable, right? So, which we're going to set to true when we encounter like SDL quit event or"
1520520,1529480," something. Uh, right. So while not quit, and there should be some sort of like, um, and like pulling an"
1529480,1535640," event or something. I don't quite remember. I haven't worked with SDL for quite some time already. So, so far,"
1535640,1542520," it's literally SDL too. Like, I have no idea why they needed like a major version that is backward"
1542520,1549320," incompatible, I presume. So maybe they added more like, uh, functions for primitives, right? Because"
1549320,1553560," one of the things I remember, SDL didn't really have that many functions for different primitives"
1553560,1559400," and stuff like that. Maybe it's now as feature for us, for example, ready. Who knows? I don't freaking know."
1559400,1564600," We'll see. We'll see. Uh, right. So let me, let me actually take a look at this entire stuff. So what I"
1564600,1569640," wanted actually, uh, yeah, I wanted to pull the events. So it should, should be something like, um,"
1569640,1578680," poll events. Uh, okay. So there's a pump events. Okay. So here is the poll events. Uh, that's pretty cool."
1578680,1592520," So the way it works. SDL, uh, events, uh, here's the events and we're pulling the event. I don't"
1592520,1601320," remember what it returns. So the return true. If this got an event or false, if there are no, uh, non available."
1601320,1608520," So essentially you usually have like a separate loop in here that sort of drains the, uh, the poll queue,"
1608520,1613240," right? So we're pulling the events while they're available and we're looking for different events."
1613240,1620600," And if I remember correctly, uh, event has like a type field, right? So it has a type here. It is."
1620600,1627800," Look at that. So here's the type. And one of them is, I think, SDL quit, right? So there is SDL quit"
1627800,1635880," event of some sort. We can even grab it. SDL quit. Uh, here it is. Right. So SDL quit. So you receive"
1635880,1642680," this, um, event when the user closed the window or something like that. So if event, um, you know,"
1642680,1648840," type equal SDL quit, in our case, we can just put quit to true. And that's about it. So usually here,"
1648840,1654840," I suppose what you have to do, you have to like initialize, maybe just draw some stuff, right?"
1654840,1659400," And then swap the, uh, the buffers, right? Because you have a double buffering and stuff like that,"
1659400,1663640," but we're not going to be doing that for now, at least. Uh, anyways, so let's actually try to rebuild"
1663640,1669720," this entire thing and it didn't work. That's fascinating. Uh, right. What does it say? Oh,"
1669720,1677000," is that a deprecation? Is that how they deprecate? SDL quit renamed SDL event."
1680520,1687000," Is that what they created a new major version for just to rename SDL quit to SDL event quit?"
1687000,1691480," I'm joking. There's probably more reasons too. Yeah."
1691480,1703880," Uh, finally, we finally encountered first backward incompatibility. Holy fucking shit. Brand new library,"
1703880,1710280," brand new library. This is the planned obsolescence at its finest. I swear to God."
1710920,1715080," But I mean, probably there are more reasons to create a, like a major incompatible library,"
1715080,1722360," but anyway. Also, uh, can we just talk about how fucking creative this is, uh, to deprecate a name?"
1722360,1725800," Um, that is fucking creative."
1725800,1732840," So, and like, why don't you just support SDL quit? Is that because SDL quit is going to be used for"
1732840,1737560," something else? No, it's not used for anything else, otherwise you won't be able to create this sort of,"
1737560,1745080," like, clutch. Like, why not, like, this is something that I don't understand. Like, why not just allow that to be a thing?"
1745080,1752920," Right. Like, what's the point of deprecating such a, like, a harmless name? Uh, I don't freaking know,"
1752920,1761480," but whatever. So now it is SDL event quit. Okay. Sure. Sure. Sure, buddy. Uh, now it is SDL, uh,"
1761480,1765320," event quit. We'll be able to compile this shit. Okay. Look at that."
1765320,1773640," It doesn't clean anything, right? So, but it's a window. It's a window, nonetheless. And again,"
1773640,1784360," this thing depends on the NSDL 3. NSDL 3 by itself does not depend on anything. It's probably, literally,"
1784360,1791320," does DL open, like, searches for different, like, assos on your machine, and, uh, you know,"
1791320,1796280," does DL open for them. We can even try to check that. Can we S trace this mother flipper?"
1796280,1798760," This is a very cool question. Like, S trace."
1798760,1813560," Okay. I guess we're back. Uh, so sound is working. Everything seems to be working, hopefully. Um,"
1813560,1819640," this is something that I didn't expect is going to happen on today's stream, that SDL somehow is going"
1819640,1825640," to kill, uh, our entire system, but that's exactly what happened. So that's something new in SDL 3."
1825640,1832120," Uh, it doesn't allow you to S trace itself, right? So it has a S trace prevention mechanism."
1832120,1841880," Um, that's very cool. Um, yeah, that's SDL 3 for you, everyone. That's SDL 3. That's,"
1841880,1848360," that's pretty fucking cool. Uh, so let me restore my entire setup, right? So, because I have had a very"
1848360,1854440," specific setup and everything, uh, just a second, everyone, we're back. We're, okay. Thank you. Thank"
1854440,1865000," you so much. Uh, right. Let's not do that again. Okay. So let's not do that. So we're going to just assume"
1865000,1872680," that it does search for DL open and stuff like that. Uh, all right. So yeah, that's pretty cool. Um,"
1872680,1878360," um, so SDL 3 is so dynamic. It crashed the stream. Exactly. That's so fucking dynamic. Like I didn't"
1878360,1883400," expect that. Like how, how the fuck can you even crash the whole thing? Like it blocked all of the"
1883400,1891800," inputs. Like I couldn't do anything. Uh, but that's SDL 3. That's another new thing in SDL 3. Uh, right."
1891800,1897720," So I think we, so far we encountered three things, right? First of all, it doesn't depend on any DLLs."
1897720,1905720," Somehow it still works. Uh, second is that they renamed SDL quit to SDL event quit, you know, worthy of"
1905720,1911160," another major, uh, you know, version. And another thing is that if you try to understand how it works,"
1911160,1915800," it fucking crashes your entire machine because you're not allowed to understand that it's a trade"
1915800,1921320," secret, how they achieved no DLL dependencies. You're not allowed to fucking know that even"
1921320,1927080," though it's open source library, but it's a trade fucking secret. Let's not do that. Let's not go"
1927080,1931400," into the details about how exactly it works. Maybe it already stole all my data. I don't fucking know."
1931400,1937000," So anyways, uh, right. So what do we have in here? So we managed to create the window and stuff like that."
1937000,1942520," There should be some sort of a way to clear the window. I do remember that, uh, there was some sort of"
1942520,1950520," way to do that. Uh, let's go into the headers. Uh, right. So SDL three includes and, uh, let's grab,"
1950520,1957000," I think it was something like a render clear. If, uh, my memory serves me correctly. Yeah, there we go."
1957000,1965320," So, uh, render clear, it's not even wait. I'm looking at the wrong place. Honestly, here is the render clear"
1965320,1974440," and you have to specify the renderer. The renderer, uh, right. So we do render clear. Maybe you also have to,"
1974440,1984760," well, it doesn't have to be a pointer. It's already a pointer. Uh, right. So set, um, clear, set render clear."
1986200,1997160," Was it a clear color? Uh huh. So, um, so set the color, set render draw color. Oh yeah. Yeah. Yeah."
1997160,2002360," I kind of vaguely start to remember this bullshit naming. Um, yeah. So here's the renderer. So we're"
2002360,2008040," going to actually set, I suppose, maybe red color. So this one is going to be zero. This one is going to be"
2008040,2015400," zero and alpha is going to be something like that. Okay. And, uh, let's actually, um, you know,"
2015400,2021480," swap the buffers. So there should be something, uh, to swap the buffers. Is there anything to swap the"
2021480,2025640," mother flipping buffers? Swap buffer. Uh, okay."
2030440,2039240," There's something for EGL, but just generally I didn't see anything. Is there something like swap? Um,"
2039240,2057720," so there's a video. Well, I mean GL. Um, so there's a render. I honestly don't see anything."
2059080,2063960," Maybe I don't even have to do anything then. GPU swap."
2063960,2076680," Don't see anything. So swap window found it, but it's a GL. That's the thing. Um, it's all a GL."
2076680,2084360," Uh, but we're not doing open, but maybe we have to do open GL. Right. So, okay. Let's try to do that"
2084360,2093160," without the GL. Uh, right. So I'm going to do just build and just run the whole thing. Uh, right."
2093160,2098040," And it didn't work. Right. So, because you do need to swap the windows and then, uh, we have to do"
2098040,2105880," something like SDL, uh, GL swap window. Right. And we have to provide them with, I don't think that's the"
2105880,2112440," case. Yeah, it's not the case. Right. Otherwise it would be red or something. Uh, right. So let me"
2112440,2120040," actually see. So SDL three, um, example tutorial. Okay. Uh, because I don't quite remember. I don't"
2120040,2124840," quite remember. Also we've got some subs. Let me acknowledge the subs. Uh, right. So thank you so much."
2124840,2130600," Uh, Krusty for tier one subscription, uh, with the message panger, waving panger. Uh, so thank you so"
2130600,2135800," much. Gigantify for emotes. And thank you so much for gifting subs. Thank you. Thank you. Thank you."
2135800,2140520," Really appreciate that. Okay. Beginning guide programming version three. Okay. So tutorials front page."
2140520,2150200," Just show me like, I don't give a shit. Ah, simple example. Brofsky. Okay. SDL two, but SDL three."
2150200,2157320," What about SDL three. Okay. Let's take a look at this deal too. Maybe it's the same. Fuck you. Right."
2157320,2164680," I never even interacted with that, uh, with that window. Okay. Uh, SDL two tutorials. Um, okay."
2164680,2174040," Okay. Basic data obstruction. What the fuck is data obstruction? Where is the SDL?"
2175720,2184360," Oh, okay. So setting up a window. Okay. Uh, I don't see the loop. Where is the fucking loop?"
2184360,2190760," This is not the loop. There's no even loop. How is that? This is horrible. Where are,"
2190760,2193800," okay. So there was some events and shit. Um,"
2193800,2203960," which shit tutorials? What the fuck is that? Get window. Like, this is not how you do SDL dummies."
2203960,2210760," Okay. You know what? Fuck you. I'm going to look at my SDL two code. I do have a deal to quote"
2210760,2216360," because for example, soon is actually implemented in SDL. Right. So how did they do that in there?"
2216360,2220840," I don't fucking remember. Right. Because again, I don't keep that information in my head. Right."
2220840,2226440," Because I have to store a lot of information there. Uh, right. So because of that, I may not remember"
2226440,2234840," how to work with certain libraries. Uh, so is that a swap or is that something? RENDER PRESENT. Holy"
2234840,2241400," shit. Freaking naming. Okay. So I think that's, that's how it's called in SDL three as well. Right."
2241400,2247480," It must be right. Because the only thing they changed is SDL quit. Uh, right. It didn't. Yeah. So,"
2247480,2256200," okay. So there is SDL present. Um, okay, cool. Uh, it's not swap. Should have called it swap,"
2256200,2261720," honestly. Right. Should have called it swap because everyone at the standard does swap. Uh,"
2261720,2266520," right. So what's the point of, yeah, finally, fucking finally, we've got a window. Nothing"
2266520,2273560," changed. Uh, at least like from the, you know, API point of view, the only thing we see changed this"
2273560,2279800," thing, but internals, I suppose change because again, DLLs are like searched differently. Um,"
2279800,2287640," so that's kind of interesting. Okay. So let's actually try to maybe, uh, draw some interesting things now."
2287640,2296040," So it was going to be 18, 18. Uh, right. So let me find, there should be something like a"
2296040,2306840," feel wrecked. Chat, chat, chat, chat, chat. Do you feel wrecked? So, oh, there is a old names."
2306840,2317720," That's very cool. Okay. So, and what about this deal quit?"
2317720,2325720," Wait, I could have used SDL quit if I included SDL old names."
2326360,2334280," I can do that. Wait, wait, wait, wait, wait, wait, wait, wait, wait, wait, wait, wait, wait, wait, wait,"
2334280,2338840," I can't do that. But what if I include old names?"
2338840,2347800," Old age. Uh-huh. Still can't do that, but maybe that just means I have, don't have to include that."
2348920,2358600," And that, how do I fucking use old names? Definition to ease, to ease transition from SDL to the new"
2358600,2364280," function names are recommended, but if you want to have the old names available while you are in the"
2364280,2369480," process of migrating code to SDL, you can define, enable old names."
2369480,2384760," Let's define this stuff. So I suppose this is how it works. Holy shit. Fuck SDL. You can use SDL2 code with SDL3?"
2389240,2394840," Okay. So let's not do that. Right. So let's actually move forward. Let's not be stuck in the past."
2394840,2401720," Uh, right. So let's not be stuck in the past. So this is SDL event. Let's fucking go."
2401720,2411480," Uh, yep. It's pretty cool. Okay. Um, so render. So fillRect. Uh, this is how you do fillRect. So"
2411480,2422760," render, fillRect. And it's actually fRect. I don't remember fRect. Is that a floating point rect? And so,"
2422760,2432600," which implies that there's also integerRect, huh? Wait. Is integerRect literally called iRect?"
2432600,2445080," No fucking way. Okay. Let's go. All right. So there's fRect. So here's the fRect. Cool."
2445080,2450760," Uh, so there should be integer. Uh, yeah. I was just called rect. Okay. Okay."
2452760,2459400," Fully IRect. Yeah. They missed such a good opportunity. Holy fuck. They missed an opportunity"
2459400,2470120," called IRect. E-Rect. Yeah. So it should be E-Rect. Yeah. So E-Rect. But what E stands for?"
2470120,2478280," What kind of type is that? Integer. It's not integer. But anyways, uh, right. What we want to do,"
2479000,2487480," uh, wanna fill the rect. All right. We wanna fill the rect. Let's actually put this tab in here. Uh-huh."
2487480,2495800," And what kind of rect are we going to have chat? Right. So here is the rect. And I suppose,"
2495800,2500600," in terms of x, it's going to be maybe half of the width of the window. Right. So we're going to have"
2500600,2506520," width. And let's take half of the width of the window. Uh, so maybe we can extract this kind of stuff."
2506520,2513240," So it's going to be width and height. Width and height. Width and height. And, uh, width is going to be"
2513240,2519240," this kind of thing. And height is going to be this kind of thing. Uh, right. So that means, that means,"
2519240,2526440," uh, we can have something like this. So this is going to be height. Uh, so now what I'm thinking,"
2526440,2538360," actually, I think it would make sense to, uh, uh, define width in here. Um, so sdlf rect. Yes. It's just,"
2538360,2545480," uh, you know, this. And let's define something like 100. So it's going to be 100 by 100. And then here,"
2545480,2554360," what we can do, we can quickly sort of like replace this kind of thing. So it's a x, uh, center of the"
2554360,2563000," window, but minus, uh, this thing also divided by two. Right. So all of that is floats. So we don't"
2563000,2568680," really have to worry about all of that stuff. But I mean, here, we probably have to do this thing to not"
2568680,2574760," lose any precision. Uh, in any case, I think it makes sense to actually make all of them floats."
2574760,2584760," All of them floats. Maybe it would be even better to put some sort of a parenthesis in here. Right. So"
2584760,2589160," you can move all of that stuff outside of the parenthesis. Right. That way you even lose less"
2589160,2595080," precision. Maybe. I don't know. Maybe. I don't know if that's the case. But, uh, anyway, so here's the"
2595080,2599640," renderer. We have to supply the renderer in here, and we have to supply the pointer to the rect."
2599640,2606120," And that should draw a rectangle at the center of the window. Right. So that's what should happen. But"
2606120,2617800," it didn't happen. Surprisingly. I have no idea why, though. Am I going fucking crazy, mate? What if I just..."
2618920,2628600," I forgot color. You're right, chat. So we have to... We have to set render... Actually, yeah, I said..."
2628600,2636280," I should set it in here. And then I have to set it to something like red in here. Yeah. There we go."
2636280,2641400," Here's the... Here's the return. Here's the thingy-ma-jingy. How about that? So, so far, it's just like, yeah,"
2642200,2647720," it's a slightly different interface, and I don't really understand why, but that's what it is. So,"
2647720,2655160," does it have more interesting shapes to draw? Right. Can I do circles? Because I remember... Does it..."
2655880,2657400," It still don't have circles?"
2657400,2670520," What's the... Ellipse. Okay. So, ellipse..."
2670520,2679560," 10 years of date, and we still don't have... Exactly. It's an unsolved computer science, bro."
2679560,2690120," What exactly changed? Oval... Okay. Oval... No. What's the point of this release? Like,"
2690120,2695400," can anybody explain to me, like, what's the point of it? Like, what's new? Okay. So, let's actually"
2695400,2702280," Google it. What's new in SDL3? Because this is not immediately apparent. Okay. So, here are new features."
2702280,2708200," Right. So, here are new features. So, if you've got an SDL2 app, you might be wondering why you should move"
2708200,2716520," to... Exactly. That's a good question. Thank you. So, a lot of things you've already used in SDL2 are easier,"
2716520,2723480," more consistent, and just generally better in SDL3. So, the upgrade can be worth it in any case,"
2723480,2728680," but here are some things that are new features in SDL3. Extremely good documentation."
2731080,2739320," Example programs to get you started. How is... What? More consistent API naming. You know, so,"
2739320,2747400," more consistent API naming equals changed names. Like, it doesn't matter that naming is better or"
2747400,2752120," anything. No, no, no, no. You created problem by changing names. Okay. Syphon said something"
2752120,2757880," interesting. From my experience with SDL3, it's just a simverb bump to make the API more consistent."
2757880,2765560," I see, but... I don't fucking know. You could have just, like, added more consistent naming on top of"
2765560,2772760," SDL2 while preserving inconsistent names. So, the old code works, but the new code just uses consistent... Like,"
2772760,2776760," I don't fucking understand. This is so bizarre. But anyway, so, let's actually keep reading."
2777960,2782360," So, more consistent by naming. Everything is named consistently across the API now instead of blah,"
2782360,2788280," blah, blah. Okay. Rules about memory management are more clear in SDL3. What happens if I query"
2788280,2793960," device name and the device name is unplugged before I can touch? Okay. This is something that you're..."
2793960,2798920," When you're using SDL more, like, seriously. Right. So, when you're developing, like, actual games and"
2798920,2804760," stuff like that. Maybe the actual improvement is apparent when you, like, developed a complex game in"
2804760,2812920," SDL and some subtle details that are very difficult to fix in SDL2 are actually fixable by making backward"
2812920,2819960," incompatible release or something like that. So, GPU API access to modern 3D rendering and GPU compute in,"
2819960,2824040," like, across... Okay. So, this one is interesting. So, is it cross-platform way of doing that?"
2824040,2827640," So, create GPU device. Ooh, this one is interesting."
2828280,2832440," So, GPU context. So, I can do compute shader..."
2832440,2841800," I can do compute shaders and scheisse. Can I do computer shaders and scheisse? That sounds"
2841800,2847080," fucking interesting. That sounds fucking dope. Okay. The GPU device."
2847080,2859000," Upload create GPU shader. Create the shader to be used when creating a graphics pipeline."
2859000,2868200," So, okay. The shader resource bindings must be authored to follow a particular order depending on the shader for"
2868200,2879240," SPRE. Okay. So, and it's abstracted away from a specific GPU API. That's so cool if I can hate the OpenGL."
2879240,2884280," Well, I mean, it could be just like OpenGL, but rebranded, right? So, it doesn't mean that you have to deal with"
2884280,2891960," less bullshit. Right. So, it's just sort of like an abstraction layer on top of different GPU APIs,"
2891960,2899480," like OpenGL, Metal, DirectX, and stuff like that. Right. So, okay. Okay. This caught my attention,"
2899480,2907800," actually. GPU. GPU API. That sounds interesting. So, Dialog API. Access to System File Dialogs like a..."
2907800,2910280," Oh my god. This is fucking classic."
2910280,2921320," The Select File Dialog. The fucking unsolved computer science problem. Holy shit. Because remember from the"
2921320,2928280," RayLip release. If you want to know what I'm talking about, like go watch the, like where we looked into"
2928280,2941080," the RayLip release. We can re-select files. Let's fucking go. This release is crazy. Actually, on that"
2941080,2950840," stream, I added to my to-do list to look into SDL3. Right. So, if you want to know what I'm talking about,"
2950840,2956200," watch that, that thing, we actually explored like dialogues there extensively, more or less."
2956200,2961160," So, I'm going to put that stuff in here. Okay. And obviously, I think I want to put the new features"
2961160,2969560," in here. So, here's the new features. Right. So, File System API. Simple directory management and globing."
2969560,2975480," Access to topic-specific user folders. Huh. That's interesting. Storage API. Abstract interface to"
2975480,2984120," platform-specific storage. Ooh. Does it imply that maybe, yeah, maybe SDL actually kind of implies that it"
2984120,2990280," may work in WebAssembly. Right. And by doing that, you kind of access like a local storage of the browser"
2990280,2995480," or something like that. Yeah, that sounds interesting. Camera. Access to camera, to web cameras."
2998680,3007400," So, that's okay. This is the new thing. Pan API. Like, what? You can create like a drawing software."
3007400,3014840," Oh, right. Like, I already respect that. This is actually super cool. The new APIs. Right. So,"
3014840,3022200," logical audio device. Audio streams. Right. And does it have mixing? It finally can do mixing by itself"
3022200,3027720," without additional library, without SDL mixer or anything like that. Holy fucking shit. Like,"
3027720,3038280," it can mix things by itself. That's insane. So, asynchronous API for reading files, time API processes,"
3038280,3049800," process API, color space support. So, better keyboard input. Yeah. Unicode friendly stuff. App metadata."
3049800,3055720," Yeah. That's all pretty cool. I suppose. Okay. That's an improvement then. Right. So, that's an"
3055720,3060280," improvement. So, additional APIs and stuff like that. That's very awesome. So, but the thing I'm interested"
3060280,3067240," in is actually GPU API. All right. So, the GPU API offers a crowd plumber way for apps to talk to modern"
3067240,3076280," graphics hardware. It offers both 3D graphics and compute support in a style of Metal, Vulkan, and Direct3D 12."
3076280,3083080," That's so fucking cool. So, now I can just have a consistent API for all of these APIs and it's just like,"
3083640,3092760," Yeah. I really like that. So, do they also have their own shader language? That is a very interesting"
3092760,3099400," question. Yeah. You know what? I think we're going to look into that because that's the most interesting"
3099400,3103160," part of this entire thing. Right. So, the rest of the stuff is kind of cool. Right. I'm going to keep"
3103160,3109480," that in mind, but this one is interesting. Right. So, why compute in quotation marks?"
3110280,3117480," Compute support. I don't really know. Maybe it's not real compute. Maybe it just executes that on CPU."
3117480,3125400," Or maybe it doesn't actually compute anything. They do. It's supposedly similar to JLSL without footguns."
3125400,3131880," Holy shit. Okay. We should have started from that. This is awesome. Wow. Okay. So,"
3132680,3140760," You know the XKCD with standards, right? So, XKCD competed in standards. Right. So, we have this kind"
3140760,3148920," of situation now. Right. So, we had OpenGL, Direct3D, and Metal, Vulkan, and stuff like that. So,"
