start,end,text
0,13500," All right, all right, all right, all right, all right, hello everyone and welcome to yet another"
13500,23740," offline stream while I'm on vacation, vacation, I don't speak English, I'm sorry, I'm trying to,"
23740,31900," all right, so today is Saturday, the day of the Saturn, right, that means today according to the"
31900,39980," schedule we're doing a game development in OpenGL and C++ as usual, so we continue to develop our"
39980,47940," game, so this is how the game looks like so far, so it's using OpenGL, it doesn't use any engines or"
47940,51760," anything like that, well, you may say that I'm using a custom engine, it just depends on the"
51760,57320," perspective, right, so from one perspective I'm not using any engine, from another perspective I'm using"
57320,62700," a custom engine, it just depends on how you look at it, you know what I'm talking about, yeah, so and"
62700,72140," this custom engine is actually pretty cool, so it's a rewrite from PureSDL2 and in PureSDL2 we were not"
72140,78640," able to actually do this kind of effects where you can make an object shatter into like pieces and also"
78640,84200," pieces maintain the textures and stuff like that and they also disappear because it's not really easy to"
84200,92240," do in PureSDL2 because PureSDL2 doesn't really provide you that much power, so we have to we had to go a"
92240,99360," little bit lower in the abstraction layer because SDL is built on top of OpenGL, DirectX and Metal, so we just"
99360,108760," went layer down, OpenGL and we unlocked a lot of computation power that we can finally use in our game and I'm super happy actually, I'm super super happy."
108760,121320," Alright, before I start, I would like to actually shout out people who were donating while I was still on vacation, so first of all,"
121320,138320," Jaime Covey, thank you so much for $5 donation, Shredding gives up, he donated it like while while I was offline when I was not even recording or anything like that, thank you, thank you so much. And also, I got a new Patron,"
138320,144880," on the Patron, on the Patron, thank you so much Susan Sun for a generous 20 euros"
144880,159760," Patronage? I don't even know how to call that, I quite rarely use a Patron, so I do have a Patron and I had it for quite some time, I sort of reserved it for my main YouTube videos and my main YouTube channel."
159760,170320," So, in any case, thank you. So, if you still want to support me, I'll leave all of the links, all the support links in the description."
170320,199880," So, let's start our development. You can find the source code of the game that we'll be developing on the GitHub, so the game doesn't really have any particular name. So, that's why the repo is called like that. So, but game source code."
199880,216440," You can find the source code in here. If, of course, you are interested. If you're not, you can just watch me making pretty pictures. Well, it doesn't really look that pretty. I don't know what I mean. Maybe at some point it's going to look interesting, but right now it is not. It is not."
216440,228680," But, okay. So, let's go to the source code and see what we can do. I think I had a couple of issues. I think I had a couple of issues that I wanted to resolve."
228680,248400," Yeah. Recently, we actually refactored our renderer, right? Our renderer is capable of rendering different things, specifically triangles. You can provide the geometry of a triangle, the color of a triangle that will be mixed in into the texture and UV coordinate of the texture."
248400,258400," And then, you can also provide a program with which you want to render that triangle, right? You can switch between different programs and stuff like that."
258400,276400," So, and by the way, the texture coordinate is taken from our texture atlas. So, all of the textures are consolidated into a single texture atlas. And also, calculated their UVs. So, you have to provide the UV coordinate inside of the texture atlas. So, essentially, that's what you have to do."
276400,304600," So, we can also render a AABB, access align boundary box, but it's essentially implemented in terms of field triangles because it just takes AABB and splits it into triangles. And we also had a circle. We also had a way to render a circle. And I'm not even sure. Well, so essentially, the way we rendered circles, right, the way we render circles, we used to render circles, actually."
306400,325220," So, it's the following. I just opened my paint and accidentally closed it. It's a shame that my paint closes faster than it opens up. Anyway, so, we usually just render a quad, right? We usually just render a quad."
326340,342880," So, inside of a shader, right, we also sort of set up its UV coordinates, right? UV coordinates from 0 to 1, 0 to 1. And then we pass all that information to the fragment shader. And in the fragment shader, we already calculate the distance from the center of the squad."
343120,351380," And we simply draw the circle, right? Usually, I mean, it's filled in, right? So, this is how we usually do that."
351380,361760," But then, like, we refactored everything and making, like, allowing the user to actually just render AABB in triangle and just specify the program that you want to use."
361760,373720," So, I feel like this particular function is sort of obsolete because now you can essentially just draw AABB with a special circle program, right?"
373720,377720," You just need to write a special circle program and just draw the regular AABB."
377720,381540," But the cool thing about this function is that it doesn't accept AABB."
381900,385460," What it does, it accepts the center and the radius."
385460,393480," So, what I'm thinking is that maybe we're going to retain the signature of this function, but we're going to rename it a little bit."
393480,399000," And the thing that this function is going to do, it's going to simply take a point, the center, right?"
399000,403240," Then, take the radius. Let me actually switch the brush."
403240,408320," Take the radius, go up, and then go another radius in here."
408320,411280," And this is going to be the position of the AABB."
411560,413640," Then, go here and here by one radius."
413640,415700," And this is the size of AABB."
415700,424360," So, basically, it will just render the AABB with the center that you provided, and radius is going to be the size."
424360,431280," So, on top of that, since it's going to be, like, pretty much the same thing, you also should provide not only color, but the UV coordinates."
431280,435320," The UV coordinates that you may want to have."
435320,439560," But the question is, what's going to be the UV coordinates in that particular case?"
439560,441220," What's going to be the UV coordinates?"
441220,444540," It's a good question, actually."
444540,446140," It's a good question."
446140,450740," Maybe we won't provide any UV coordinates."
450740,455660," Maybe it's always going to be automatically, like, 0, 0, 1, 0, 1."
462660,480260," Okay, I'm going to actually postpone that idea for a while, because I'm not pretty sure what's going to be UV coordinates in Atlas."
480380,492340," So, I suppose UV coordinates in the Atlas also should be, like, center and the radius, but in the coordinates of the Atlas."
492700,507620," So, that means I'll have to have something like V2 GLFloat UV center and then GLFloat UV radius."
508080,515380," But there's just too many things to actually provide, so I'm going to just actually postpone that, because I just want to fix the issue of implementing this fill circle."
515380,522380," And the question is, how I'm going to call this entire function if it's not going to be about the circles anymore?"
522460,536380," Let's actually keep calling it fill circle for now, at least, and then maybe I'm going to rename it to something else."
536920,545780," Yeah, since I don't know how to call this function, since I don't know how to call this function, maybe I just don't have enough information about that function, about what that function is."
545780,551620," So, I'm going to leave it as this right now, maybe later it's going to be a little bit more clearer."
551620,562720," So, but we still use this function, by the way, we still use this function for particles, right, for particles, because the particles are usually rendered at a particular position with the center of particular position,"
562720,568520," And they're usually just quads, but with the texture generated procedurally, right, so that's basically what it is."
568520,579360," Okay, so, and as I already said, we probably have to accept the program, right, we probably have to accept the program with which all of that is going to be rendered."
579360,583800," All right, so let me, let me see."
583800,590820," So, maybe we need to create a separate branch for this entire thing, the branch is actually 79, right, it's going to be 79."
591620,596360," And, let's get started, let's get started."
596360,599040," So, I'm going to remove that."
599040,611420," So, this is the center, this is the radius, this is the color, and we're going to accept program asset, right, program asset."
611420,618320," And program asset is the, essentially, the shader program, right, program asset."
619320,633940," All right, and I think implementation of the center, I think, is relatively simple, right, because, basically, you need to take the center and the radius, and construct AABB out of that, and then just pass, fill AABB, so that's going to be it."
636940,640700," That's essentially going to be it, I think."
648700,649140," Okay."
649140,654580," So, let's do that."
654580,664660," I'm going to take the center, and I'm going to subtract the half of the radius, no, it's not the half of the radius, but the whole radius."
664660,667200," I think I should be able to do it like that."
669720,689960," So, if I take a look at the GEOHPP in here, oh, and by the way, on the previous stream, I came up with a good name for this kind of library, so, this kind of library is, should be probably called something like LA for linear algebra, but, again, here we not only have linear algebra."
691960,695080," So, I don't know how to call it."
695080,700580," It's just like math libraries, because, what could be not a linear algebra?"
700580,705840," I don't know, triangles are not particularly linear algebra, but maybe, maybe they are."
706920,709480," It's more like a geometry or something like that."
709480,712000," It would be better to just call it math."
712000,731280," And I think I could probably call it math, because I usually put, like, some sort of a prefix for my modules in here, so, yeah, and it's not going to collide with, like, math.h or anything like that, so it's going to be clear that this is the math module of my specific game."
731460,737320," So, yeah, I just don't like the name GEOHPP, it's just, like, yeah, I just don't like it."
737320,746920," It's, like, it makes it sound like it's something about the, you know, geography or something, but, yeah, it's better, let's just call it math."
746920,751680," It's a pretty abstract, pretty abstract module, but, yeah, it is what it is."
752420,759280," All right, so, let me go through the compilation errors and just fix all of them, and this is not how we build this game."
759280,761060," Apparently, we build it with builded SH."
761060,765880," I need more tea, I'm actually falling asleep a little bit, I'm very sorry, just a second."
765880,774800," So, I just need to go through all these places where it complains about that stuff and just replace everything."
777420,801720," No biggie, no biggie, no biggie, okay, so, so, this is going to be a math, there's another one, maybe I could just find a lot of places where we use this entire thing by doing GREP, something GEO, right, and there's at least, like, four of them, and this is one of them, this is another."
802420,806840," You see, GREP is better than the compilation, but refactoring things."
806840,814360," All right, so, and then, let me rebuild this entire thing, and I think it's going to work quite well."
814360,822760," Everything is working, hopefully, okay, if it compiles, it works, you know, you know the saying, you know the saying, if it compiles, it works."
824260,831260," I want to run the game, excuse me, and I think it is working, I think it is twerking."
831860,836420," So, let's do a committee, committee, and then maybe even a pushy-pushy."
836420,840700," All right, all right, all right, all right, so, it's going to be 79."
840700,846860," Rename something, something GEO to something math."
846860,847540," There we go."
847540,849400," Did I, did I do it correctly?"
849400,853240," Did I not make any stupid fucking mistakes, man?"
853340,857040," I think everything's okay, and let's push that right into the repo."
857040,867100," All right, so, let me unstash my changes, and let's continue doing this kind of stuff."
867100,870780," So, that was a weird tangent, but, yeah."
870780,876080," So, yeah, yesterday, by the way, I was working on the particle simulation thingy."
876080,883660," I was working on the particle simulation thingy, and I'm going to actually give you the link to the previous board or something,"
883660,886220," so you know the context of what I'm talking about."
886220,892220," Particle simulation stream."
892220,901360," And I had to implement, I had to implement my own linear algebra library, like a very small one."
904160,906580," Nice video, Susan, yes, I do remember that one."
906580,913680," Yeah, I had to implement my own particle system."
913680,919260," Not particle system, my own vector library to work with vectors."
919260,926720," And this is because I was translating the code from Unity to C, right?"
926720,928880," So, from C-sharp Unity to C."
929340,935160," And what I noticed in Unity is actually, they made a very convenient overloading."
935160,939180," So, basically, you can have a vector, which is a center, right?"
939180,945680," And you can always subtract or add to the vector like a scalar, right?"
945680,952760," So, usually in my libraries, I give an ability to multiply by a scalar,"
952760,957120," because it's kind of like the usual thing that you do in math, right?"
957120,962540," In actual math, you have a vector, you multiply it by a scalar, and you scale that vector."
962540,968500," But quite rarely, in math, you just add a scalar to a vector or subtract a scalar to a vector."
968500,970740," So, mathematicians usually don't do this kind of thing."
970740,972260," But in Unity, you can do that."
972560,976620," And in Unity, it basically means, I think, this stuff."
976620,978340," And it's actually quite convenient."
978340,980240," It is actually quite convenient."
980240,983140," So, in C, it's kind of difficult to overload operators."
983140,985480," But we can do that in C++."
985480,990800," In C, what I had to do, I had to create an alternative constructor or a vector from the radius."
992140,993720," And it worked quite well."
993720,1000260," So, I find this idea of, like, allowing the user to combine vectors with scalars."
1000260,1003360," And if it's a scalar, just extend it to the vector."
1003360,1004920," Very, very powerful."
1004920,1006880," It's a very powerful idea."
1006880,1008500," It's actually quite interesting."
1008500,1010840," So, I never realized how powerful it is."
1010840,1015880," And it just makes the code, like, more readable and more, like, concise and stuff like that."
1015880,1017900," So, like, I learned a thing or two from Unity."
1017900,1021920," So, specifically, I'm talking about, specifically, Unity mathematics module."
1022140,1027780," Unity mathematics, this one."
1027780,1030980," That's a pretty cool module."
1030980,1035660," Even though I never programmed in Unity ever in my entire life."
1035660,1042920," But from what I saw while sitting on Linux, it's actually quite cool."
1042920,1044980," It's actually quite cool."
1044980,1048180," Maybe at some point I'm going to actually do, like, a Unity stream or something."
1048180,1052020," But I would like to have a more powerful PC."
1052140,1053940," And preferably Windows."
1053940,1056580," Because, I don't know, does Unity even work on Linux?"
1056580,1060880," Or, because everyone I saw who develops on Unity, they're usually using Windows."
1060880,1063140," Unity Linux."
1063140,1065140," Like, how do you set up Unity on Linux?"
1067320,1068420," So, let me see."
1068420,1069080," Let me see."
1069080,1073800," Choose your Unity plus download."
1073800,1074540," Okay."
1074540,1078260," Oh, shit."
1078260,1079120," That's expensive."
1079120,1082320," But I suppose it's, like, you don't have to pay it."
1082320,1084380," Like, okay, I'm individual and I'm doing..."
1084380,1085340," Okay, so I can do that."
1085340,1087620," Personal, get started."
1088300,1090980," So, we have to sign up for something, right?"
1090980,1093200," Do I have to sign up?"
1093200,1094120," Can I just download?"
1094120,1096020," Can I just download?"
1096020,1105240," The more clicks I make, the more I lose interest in this thing."
1105320,1105680," I'm sorry."
1105680,1107220," And I lost it."
1107220,1108520," All right."
1108520,1111720," Anyways, maybe at some point we're going to do a Unity stream."
1111720,1112080," I don't know."
1112080,1113080," I don't promise anything."
1113080,1113960," But we'll see."
1113960,1114260," We'll see."
1114260,1117220," All right."
1117220,1119980," So, and I was thinking, maybe I can overload this kind of thing."
1119980,1121740," Maybe I can overload."
1122260,1124280," So, you can do it like that."
1124280,1131160," But it feels like if you try to overload, you will have to overload a lot of things."
1131160,1137640," So, you have to overload something like Vector2 and then the scalar, right?"
1137640,1143300," And then you have to overload the version where the scalar comes first, right?"
1143300,1145040," And so on and so forth."
1145040,1147220," Basically, like, you have a lot of combinatorial complexity."
1148900,1154300," But on the other hand, if you just allow to construct a vector from a single scalar,"
1154300,1161480," you only need to implement a single operator which works only on the vectors, right?"
1161480,1166840," And then if you want to make it work on a scalar, you just call, like, this simple constructor"
1166840,1172560," that turns a scalar to a vector and you automatically have a version where you have a different order"
1172560,1173220," of the arguments."
1173220,1174060," You know what I'm talking about?"
1174260,1181420," So, it's kind of like the binary operations that work only on vectors plus constructors"
1181420,1187040," that turn scalars to vectors is more powerful idea than, you know, overloading with different"
1187040,1191220," combinations because this kind of idea compresses all that combinatorial complexity into, like,"
1191220,1195360," a couple of functions, like binary operation plus conversion from one thing to another."
1196120,1197900," So, yeah."
1197900,1204560," And to be fair, in Unity mathematics, there is a lot of combinatorial complexity, right?"
1204560,1210560," If you take a look at how many overloaded operations and types and stuff like that there is, it's"
1210560,1211280," just, like, insane."
1211280,1212280," It's a huge page."
1212280,1218900," If you look at my previous stream, that page, I went on that page and it was loading, like,"
1218900,1225560," for ages, I think, I think I just, I was, I was searching for that page, for the thing"
1225560,1226740," that I wanted on that page."
1226740,1232300," I found it, I read everything I wanted and I closed it and it yet didn't finish loading."
1232300,1234100," It was, it was kept loading."
1234100,1236100," That's how huge it was."
1237180,1241400," So, yeah, anyway, so there's a lot of combinatorial complexity."
1241400,1243280," Maybe I'm going to just keep things like this."
1243280,1244920," I think it's pretty, it's pretty convenient."
1244920,1250240," And do I even have an operator that constructs a vector out of a single thing?"
1250240,1251280," I think I do."
1251280,1253160," Yeah, yeah, yeah, I do."
1253160,1254100," Here's the constructor."
1254100,1259540," So, you can just provide a single scalar and it basically constructs you a vector with,"
1259540,1261600," with these values."
1261900,1270280," Okay, so in that case, what I can do, right, I can take center, subtract a radius and this"
1270280,1276100," is the position of AABB, right, this is the position of AABB and the size of AABB is basically"
1276100,1285100," a radius but multiplied by two, right, so multiplied by two because the size of this AABB is essentially"
1285100,1289640," two radii, first radii, so here is the first radii, here is the second radii."
1291900,1303520," So, radius, plurals for nouns in English that end with S are really, really complicated."
1303520,1305120," I don't understand them, I'm sorry."
1305120,1308480," I'm a very stupid person, I'm just a stupid Russian, what do you want from me?"
1308480,1314400," All right, so here is the AABB that we want you to render, I suppose, and what I want to call in here,"
1314500,1322240," I want to call fill AABB, so this, this is the AABB I'm filling and we're going to use the color for the shade"
1322240,1327420," and what we're going to use for the UV coordinates, I suppose for the UV coordinates, we're going to just use"
1327420,1336500," AABB with a center at zero, right, and the size is going to be just one, one, right, so this is going to be"
1336500,1344140," simply one, one, because that's precisely the things that we'll need to render a circle at the end of the day"
1344140,1349520," and then we need to pass the program that we're going to be using to render all this stuff, okay"
1349520,1352940," I suppose that's, that is it, I suppose that is it."
1352940,1361860," What's interesting is that we already have, okay, we already have things that use fill circle,"
1361860,1370140," I think we have particles, right, I think we have particles, and let me see if they use them,"
1370140,1377880," particles.cpp, fill circle, yeah, yeah, we do, we do use this thing, here is a fill circle, and"
1377880,1389460," since we're using fill AABB and the default program, the default program uses the UV coordinates in the"
1389460,1397500," atlas, this particle will appear with the chunks of the, oh my, they will actually contain the"
1397500,1401800," whole atlas, they will look like a little bit weird, so we're going to have particles with the"
1401800,1408200," texture of the whole atlas, like compressed and squished and stuff, like, it's going to be funny,"
1408200,1412600," okay, so let's, let's see if it's going to work, first we need to make it compile, because we changed"
1412600,1418200," the signatures of some things, and then we'll see, we'll see, okay, so here I have to use one of the"
1418200,1424340," program assets, let me see, so it's going to be a renderer, right, and what kind of program do I have"
1424340,1428500," to use, I have to use a regular program, I could have used particle program, but the particle program"
1428500,1435800," don't know how to work with our specific vertex attributes, so we'll have to change the particle"
1435800,1443640," program to actually be able to work with our vertex attributes, okay, so let's try to recompile that,"
1443640,1449140," so is it going to compile now, it still doesn't compile, let's take a look, this has to be f,"
1449140,1455960," because if you have a floating point literally without f, it's actually double, not a float,"
1455960,1462400," for float you have to use something like this, and are we good, are we gucci, tamaguchi,"
1462780,1469080," forcing e, okay, so let's try to run this thing now, uh, what do we get, what do we get,"
1470920,1478900," I don't know why I rebuild it a second time, but yeah, uh, yeah, what the fuck is this shit,"
1478900,1483860," it's so funny actually, yeah, this is precisely what I was talking about, these are particles,"
1483860,1489100," and yeah, so they're supposed to be red by the way, so that's why they're, it looks so cursed,"
1489100,1496300," it looks corrupted or something, love it, I fucking love it, um, I wonder if I can demonstrate how the"
1496300,1503740," atlas actually looks like, can I do that, I think I should be able to, because, uh, we store"
1503740,1511000," the pixels of the atlas, uh, as just like our gba, right, so it's just, uh, our gba or something,"
1511000,1520840," something, what not, um, so I suppose the texture is actually the pixels of the atlas,"
1520840,1527180," and I wonder, and I wonder if, uh, I can actually save it to file, okay, oh, here it is,"
1527180,1531300," so it's a width and height and pixels, uh, you can even get individual pixels and stuff like that,"
1531300,1537720," for some reason, probably a bad idea, um, so you can save it to png file, does it still work,"
1537720,1545360," um, save to, oh yeah, we, we use stbi, right, so yeah, I was using that for debug purposes,"
1545360,1551160," so at any point, I can, I can actually save the atlas to, like, png and look at it, my god,"
1551160,1557980," such an advanced engine, isn't it, um, all right, so where do we initialize the atlas,"
1557980,1563820," uh, I think we're not initializing it, uh, let me take a look at the atlas,"
1563820,1570280," and maybe what I want to search for is the atlas from config, all right, so this is the atlas from"
1570280,1576940," config, and I'm initializing it here, and after that, I can just do something like atlas, uh,"
1576940,1587100," texture, save to png file, atlas.png, and, uh, let me see if it's gonna work now, um, and so it's not"
