start,end,text
1587100,1594820," texture sick, it's a single texture, okay, um, so it will just save that, uh, and then we'll be able to"
1594820,1602620," look at it, uh, so here is the atlas png, and let's open it in pff, so here's the atlas, so here"
1602620,1609820," are all of the textures that we have, uh, probably pff actually ruins the encoding, uh, so we have to do"
1609820,1615560," something like background black, if I remember correctly, I'm not 100% sure, I keep forgetting"
1615560,1627560," how to make pff to, like, I have a specific background, uh, background, uh, b, uh, okay, so it has to be"
1627560,1646240," actually small characters, so it has to be b, b black atlas, um, okay, that's what I want, I'm sorry,"
1646240,1651820," all right, so basically these are all the textures that we use, and we put them into a single atlas,"
1651820,1656480," yeah, I know that the atlas is not, like, a power of two or anything like that, I, I'm aware of that"
1656480,1662360," and everything, so, um, but yeah, it's, it's not that important right now, uh, it's not that important,"
1662360,1669820," and what's interesting is that we have, okay, we have, like, these interesting margins, uh, which are"
1669820,1675280," built at runtime, by the way, the original textures don't have this sort of margins or padding or anything,"
1675280,1681780," uh, they're built at runtime, and these margins are needed to prevent the texture bleeding, right,"
1681780,1688840," so because, um, yeah, because of the interpolation, uh, some, some of the cores of the, of one texture,"
1688840,1696480," uh, can bleed into another one and just creates, like, these ugly edges, so to combat that, we just put a"
1696480,1702620," little bit of margin, and it's quite cool that we do that, like, at runtime programmatically, um, so you can"
1702620,1707760," just add more textures, and these margins are going to be added, like, uh, automatically for you, so,"
1707760,1712020," yeah, that's pretty cool, uh, so, and yeah, and essentially what you see in here,"
1712020,1723920," what you see here in this corrupted mess is, like, each particle is the whole atlas squashed into,"
1723920,1729460," uh, like, uh, into a square and colored red, because that's the color of the particle,"
1730160,1734420," that's why it looks so cursed, because, like, this is not what you're supposed to see,"
1734420,1741460," uh, I love it, so, like, it's like a glitch effect of some sort, uh, nice,"
1741460,1751160," anyway, so, essentially, now, since we have a particles, we kind of have the field circle"
1751160,1756620," implemented, it's just, like, we have to use a different program, uh, theoretically, theoretically,"
1756620,1762820," in here, we have to use a particle program, but the particle program is not adapted to work with a new"
1762820,1768920," renderer, so the next step is going to be adapting it to the new renderer, uh, I didn't recompile anything,"
1768920,1785720," yeah, there we go, so, as you can see, uh, we're using program that is not meant to be used like that,"
1785720,1791000," and it also creates interesting effects, too, so, not gonna lie, it also creates interesting effects,"
1791000,1799400," so, yeah, it's kind of cool, it's kind of cool, not gonna lie, especially if I'm moving and stuff like"
1799400,1806280," that, it's just, it's, sometimes it tries to take a shape of the, uh, of the circle, uh, but it's failing"
1806280,1812440," miserably to do so, yeah, it's kind of interesting, all right, so, let's do a committee committee,"
1812440,1822760," let's do a committee committee, and maybe then even a pushy-pushy, um, so, uh, let's remove this thing,"
1822760,1833240," 79, implement, um, oh, wait a second, I don't want to commit the saving of the, of the atlas, I think it's quite important,"
1833240,1838360," it's not needed, so, basically, if I commit that, every time you run a program, it will save its"
1838360,1843320," atlas to the, to the file system, and it's just not really what we want, it's not really what we want"
1843320,1853240," for the program, from the program, um, okay, 79, implement, uh, a renderer, uh, a renderer,"
1853240,1863800," from, uh, field circle, right, uh, circle, go, and I'm gonna push that right into the repo,"
1871320,1877720," and, uh, let's go ahead and take a look at the program, let's take a look at the, uh, the program,"
1877720,1883080," so, we have a shaders, and for the particle program, if I remember correctly, right, if I remember correctly,"
1883080,1891560," so, let me take a look at the, uh, renderer, and I want to find what are the file paths,"
1892120,1902440," paths that we use for all of that, um, where do we load up dot vert, uh, something like that,"
1902440,1907160," okay, so, here is the one shader, okay, so, we're loading, uh, it all up in here,"
1907720,1911240," so, our particle program, our particle program uses circle,"
1911240,1919240," vertices, and, uh, frag shader assets, uh, particle frag,"
1919240,1926040," so, what I'm thinking is that maybe instead of circle vert, we're going to use, um,"
1928520,1933320," the regular one that is used by the regular program, so, essentially, we have to use the rect,"
1933320,1939240," because now, what we are rendering, essentially, is just a rectangle, we just have to, uh, make the"
1939240,1946280," circle slightly different, uh, furthermore, um, maybe we won't even need to adapt anything in the"
1946280,1952280," particle fragment shader, right, do we need anything in the particle fragment shader, so, here, we accept"
1952280,1959720," color, uh, uv, and surprisingly, I, I guess that's it, so, this is going to be the whole thing,"
1959720,1967000," so, the only thing we have to do, we have to remove, um, yeah, we have to remove circle vert,"
1967000,1971160," yeah, we don't need circle vert anymore, that's what's interesting about the syntax stuff, that's"
1971160,1975720," actually cool, we don't need circle vert, okay, so, if I try to recompile the syntax, I think it should"
1975720,1983800," automatically work, I think, uh, and, okay, that worked, that's precisely what's gonna, what's the"
1983800,1990600," end result has to be, yes, okay, so, I just have to swap out one shader, one vertex shader for another"
1990600,1995240," one, but the fragment shader actually stayed the same, that's actually super cool, that is actually"
1995240,2000440," super cool, I'm super happy about that, uh, I thought it's gonna be a little bit more difficult,"
2000440,2006280," I thought I would have to actually modify GLSL code, but that was not needed whatsoever,"
2006280,2012760," and I'm super happy about that, all right, so, uh, let me see, so, because of that, maybe we have to"
2012760,2019080," remove the circle vert shader from our system, so, it's not needed anymore, so, I'm gonna go in here,"
2019080,2023720," so, circle vert is gonna be that now, and let's try to recompile this into, I think,"
2025880,2032600," so, let me see, let me see, circle vert, okay, so, we don't have this thing anymore, right, this thing"
2032600,2039560," is gone, uh, and, yeah, yeah, so, now we have less shader assets, so, we used to have five, now it's four"
2039560,2045000," of them, so, uh, the reason why I have a static assertion here is that I want the compiler to remind"
2045000,2052680," me to update this section of code if the amount of assets changes, you see what I'm talking about,"
2052680,2059320," so, essentially, we are initializing four shaders, which means we're making an assumption that there's"
2059320,2067240," four of them, if we modified something, if we modified the definition, uh, of the enumeration of the shaders,"
2067240,2072360," that means that assumption in this particular piece of code is incorrect, and by the way, this assumption"
2072360,2078840," can be checked at compile time, and that's precisely what I'm doing, it's a pretty neat trick, uh, and it"
2078840,2084040," saved my ass so many times in different projects, I absolutely love it, so, I'm now doing this kind"
2084040,2090520," of stuff, so, oh, I'm trying to always think what are the assumptions we're making, uh, in any particular, uh,"
2090520,2096920," point of, of program that could be broken, but could be checked at compile time or run time, and if there's"
2096920,2103960," something that could be broken, but we still can check, I either put assert or static assert, and I try to put as many of them, uh, as"
2103960,2110680," possible, and that helps in development immensely, uh, believe it or not, because quite often these asserts"
2110680,2115640," fire up, and they fire up when they don't expect them, and they always say to myself, thank you,"
2115640,2122280," past me, for putting an assert in here, so, asserts are very powerful tool, learn how to use them, seriously, um,"
2129880,2136840," especially runtime asserts, runtime asserts, no matter how powerful your type system is, if you,"
2136840,2141640," if you're developing a statically typed compile language, no matter how powerful it is, no matter"
2141640,2147240," how many things it can check at compile time, any useful program, uh, actually"
2147240,2156760," accepts user input, right, and, uh, outputs something to the user, and none of these things can be checked at"
2156760,2162760," compile time, that's the point of an interactive program, right, so none of these things can be"
2162760,2169320," checked fully at compile time, or maybe some of them can, but not all of them, right, and, uh, yeah,"
2169320,2174040," so it's quite important to have asserts for things that may break, not only that, but I mean for, for the"
2174040,2180200," user input has to be actually properly checked, not with asserts, yeah, I'm, I'm sorry, talking bullshit,"
2181240,2186840," yeah, the user input has to be actually processed properly, not with asserts, it's like, um,"
2186840,2195560," usually asserts are useful when one piece of code making an assumption over another piece of code,"
2195560,2202280," piece of code working correctly, right, but that assumption may break at any point, and this is"
2202280,2206600," very difficult to check at, uh, at runtime, this is what I was trying to say, like, I wasn't trying to"
2206600,2210600," talk about, like, the user input, the user input has to be, like, checked properly without the answer,"
2210600,2216040," asserts are usually for different parts of program that depend on each other working correctly, but, um,"
2217000,2228520," sometimes it's, like, very difficult to check at compile time, um, if that makes any sense, anyway,"
2228520,2236760," so what's going to be the next issue, basically this issue is done, basically this issue is done, so,"
2236760,2244760," uh, we need to do a committee committee and then pushy-pushy, and, uh, we are good to go, so since we"
2244760,2250760," removed the, uh, circle vert, right, since we removed the circle vert, uh, I need to remove this file as"
2250760,2256200," well, it's actually the biggest file in here, surprisingly, this is probably because we, yeah,"
2256200,2262440," we put a lot of effort into transforming center and radius into, like, quad and uv card, yeah,"
2262440,2267160," that's precisely what we're doing in here, so that's probably why it's so, it's so big,"
2268680,2274520," all right, so, uh, let me recompile this into, I think, and, uh, let me see, let me see,"
2274520,2279560," all right, um, so let's do a committee committee"
2283560,2299160," so, um, remove circle vert and use, uh, rect rect vert in the particle pro, it's not gonna fit,"
2299160,2305800," that's not gonna, it actually fit into the entire thing, okay, I had two characters before I, like,"
2305800,2311800," went over the limit, okay, uh, and let's push that, uh, right into the repo, and let's create a pull request"
2311800,2324360," to check for all of these things, uh, the first pull request of today's stream, isn't that exciting,"
2324360,2331320," I think it's goddamn exciting, my gut, my gut, my gut, my gut, my gut, my gut,"
2331320,2340360," so we're just waiting for all the continuous integration and stuff like that, it's actually,"
2340920,2346120," I'm really glad that we removed more than we actually added, I think it's, it's cool,"
2346120,2353000," I always love removing the code, the less the code, the less the, yeah, the less the code you have,"
2353000,2360920," the less the bugs you have, I think, I don't know, it depends, it depends on the density,"
2362840,2378920," and where exactly, uh, the bugs are concentrated, uh, it also depends on the definition of a bug,"
2378920,2385240," so it's, we're only waiting for Mac OS, we're only waiting for Mac OS,"
2386040,2391240," and now we're only waiting for Windows, msys2 means GW,"
2391240,2399240," come on Windows, I believe in you, you can do it, you can do it,"
2399240,2413480," it's kind of ironic how, you know, GitHub is now Microsoft product, Windows is a Microsoft product,"
2414360,2418520," Windows builds, uh, on, uh, GitHub are usually the slowest ones."
2419560,2433480," So what's going to be the next issue? We need to think about the next issue."
2436760,2441560," loading config from file panics instead of providing error or recoverable interface, yeah,"
2441560,2446520," that's actually very interesting, that would be cool to implement in my opinion,"
2446520,2456040," but maybe, well, it's not that important, so the main problem with this thing is that we have a hot"
2456040,2463400," reloadable configuration, right, so essentially you have a game and, uh, the game has a lot of parameters,"
2463400,2467880," the, the worldwide parameters, like, for example, gravity, gravity is not part of the,"
2467880,2473560," oh, shit, we need to actually add gravity to the configuration, but, uh, yeah, things like gravity has"
2473560,2479080," to be in the configuration, so it's just like different, different things in here, and for instance,"
2479080,2484040," you can see that the player has a, has a health bar, right, so the player has a health bar,"
2484040,2490360," uh, let's actually zoom in a little bit, and, uh, the width of the health bar is described here,"
2490360,2494280," so what you can do in here, you can change it, and then you can hot reload this into anything,"
2494280,2500760," uh, just a second, and there we go, so, yeah, so we have this sort of hot reloadable configuration and"
2500760,2507160," whatnot, and if you make any syntactic mistake in here, right, uh, for instance, maybe you, you have a"
2507160,2512840," variable that is, well, it's not a syntactic one, but we can try to do it like that, uh, the, the whole"
2512840,2519080," game crashes, it tells the problem though, right, it tells the problem and where exactly, uh, this thing"
2519080,2524840," is located, but, uh, it crashes the whole game, but I think it shouldn't, right, it shouldn't crash,"
2524840,2532440," it should just at runtime tell you, I couldn't reload this into anything, sorry, uh, that precisely the"
2532440,2538120," error message has to, has to be, like, it has to contain, otherwise it's not gonna work, so it's a little bit"
2538120,2544360," annoying, um, but isn't that important, maybe it is, maybe it is, maybe we can work on that, right, so,"
2544360,2553480," um, so today is a Saturday, today is a weekend, maybe I want to just do a chill stream where I could just"
2553480,2559320," work on this kind of stuff, uh, yeah, I guess, I guess we can work on that, okay, let's just merge this pull"
2559320,2570600," request and see, uh, so, cool, nice, nice, nice, nice, nice, nice, nice, okay, let me go to the master"
2570600,2579320," and fetch the latest stuff, fetch the latest stuff, um, origin master, and let's remember this thing,"
2579320,2586680," all right, so, um, let's grab this issue, reload config from file panics instead of providing error"
2586680,2596280," recall the interface, uh, 68, not even 69, what was the 69th issue, by the way,"
2596280,2608520," uh, what was the 69th issue, ah, it was a, it was a pull request, okay, boring, uh, so let's create a branch 68,"
2609480,2617560," uh, and let's find the function called reload config, uh, from file, and where is it located,"
2617560,2622200," I think it's located somewhere in here, and yeah, that's pretty much what we have in here, right,"
2622200,2628200," so essentially every time you encounter some sort of an error, uh, it's like, I'm sorry,"
2629960,2636120," and panics, um, so I suppose what we want to do in here, maybe instead of panicking,"
2636120,2639080," right, uh, we're gonna return boolean,"
2642280,2650680," uh, it's just, I chuckled because, uh, after saying panicking, I was thinking about the star wars"
2650680,2661160," joke, but I couldn't come up with one, panicking, uh, all right, so, good, so dumb, sorry, um,"
2662760,2671880," yeah, but we can also potentially panic in other places, especially with, like, a parse config content,"
2671880,2679080," right, so this thing, parse config content, um, so we're using, like, a special thing that parses"
2679080,2685800," things for us, parse config content, right, so you provide the content, you also provide the file path"
2685800,2691640," for, for the things, yeah, it can also panic at any time, it can also panic, but it doesn't provide any"
2691640,2700520," error messages, I guess the, the main problem here with the config is when it fails, uh, where do we"
2700520,2707000," provide the, how do we provide the error messages, how do we provide them, um,"
2707000,2720280," maybe we're gonna have some sort of a buffer, yeah, it could be something like, um,"
2721640,2730920," yeah, it could be a special global buffer for the config loader through which it communicates"
2730920,2738360," its error messages, and then you can always grab that error message and, um, display it somewhere,"
2738360,2743320," you can put it into the standard output or to the screen, uh, this is one of the things I want to be"
2743320,2753400," able to do, so the same error messages has to be displayable in the, uh, in both std out and"
2753400,2759400," the screen in image and stuff like that, if you know what I'm talking about,"
2759400,2763800," all right, let me see, uh, so I'm using aids, which is the"
2766840,2772600," replacement for c++ std, uh, yet again, if you've never heard of it, I recommend to check it out,"
2772600,2781640," so, and I'm using it in my games, because I think std, c++ std, uh, is a little bit"
2781640,2792040," more over complicated for what it's doing, uh, okay, std replacement for c++, genius name, I know,"
2792040,2797000," so the idea of this entire replacement is that, like, tries to, it's basically, um,"
2797000,2803880," programming in c with classes, right, it's built on top of, uh, libc, and it just uses,"
2803880,2810840," uses the minimum of c++ features, right, and by the way, things like println that you probably saw"
2810840,2820760," me using in, uh, in my game, probably, uh, these things are from that library, so in println actually"
2820760,2826520," acts more like, uh, write a land from Pascal, I don't know how many people who watch me right"
2826520,2832520," now actually programmed in Pascal, but essentially you can interleave different types, and it will just,"
2832520,2838040," you know, print their textual representations and just concatenate them, so that's how it works."
2838040,2843080," Actually, as a matter of fact, each individual call in here will be translated into a separate,"
2843080,2850520," like, printf, right, and the, uh, the specific printf will be dispatched based upon the type of this"
2850520,2858280," value, right, and println is implemented using c++17, uh, variadic template magic, we can even take a look"
2858280,2864680," at it, I think, so it's a println, uh, well, it's a sprintln, which prints things into string buffer,"
2864680,2867720," which we're going to use, by the way, for error reporting a little bit later right now,"
2867720,2874200," in, in, in the stream, but the idea is pretty much the same, so, uh, we accept a variadic template of"
2874200,2881000," types, and, uh, then we have a pack of arguments of different types, and we unpack these arguments into"
2881000,2890600," a sequence of calls of, uh, just sprint1, and through overloading, um, we dispatch between sprintf, uh,"
2890600,2895880," sprint1s depending on the type of each individual argument, so that's basically how it's implemented,"
2895880,2901960," it's actually pretty simple, pretty straightforward, if you know how c++17 variadic templates work,"
2901960,2905560," uh, they are really useful for this specific feature."
2907240,2919480," uh, so, essentially, essentially, in a low order, we have, like, a"
2919480,2931160," global static variable, uh, which holds the, the content of the configuration file, we need to hold"
2931160,2936200," the content of the configuration file, because we refer to it from different places, so maybe we're going to"
2936200,2942040," do a similar thing for the string buffer, right, so it's going to string buffer, the problem with the"
2942040,2947640," string buffer is that it's like a string view on the string buffer, right, so let me take a look at the"
2947640,2960680," definition, string buffer, yeah, it's like, it doesn't really do things at all properly, uh, it would be"
2960680,2966680," better if string buffer was defined slightly differently, it would be way better if it was"
2966680,2974280," actually holding that data somewhere inside, um, let me, let me see, so it can be no white spaces,"
2974280,2977400," uh, it could be, like, templated, right, templated,"
2979720,2987960," template, um, okay, this is a little bit inconvenient type name, uh, I'm using the wrong mode, by the way,"
2987960,2994440," um, so, and it's going to be actually holding its capacity, right, so let's imagine that it has its"
2994440,3004280," capacity, um, and then this data is going to be, like, this capacity, there we go, uh, so, and then you would have"
3004280,3011640," things like sprint1, which are also templated, right, which are also templated, that take the size of this"
3011640,3023560," capacity, and, uh, so on and so forth, uh, so, which probably would, uh, reduce the compilation time"
3023560,3027880," immensely, I don't know why I keep using this word, but I kind of like this word,"
3028680,3034440," dramatically, let's, let's try to use a different word to exaggerate things, okay, so that will reduce"
3034440,3038680," the, uh, compilation time dramatically, um,"
3038680,3045240," because it needs to instantiate templates and stuff like that, but that will be kind of cool,"
3045240,3053080," because I would be able to just, you know, do something like string buffer, um, let's say I want to allocate, um,"
3054840,3062920," 6040 kilobytes, because it's obviously enough for everyone, uh, something like this, and this is"
3062920,3070040," going to be my error buffer, right, and every time a loader, right, fails, I actually print the message"
3070040,3076280," into that buffer, right, I just print the message into that buffer, um, and regardless of its size,"
3076280,3083000," it dispatches, uh, uh, like, correctly, and on top of that, we can use this capacity for boundary checks,"
3083000,3087480," right, we could use that capacity for boundary check, and because of that, we don't need this capacity in here,"
3087480,3094360," right, uh, but the problem also is that for each, like, version of string buffer, right,"
3094360,3100280," you have to generate a version of sprint, uh, sprint one, but on top of that, maybe with, uh,"
3100280,3105080," with a good compiler, some of these small functions could be optimized away and whatnot,"
3105080,3110200," right, because it could be in line and whatnot, but since they are sort of, like, public, um,"
3110200,3116600," I don't know, I just want to see if that's a generally good idea, and we just want to see if"
3116600,3126920," it's a generally good idea, um, because right now this thing expects you to first allocate that buffer"
3126920,3131720," somewhere, and then create a view on this string buffer, which is not particularly convenient,"
3131720,3136040," I just want to allocate the string buffer over particular size, and I think we even had something"
3136040,3145080," like fixed, uh, region, which is essentially that, right, which is essentially that, so, um,"
3145080,3150520," maybe I just need to, like, implement printers into fixed regions, so I can use,"
3152600,3157000," yeah, all right, okay, so this library is a mess, okay, it's in the middle of, like, you know,"
3157000,3163160," figuring out what exactly I need, and what is the minimal things, uh, what is the minimal things"
3163160,3165000," that I need, and just removing everything else."
3165000,3180440," So, and you can allocate things into the fixed region, which is kind of interesting."
3182600,3192680," So we can use it as an allocator, but yeah, I'll see what I can, what I can do in there."
3192680,3197480," Um, anyway, so let's make a cup of tea. Let's make a cup of tea."
3197480,3205000," Maybe, maybe I'm gonna, I'm gonna even do a small break, because yeah, I'm almost doing for like an hour,"
3205000,3209160," I think it's time for a break. I think it's time for a break."
3209160,3217800," Make a cup of tea, and listen to some music, listen to some music."
3217800,3224440," Uh, all right, so let's listen to a smooth jazz."
3230440,3231000," All right."
3231000,3238200," So let me set the text mode, three minutes."
3238200,3247880," I think I'm gonna switch to a different song."
3247880,3255240," Okay, let's make some break, you guys have fun."
3260440,3261840," I think I'm gonna switch to a different song."
3261840,3262840," I think it's time for a different song."
