start,end,text
720,6960," Hello everyone and welcome to yet another recreation programming session with Amista Zozin."
6960,10560," So today we're going to do a little bit of an interesting thing. Today we're going to try to"
10560,16720," use WebAssembly on the back end. How about that? So we have this interesting game, right, so which"
16720,24720," is basically like a web multiplayer game with a server, right, so which enables you to have several"
24720,31360," players, right, so you open a game in one tab and then you can essentially open this game in another"
31360,37840," tab and that creates another player and players can actually see each other, right, so here is the"
37840,41760," second player, I can stand in front of the other players, as you can see we can actually see each"
41760,49680," other. So it uses this like an old-school raycasting graphics intentionally and originally it is written"
49680,57200," in JavaScript, specifically it is written in TypeScript, but we recently started to incrementally"
57200,64080," rewrite this entire thing in WebAssembly, specifically in a language called C3. If you never heard about"
64080,69280," this language, this is because it's not really that well known, right, so it is kind of normal for you"
69280,75280," to not know about this language, but it's a SQL to C, right, so I'm trying this language out,"
76800,82000," it's kind of an okay language, it's an interesting language and but it's not particularly finished yet,"
82000,90160," it's rough around the edges, but the development is rather open, so I'm using it because it is the"
90160,98160," developer of this language makes it easy to report bugs and contributes fixes, right, so essentially if I"
98160,104640," see any problems with the language as I use it, I know that I can easily report some bugs or contribute"
104640,110400," fixes, right, so the code base of the language is also easy to read. So recently what we did,"
110400,118480," we actually rewrote a little bit of a rendering code in C3, right, so here is the rendering as you can see,"
118480,126960," so the rendering of the floor is actually implemented in C3, so the floor is implemented in WebAssembly,"
126960,135840," right, so C3 compiled to WebAssembly, but the walls, the walls themselves are not implemented in C3 and"
135840,144720," they're still happening in JavaScript. The way it works is that we basically render into a shared WebAssembly"
144720,151600," memory, that's how we do that, so we render into a shared WebAssembly memory and every time I need to render,"
152320,158320," for example, floor, I call to WebAssembly function and every time I need to render the walls, I call to a"
158320,164320," JavaScript function, and that's how it works, so this allows us to actually slowly incrementally,"
164320,171760," you know, rewrite JavaScript code in C3, right, so that's basically the strategy that we have in here."
171760,178400," So the other day I was actually thinking how I'm going to rewrite rendering of the walls in C3,"
178400,182960," and I encountered a rather bizarre problem, not really bizarre problem, but kind of an annoying"
182960,188560," problem. We can take a look at the client which is responsible for rendering the walls, so there's a"
188560,198880," literal function called render_walls, right, so, and what it accepts, it accepts a scene, right, and a scene"
198880,206480," is basically an array of booleans, so it's a grid, it's an array of booleans and it's a grid, so where"
206480,212480," there is a true, there is a wall, right, so let's actually take a look at how we call this function"
212480,220720," and where we call this function. So here we have a level scene and stuff like that, so we pass the scene"
220720,230960," from here, and the interesting thing about this scene is that it is supposed to be shared between the client"
230960,238400," and the server, it is supposed to be shared between the client and the server, so let me actually bring"
238400,244800," up the architecture of the whole application, so it's a little bit easier to understand, so what exactly is"
244800,253120," the problem, right, so let me actually start up my laptop, not really laptop, how is it called, like a tablet,"
254960,258960," so we have sort of like three things in here, so there is a common part"
258960,267120," which is implemented in TypeScript, so it's a code that is reusable both on the client and the server,"
267120,270800," right, so because we're using TypeScript, right, so we have a universal common code,"
271920,279280," right, so we have a client also written in TypeScript, and we have a server written in TypeScript,"
279280,287520," so server ts, let me sort of denote them as sort of like circles and stuff like that, and the client"
287520,294560," uses common part and the server is using common part, and the interesting part is that we have a little bit"
295120,303760," over rendering code on a client which is implemented in the Wasm, right, so it's implemented in Wasm,"
303760,315680," so and now rendering code is trying to use the state of the scene, but server also uses the scene"
315680,321520," to check for collisions, right, because when you're walking around, it's actually processed by the server,"
321520,327280," and servers actually determines whether you can go through a wall or not, so it checks for collisions,"
327280,336560," so the scene array is shared between the client and the server, so now the renderer code is trying"
336560,343440," to access something, is trying to access something that is supposed to be in common in here, right,"
343440,351360," but if I try to rewrite something in Wasm in common in here, that means server must be able to work with"
351360,359200," that as well, but I was planning to rewrite server in actual native code, my idea was that I rewrite"
359200,366320," everything in C3, and this common module for the client is going to be compiled to WebAssembly,"
366320,372560," and for the server it's going to be compiled to a native code, and now like I need to take this state"
372560,377760," of the scene, right, and I need to rewrite it to WebAssembly, but I can't do that, right, so I can't"
377760,388000," call a native code from the server TS, but it just occurred to me that I can actually use WebAssembly from"
388000,394080," Node.js on the server. It is a thing you can do in Node.js, can't you? I'm pretty sure you can, right,"
394080,401040," if I do this thing, I can do, yeah, WebAssembly instantiate, instantiate, yeah, there we go,"
401040,409120," so I can actually load WebAssembly module and just like use it on the server side, so that means I can"
409120,417440," take some code that needs to be shared between the client and the server, basically a small part of the"
417440,424720," common, right, small part of the common in here, and renderer is going to be using this part, and the"
424720,430560," server also going to be using this part, right, and essentially, yeah, so this is how the architecture is"
430560,436480," going to look like, so everything green is JavaScript, everything blue is WebAssembly, and as you can see"
437440,443760," within each of the modules, there is a little bit of WebAssembly, and we're going to be slowly growing"
443760,450960," these bubbles until we sort of rewrite everything in WebAssembly, right, the fact that I can use WebAssembly"
450960,456320," modules from Node.js makes it makes it actually rather easier, but for some reason in the previous"
456320,461840," stream, I didn't think about that, right, but now it kind of makes sense, right, and I think it will make it"
461840,466880," easier, so as soon as this bubble grows to the entirety of the server, we'll be able to just like,"
466880,473120," you know, recompile it to a native code, and now the server is going to become a native executable."
473120,478960," There will still a little bit of problems with WebAssembly implementation because Node.js comes with"
478960,484880," its own WebAssembly implementation, it's actually not true. You need to install WebAssembly third-party"
484880,491360," package, right, so to be able to do that, but I mean, I had a plan to implement WebAssembly for"
491360,498960," C3, no, not WebAssembly, WebSockets, I'm sorry, okay, freaking them, these web devs, freaking prefixing"
498960,505680," everything with web, so all of the names look, like, sound the same: WebGL, WebGPU, WebAssembly,"
505680,510720," Web Your Mom, it's just like, it's just like everything, it's almost like an old Apple that was"
510720,520400," prefixing everything with ""i"", iPhone, iPad, and whatever, it's just like, uh, yeah, it's so annoying."
520880,532480," Mm-hmm, um, web your mom, yeah, exactly. Uh, so yeah, that's going to be basically the plan for"
532480,541360," today, I'm going to be, I'm going to basically rewrite a small part, uh, that is responsible for"
541360,546640," storing the state of the scene in WebAssembly, right, so essentially my idea is going to be,"
547280,554240," uh, take the scene, uh, in common, right, so there's an interface, interface scene, and just basically"
554240,560080," store this entire thing in a WebAssembly memory, just, just store it in the WebAssembly memory,"
560080,567520," uh, right, so, and then let the client read that for rendering and stuff like that, and let the server"
567520,572400," read that for checking collision and everything, that's basically going to be the idea, right,"
572400,578560," at least for, for, for today's stream. Uh, so the, the goal is going to be to establish this architecture"
578560,584640," where there's a little bit of a WebAssembly in each module, right, a little bit of WebAssembly"
584640,587760," on the client, we already have a little bit of a WebAssembly in the client, there is nothing"
587760,592240," particularly special in here, uh, right, so we need to bring a little bit of WebAssembly into the common"
592240,598400," module, uh, which in turn will bring a little bit of WebAssembly into the server module, right, so we're"
598400,605040," growing the bubbles of WebAssembly, WebAssembly is consuming the entire of our application until it's"
605040,611360," fully, uh, native, right, it's not going to be fully native, client is still going to be in WebAssembly,"
611360,617840," but still, right, okay, sounds good, sounds Gucci, sounds what, at Amaguchi, let's go, let's actually"
617840,622240," acknowledge some subs, uh, so Laurie Master, thank you so much for, uh, Twitch Prime with a message,"
622240,627360," four years of good quality content, thank you, I'm really glad that people think that my content is high"
627360,635120," quality, uh, Niklaus, Niklaus D3O, I have a problem, thank you so much for tier one subscription, thank"
635120,644480," you, thank you, thank you, all right, so next milestone, C3 WebAssembly running on GPU, can you"
644480,649920," run, uh, WebAssembly on GPU, uh, I don't really know, maybe there are some extensions that actually allow"
649920,655760," you to do that, but who knows, who knows, who knows, who knows, I'm not really sure how I'm going to be doing"
655760,663520," all of that, um, I feel like I need to maybe introduce like a common C3 module, right, so let's actually go"
663520,670560," ahead and introduce a separate common C3 module, and I suppose I'm going to be compiling that for,"
670560,678000," right, so I'm going to be linking that with the renderer, and I'm going to be compiling separately for"
678000,683920," the server, that's going to be basically the idea, that's going to be basically the idea, okay, so I'm"
683920,690240," going to say this is a module common, right, so this is how you sort of declare the module, uh, and in here,"
690240,697200," I suppose we need to allocate a two-dimensional array, right, or at least one-dimensional array,"
697200,702400," right, so, uh, which can be treated as a two-dimensional one, right, so you can always take a two-dimensional"
702400,707600," array and just straighten it up, uh, right, allocate as one-dimensional one, and then do all of the index"
707600,714240," computations yourself. Uh, let's introduce a function that will allocate like an array of scene, right, so"
714880,719120," it is going to, I don't really know, like, what is it going to return, it's going to return boolean,"
719120,725280," but I don't really know what's the size of the boolean in, uh, C3, does anybody know, by the way,"
725280,731520," uh, okay, can we quickly check that, so can I do main, uh, right, so let's actually do it like that,"
731520,742000," and I'm going to import std, and I'm going to just quickly print, um, you know, boolean, I think this is"
742000,747280," how we do that, right, so size of, so you can take a type, and you can take a size of of that type,"
747280,755680," this is how we do that, then we do C3, compile, run, common, uh, C3, uh, right, let's go, and is it going"
755680,762720," to do the thing, so it's going to take some time, so we're warming up some cases, one, it is one byte,"
762720,770880," interesting, it is one byte, so if you, if I do something like, uh, uh, int, the size of int,"
772000,777440," is four, right, and size of, how do you do 64, by the way, is there something like, uh,"
777440,784400," u64, or maybe int64, uint64, I don't know if you can know, honestly, but this is just a boolean,"
784400,793920," right, so maybe, okay, so basically we're going to treat each cell as one byte, u long, okay, uh, u long max,"
796720,803120," u long max, because, you guys know, like, I suppose, I feel like, I think YouTube audience"
803120,810480," doesn't really know everything that I do on Twitter, but on Twitter, uh, I did, like, a very stupid joke,"
810480,818000," uh, about u long max, let me actually show you, uh, right, so if I can find it, um,"
820160,827280," so, uh, somewhere down there, uh, it was actually a long time, yeah, yeah, there we go,"
827280,834560," so this is basically the joke, uh, so yeah, yes, I know him, he's the current owner of x social,"
834560,838080," uh, social platform, formerly known as Twitter, u long max,"
838080,842960," this is so fucking stupid, but I mean, yeah,"
845120,850800," that's what it is, I'm gonna, uh, I'm gonna post it to, uh, to chat, uh, without any cancel,"
850800,856320," but I mean, uh, if you don't have a Twitter account, you can just put cancel in front of x,"
856320,863360," by the way, uh, like, a trick for anyone for whom x is currently banned, people in Russia or Brazil,"
863360,868560," right, or who doesn't have any account, right, or don't like Twitter, you can just put a cancel in"
868560,873600," front of it, and you will get an access to that tweet, so there is a, like, a neater instance in here,"
873600,879040," don't tell anyone, don't, don't fucking tell anyone, uh, right, so I'm gonna put that in"
879040,884880," description, right, so for anyone who's interested, so, uh, for anyone who wants to laugh at my, uh,"
884880,895280," u long max, a joke, haha, very fucking funny, very funny, oh, oh, chat, laugh, love,"
897200,904560," anyways, uh, so, uh, let's go, so this is a boolean, so essentially, uh, yeah, okay, thank you,"
904560,911680," thank you, thank you, chat, uh, what I want to do, I want to allocate, uh, right, so this scene, right,"
911680,918160," so we're going to do something like allocate scene, and we're going to accept width and height,"
918800,925600," right, so this is the function that is going to be available from, um, available to JavaScript,"
925600,930080," right, so we're going to be calling this function from JavaScript to allocate a little bit of a memory"
930080,934960," from within the WebAssembly module, that's going to be basically the idea, so the module itself is"
934960,940480," called common, right, so that's the module we have, so it's an external function, right, so we need to"
940480,944960," specify what's going to be the external name, uh, it's going to be the same name as it is, and I'm also going to"
944960,951040," specify that this is a wasm function, so in here, we're going to be basically doing the same thing we do"
951040,959360," in a renderer, c3, so when we are allocating pixels, right, so we're just allocating a new array, so I say"
959360,968720," mem new array, right, and I'm just allocating a boolean, uh, width by height, uh, right, and that gives me"
968720,974720," basically an array of scene, a one-dimensional one, but I mean, it's just like, uh, it's a straight enough"
974720,979760," two-dimensional, and what I'm doing, I'm just returning the pointer to the beginning of that"
979760,987040," array, right, so that's basically the idea, and I think that's the entirety of the thing I want to"
987040,996160," do in here, so the JavaScript code is going to simply allocate the scene and just populate the scene in"
996160,1002240," there, um, so we also need to make sure that it's populated with the same stuff on both clients and the"
1002240,1012640," server, right, so maybe we can populate it somewhere in here, uh, I'm not quite sure, I'm not quite sure,"
1012640,1022160," we'll see, we'll see, anyways, so we need to compile this entire thing, um, right, but we also need to use it"
1022880,1032640," in the client, so right now the client's web assembly module is called a renderer because it is only"
1032640,1043120," concerned with the rendering, so maybe I should rename this entire thing to something like client, right,"
1043120,1051120," because now it is not only concerned with the rendering, but also with maintaining the state,"
1051120,1056720," so because of that it kind of makes sense to actually call it a client, so an idea is going to be"
1057360,1065520," is that, uh, we're also going to link the common module, common c3, into the client, right, and we're"
1065520,1073120," probably going to have a server c3, which will also link with the common, right, and it's just like two"
1073120,1079360," web assembly modules that are used both by client and the server, right, so this is actually, this is actually"
1079360,1088000," kind of cool idea, right, so renderer client wasm, actually the other way around, I think it's going"
1088000,1092800," to be client render wasm, but I mean, it's just like, it doesn't really matter how exactly we'll organize"
1092800,1101200," the objects and stuff, none of that matters, uh, thank you so much develop land for, uh, wasm to what,"
1101200,1108560," wasm to what indeed, uh, right, so we can take a look at what, um, so of this client, uh, right,"
1108560,1116800," so wasm to what, client, I think you have to do it like that, wasm to what, client wasm,"
1116800,1124480," redirect client what, and what we'll get, we'll get this thing, right, so this is how web assembly looks"
1124480,1131600," like, uh, textual representation of web assembly, not particularly human readable, but you can read it,"
1131600,1137200," right, so it's not really that hard to read, uh, some of the things that are very obvious is when you"
1137920,1144000," export some things, right, so here are all of the objects that we export in here, right, so we export"
1144000,1149120," memory, allocating pixels, some of the functions responsible for rendering, for example, render"
1149120,1154720," floor and ceiling, as already said, we're rendering floor and ceiling in web assembly, and look at that,"
1154720,1162800," we have a function that does exactly that. Can your clean code do that? Can your clean code do that?"
1162800,1167360," you're supposed to have like a shit ton of hierarchies and virtual functions and shot like that here,"
1167360,1173440," uh, I say that web assembly module is responsible for rendering floor and ceiling, and look at that,"
1173440,1178640," it has a function that says render floor and ceiling. How more clear can you be than that?"
1179840,1181760," How fucking more clear can you be than that?"
1181760,1191200," Fucking no! I don't fucking know! Just write a goddamn fucking code that solves the problem, bruv!"
1196960,1206240," too much concern mixed, yeah, rendering floor and ceiling in a single function? What the fuck is that?"
1206240,1213360," Where is my single responsibility? Each function must have a single responsibility, which means that each"
1213360,1222000," function has to consist of a single CPU instruction. And even that, on x86-64, some of the CPU instructions do"
1222000,1230320," too much. You need to use micro-op codes or something. What the f- can anybody like for real explain to me"
1230320,1236320," what the f- is a single responsibility principle? Who, who f-ing came up with that? Like what kind of"
1236320,1243200," mushrooms they smoked? Like what the f- is that? How do you measure that? It's just like what is a single, like how..."
1247600,1248160," Anyways."
1248160,1255200," Anyways, let's continue."
1255200,1261760," Let's remove this Scheisse."
1261760,1272960," Let's remove this Scheisse, my friend. So, I need to update the building, actually. BuildJS, right, because I"
1272960,1280160," rename to render to clients. So, I must do that stuff in here as well, right. So, this is a client now."
1280160,1288160," Right. So, if I run npm run build. So, let's see if it still works or not."
1288160,1299520," Yesu, yesu, yesu. So, now if I try to serve this, it's already serving. If I try to refresh, it is not going to"
1299520,1304800," work because it couldn't find the WebAssembly module because we renamed it. Which is understandable,"
1304800,1308160," right. So, execute compile HTTP status code is not okay."
1308160,1315280," Thank you so much. HTTP status code is not okay."
1315280,1320080," Are you okay? No, it's not okay."
1322000,1332560," All right. So, let me go into the client mts and find renderer wasm. So, now it is client."
1332560,1343040," So, on top of that, it is loading a thing into a wasm renderer, right. So, we have a thing called wasm renderer,"
1343040,1349360," and here we instantiated wasm renderer and the entire thing is called wasm renderer. So,"
1349360,1356160," which is not what I think it should be called, right. So, it should be called wasm client because"
1356160,1361520," we renamed the whole thing into client, right. So, maybe I'm going to go ahead and say query"
1361520,1368960," replace wasm renderer wasm client, right. So, hopefully, emacs is going to update the casing."
1368960,1372720," It almost did update the case."
1372720,1380640," It almost managed to do that. I don't fucking know, man. All right. So, this is client. I'm going to"
1380640,1388560," query place wasm renderer, right, to wasm client. Is it going to work? I think it's it works almost"
1388560,1396400," correctly. All right. So, we are renaming all of that stuff. Yeah, instantiate wasm. And I'm going to"
1396400,1404080," query place wasm renderer with wasm client. All right. So, hopefully, that is going to work as well."
1404080,1410480," Look at that. Who needs IDE to refactor the code? If you can just query replace in a shitty"
1410480,1418640," editor from 70s, you can do that in any shitty editor from 70s. You don't need any Visual Studio"
1418640,1423200," code. You don't need any LLMs. You can just like search and replace. Did you guys fucking know that?"
1423200,1428960," Did you guys know that? And this is like a thousand lines of code refactored easily,"
1428960,1436480," easily in a shitty text editor from 70s. Can your LLM do that? I bet this entire"
1436480,1446240," shit doesn't even fit into its small little context. Disgusting. Anyways. So, let's actually try to"
1446240,1453200," recompile this entire thing. Let's try to recompile this entire thing. Is it working? Is it twerking?"
1453200,1458560," I hope it is working. It is twerking. Okay. So, and let's refresh this entire thing. And look at that,"
1458560,1461120," it works. So, we successfully renamed some variables."
1462960,1468480," I'm a professional software developer, right? So, I rename variables and I color buttons. That's what I"
1468480,1479280," do. Okay. So, now we have a client C3. We have a common C3. And okay. So, it compiled to executable."
1479280,1485600," Let's remove the executable. I wonder how we're going to be linking with all of that. Can we just like"
1485600,1494400," import common in here and try to compile it? So, I'm in a client and I'm trying to import common."
1494400,1498960," So, if I understand correctly, this is not going to work, right? So, let's actually go ahead and try"
1498960,1506960," to compile this. Yeah. So, there's no module named common, right? And this is because when we're building"
1506960,1516400," this entire Shysung, we have to add common C3 in here, right? We have to add it in here. Okay. So,"
1516400,1522560," now, if I try to build this entire thing, hopefully, it is going to work, right? Hopefully, it is going to work."
1522560,1529760," Okay. So, it compiled successfully. It compiled successfully. Honestly,"
1530560,1540560," So, if I take a look at the wasm to what? Can I do wasm to what of this thing? Does it have allocate"
1540560,1547040," scene? It does, in fact, have a function that allocates the scene. As you can see, it does a lot"
1547040,1552960," of stuff in here. It probably inlines some code from the memory allocator and stuff like that. So,"
1552960,1559760," but the question is, is this function exported? It is, in fact, exported. It is, in fact, exported. So,"
1559760,1565520," this is actually kind of cool. So, what I want to do now, I want to have a server."
1565520,1574640," So, as of right now, server, I didn't think it is going to have any useful code, right? So, let me go"
1574640,1582400," ahead, just create a server, C3, and it's going to import common, but it's not going to do anything else,"
