start,end,text
6559940,6569220," like basically pop the things one by one. Uh, so while, uh, length of city X stack is greater than zero."
6569220,6578340," Right. Right. And, uh, length of the contract ins is great. Well, here's the thing. Uh, we don't want"
6578340,6584900," to modify the ins because the contract can be reused several times. So we need to have a copy of ins."
6584900,6595300," Right. So we need to copy, uh, this entire thing. Furthermore, I think we need to copy this stack as well."
6595300,6601460," Right. We need to copy this stack as well because, um, intrinsics, if we're going to reuse this entire"
6601460,6607780," thing for intrinsics, intrinsics have overloaded contracts, right? They have overloaded contracts."
6607780,6615060," And, um, because of that, we need to be able to check several contracts and pick the one that actually"
6615060,6619380," fits there. But to be fair, it's kind of outside of the scope of what we're doing right now. So probably"
6619380,6626740," I'm not going to bother. So I'm going to only have a copy of this in, uh, so yeah, here we're going to"
6626740,6634660," have something like this. So the actual thing in here, oh, it depends on the stack. So data, uh, stack,"
6634660,6642100," uh, it's, it accepts data type and the token where that data type was introduced. Okay. So, um,"
6642900,6653060," so data type, the actual and the basically talking location, right? So, uh, C T X stack pop and the"
6653060,6660100," expected data type is expected is in ins. So we're going to do pop. And here is this thing. If the actual"
6660100,6669780," not equal to expect it, right? This is the perfect time to report an error, right? So compiler error with"
6669780,6673780," the expansion stack, so we're going to do, um, so what we're going to do actually."
6673780,6683460," So, yeah, we can actually point at the token location, right? So we're going to point at the"
6683460,6691140," location where an expected type was introduced, right? So we know where that actual type was introduced."
6691140,6697620," We can use it as the location of the report, right? And what we're going to say in here, uh, unexpected,"
6698980,6706260," uh, data type, right? So here's an expected data type. Um, and what we can do in here, I suppose we"
6706260,6714260," can just do, uh, actual, right? So here's the actual, and, uh, then we can say something like expected,"
6714260,6719460," uh, expected, right? Expected, expected, and then we're going to exit with this thing."
6719460,6727140," Okay. And basically we keep popping, we keep popping the elements until one of them becomes empty, right?"
6727140,6732900," Until one of them becomes empty. So, and the question is like, depending on which one became empty,"
6732900,6736580," we'll have to report different errors, uh, right? If"
6736580,6746980," CTX stack became empty. Well, this one is rather interesting, right? So we need to check that some of"
6746980,6752660," them is empty and some of them are not. But since this, because of this condition, because of this"
6752660,6757780," condition, we know that one of them, at least one of them is zero. So the way we're going to do that."
6757780,6764020," Okay. So if the length of this thing is greater than the length of this thing, that means that this thing"
6764020,6771940," is zero, right? That means this thing is zero. And, uh, that means we have unhandled data on the stack,"
6771940,6777700," right? So we're doing, does it really matter?"
6780660,6786340," no, I don't think so. Right. So the stack can actually have more things. Um,"
6786340,6790740," um,"
6790740,6802420," yeah, so that kind of makes sense. For some reason, I don't quite comprehend, like, should"
6803220,6807700," this stack be, I think it doesn't matter, right? So if the stack"
6807700,6816020," becomes that, so I think this is the thing that we care about. If stack became zero, but you still"
6816020,6822260," have some stuff in the ins, that means you have to do something, right? So this is definitely an error"
6822260,6827460," that you have to report. And how are we going to report that error? That's a good question."
6829140,6836500," So we have some ins. Where exactly do we want to report that? Um, so I think we want to report that"
6836500,6843380," in the place where you call this thing, right? So we can provide the location and this is the location"
6843380,6857620," that we're going to use. Um, not enough arguments, uh, not enough arguments provided, um, expected,"
6859700,6865780," and then we can iterate through the rest of the stuff we have in here. So the, uh, it's going to be"
6865780,6877540," type in ins. And then as a compiler note, we can say, uh, location and F and this is going to be type."
6877540,6886500," And then we're going to exit with one. And I think that is it, but not really, right? If, uh,"
6887860,6894260," ins is zero, if ins the zero, that means we consume everything. And now we have to take the stack"
6894260,6900820," and append the contract outs, the contract outs."
6900820,6908260," That is very cool. But here's the thing. It's not going to pass because the stack also accepts the"
6908260,6916420," location where those things were introduced. Those things were introduced in here. So, but it actually"
6916420,6922420," accepts the location in the form of a token. So that means here we have to provide this thing as a token,"
6922420,6932980," introduced, uh, token, uh, token location or something like that. Introduced token location."
6932980,6939780," Uh, so that means this one with expansion stack intro, let's actually call it intro talking location."
6940500,6951060," Um, maybe just intro talking, uh, token. So this is the token that introduced. So this is the intro"
6951060,6963540," token. Uh, huh. And intro talking location outs. We need to map this into, I think, right? So for type in out,"
6964580,6974500," uh, we're going to do, uh, type and intro talking. So that's how we're going to do that. Right? So I think"
6974500,6979380," this is the whole type checking process. I don't think we need to implement anything else in here,"
6979380,6987620," hopefully. So let's go ahead and, uh, compile the entire thing. So, uh, this thing expects more. And the"
6987620,6994820," token that introduced is the token that is part of the current OP. Don't freaking tell me that it just"
6994820,6998980," worked first try. Don't freaking tell me that it worked first try. I do not believe that."
6999780,7015300," Uh, okay. Okay. So if I remove this thing. Fuck sake, it worked first try. What the fuck?"
7015300,7023780," No, I can't believe that there should be. Oh, I remembered. I think I remembered. We didn't type"
7023780,7030900," check the procedures themselves. I think, right? You can do something like this, like 100 and it's"
7030900,7038100," going to, yeah, it is going to work. And as you can see, it's summed up the things. Uh, and I think"
7038100,7045620," one of the things we need to do in here is just like, yeah, uh, mass plus subscribe with tweet prime."
7045620,7050180," Thank you so much for three months of tweet prime subscription and welcome to our epic fourth club."
7050180,7057940," Okay. Excuse me. Here's the thing. We don't go inside of the procedures, right? So that's one"
7057940,7063380," of the problems we have. We don't go inside of the procedures. Uh, so how can we go inside of the"
7063380,7070260," procedures? That's a very good question. Um, to go inside of the procedures. Oh, fuck."
7076660,7087860," Well, since we have the BFS of the context, we can basically add the context for each individual"
7087860,7093700," procedure. Since like when we type check the call, we don't go inside of it. So we never actually"
7093700,7100820," type check the internal procedures. So what we can do, we have procedure contracts. Let's add additional"
7100820,7106180," context to the wave. So wave also goes inside of the procedures and tap check them without going inside."
7106180,7112820," And oh, the current way of type checking actually fits perfectly for what I'm doing right now. Like"
7112820,7121300," That's really weird how all of the pieces just come together very nicely. I didn't expect that."
7121300,7128500," Like the type checking system works out for the intrinsics and it's really easy to now"
7128500,7134500," go inside. Okay. So how can we do that? Um, I'm going to go through all the procedures. So it's going to be four."
7135700,7144020," Uh, PROC address, right? PROC address and we don't really care about the PROC contract per se, do we?"
7144020,7152500," We, holy fucking shit. Oh my God. We do care about the contract because the contract of the procedure"
7152500,7160420," denotes the current state of the stack, right? So when we start the context execution for type checking"
7160420,7167860," inside of the procedure, we know the specific state of the stack. Here it is. Here is the expected state of"
7167860,7172580," the stack and we can just grab this as the current stack of the stack and continue type checking."
7173460,7179700," So this thing just provides this stack to use to start type checking things. Holy fuck."
7179700,7182500," This is so cool."
7182500,7193140," Yo, I like that. And this is what is expected. This is what is expected in here."
7194740,7204180," Yo. Okay. I'm sorry. Um, so we iterate through all these things, uh, in, uh, PROC contracts,"
7204180,7212900," right? And, uh, we take the items in here, right? And basically for the contexts, uh, we append, uh,"
7212900,7221940," the context, the initial stack of which is the PROC contract input INS, right?"
7221940,7236420," INS and, uh, the IP, we know that the IP is the address, right? The IP is the address. You know what?"
7236420,7242500," Since we don't go inside of the procedures, right? The context doesn't need the return stack."
7243300,7250020," It just doesn't need it because we never actually like go there and go out. So the only thing you need"
7250020,7260980," is, um, the stack and IP. But how do we test inside? Okay. So inside of the procedure, we reach the end."
7260980,7269860," How do we test that we expect this state of the stack? How do we expect it, uh, like this?"
7272100,7280020," We have to make it. Okay. Here's the thing. So we finish, we pop the current type checking context"
7280020,7286740," when the stack becomes empty. So when the stack becomes empty, I think we can have outs in here,"
7286740,7293460," that says, that say what kind of things we expect on the top of the stack. So we expect the list of data"
7293460,7303780," types. Oh, and this thing is applicable for the context outside of the procedures, right? Because"
7303780,7310420," outside of the procedures at the end of the program, we expect no output, right? So you cannot just push"
7310420,7315700," something on the stack and finish the program. You have to process everything. And that could be part of"
7315700,7322580," the expected outputs within the context, right? So when we start the execution, we say that for the whole"
7322580,7329300," program, so this is the whole program context, we expect no outputs, but for specific procedures,"
7329300,7339300," the outputs are going to be the outputs of the contract. That's so cool. I really like that. Okay. So the outs"
7339300,7346420," is the, uh, proc contracts, uh, outs. There we go. So this is how we're going to do all of that shite."
7347860,7355060," So, and I just remembered stack accepts also the tokens, but these ins are not the tokens. So we need"
7355060,7364580," to know where those things were provided. Fuck. Um, that is very, very interesting. So maybe for now,"
7364580,7372100," it would be kind of cool to actually use the locations of these tokens as the location where the data was"
7372100,7379700," introduced, right? So for instance, if you have like a pointer in here and you do something like,"
7379700,7385780," I don't know, what's not compatible with the pointer or like Boolean, right? And you do plus one. And this,"
7385780,7391460," the compilation step will say, okay, you cannot add integer and Boolean. And it will say the integer and"
7391460,7395780," Boolean are introduced in here because we know the locations of this token. That will be actually kind of"
7395780,7406500," cool. I think, I think that will be kind of cool. Hmm. You just check the program as independent your"
7406500,7413140," proc as independent program. Yes. Kind of, kind of, it's kind of like that. Uh, but for the proc, you"
7413140,7420260," have different expected outputs for the main program. There's zero outputs expected. And for the proc,"
7420260,7425540," there is very specific outputs expected. What's interesting is that if we going to introduce"
7425540,7431220," the following thing that the main program, uh, expects the exit code, right? So you always have"
7431220,7438020," to have at least like one, um, integer on the stack and that integer is going to be used as the exit code."
7438020,7444660," It would be trivial to enforce that basically for the main program, just say that you expect data type"
7444660,7450980," integer as the whole program. And there you go. So, and then that integer is going to be used as the exit code."
7451780,7459540," Um, that is really cool. So everything just like fits together. This is unsettling actually, the fuck."
7459540,7468660," So yeah, you know, it feels like when you play in a video game and you encounter enemies, right? And that"
7468660,7473060," means you, you going in the right direction. That's what it feels like, right? It feels like I'm going in the"
7473060,7480580," right direction. Uh, so yeah, that's pretty cool. Um, okay. So for the ins here, we'll have to probably do"
7480580,7485780," something special because we need to introduce the tokens. Uh, but for now we don't really have enough"
7485780,7493540," information to introduce it. So I'm going to do for, uh, type in this thing, right? So this is the stack"
7493540,7500660," and this is going to be type, uh, and the token, we can always take the procedure address, right? We take"
7500660,7508740," the procedure address and we take the operation where the procedure starts, right? This is where it starts."
7510260,7516020," Uh, and then since we have OP, we know what token introduced that OP so we can use that as the location."
7516020,7523700," Uh, so it's not pretty, but it's something, it's at least something. Okay. So let's try to, uh, to compile"
7523700,7531140," this entire thing. And, uh, what do we get? Um, uh, unexpected returns that, yeah, we don't have a return"
7531140,7540020," stack anymore as I said, uh, uh, contexts, uh, it's a plural thing. Uh, and another thing ins. Okay."
7540020,7553860," Dict has no attribute ins. So contract. Oh, it's a single one. Uh, contract. Oh, it's actually,"
7553860,7558340," it's actually super easy to confuse this entire stuff. So maybe I should get rid of those."
7559780,7563940," Uh, it's going to be kind of difficult. Okay. So I already, I already started doing this thing."
7563940,7571540," Um, okay. Uh, so what are we doing here? Compile them? Oh yeah. Okay."
7571540,7581300," So here is an intrinsic and we do plus and invalid blah, blah, blah. So what does it say? Um,"
7584020,7589860," Oh, oh yeah. So now we have to go through all of the context. Okay. I think I need to just type,"
7589860,7594340," check this entire thing. Right. So, because I'm checking types at runtime, but I'm obviously need"
7594340,7599300," to check them at compile time. So I need to statically check everything. Uh, all right. So finally, okay."
7599300,7608180," Compiler notes. Uh, what do we have in here? Oh shit. Uh, compile note."
7610340,7620500," All right. Uh, okay. So return stack. Okay. So this thing has to be re-implemented to do re-implement."
7620500,7628980," Right. So this is the re-implement next one. Uh, compile a path. Uh, oh,"
7630580,7638580," Oh, we have a special. Yeah. Okay. Here's the thing. Since our execution always goes inside of the"
7638580,7646660," procedures, right? Uh, like a BFS. If we encounter an error deep inside of some function, this error is"
7646660,7653460," kind of useless unless you know the whole path of the execution. You see what I'm talking about? It's kind of"
7653460,7660900," useless. So that's why I also keep track of the whole path of the execution that led to that error."
7660900,7667860," So I can report it as a stack trace telling the programmer, uh, where like what exactly caused that"
7667860,7674740," thing. So this is how the meta execution went, but since we have signatures, it is not needed anymore."
7675940,7682260," Like we don't have to do that. Right. So, because the, the, the errors will be catch as early as possible."
7682260,7688980," So we have to refactor this entire thing. So we have to get rid of the compiler error with call path."
7688980,7696420," All right. So we have to replace it with just a regular thing. Uh, yes, yes, yes. We're freaking there."
7696420,7708020," So, uh, we need to replace this call, uh, with just a thing with expansion stack, expansion stack,"
7708020,7716100," which accepts, uh, just the token. So this is basically what we have to do in all of these places."
7716100,7722340," So that will require a little bit of Emacs magic to do the, uh, substitution by a regular expression. So"
7722980,7731940," let me quickly see how we can do that. Uh, so to be fair, it should be as easy as taking this thing"
7731940,7743940," and replacing it with, uh, something like this. Yeah. So because we're using the same names everywhere."
7743940,7754900," So we're going to query replace this thing. Uh, uh, Oh shit. Oh fuck. Oh damn. Uh, query replace. Uh,"
7754900,7762260," it's not even have to be, um, regular expression. We have to replace this thing with, uh, this thing."
7762260,7770100," Boom, boom. And let's just do that everywhere. Right. Straight up everywhere. Uh, is that fine?"
7770100,7777300," Okay. So an expected word key stack. We say we, okay. So here's the if, right. And when we split"
7777300,7782100," the execution for the, if we copy the return stack, we don't have a return stack. We don't have to do"
7782100,7788260," that anymore, but we have to copy the out. Okay. That one is interesting. So maybe I can do a little bit"
7788260,7794340," over Emacs magic yet. Again, I'm going to replace this thing with just outs. Ah, Emacs, Emacs is done."
7794340,7801540," Um, uh, didn't allow me to properly select this thing and do outs. Come on. You can do that. Okay."
7801540,7813540," Okay. So there's a last thing in here. So, oh yeah, here's the thing. Oh shit."
7814340,7822660," You guys remember how I said that I type check while loops by testing whether I already visited that do or"
7822660,7829060," not. That actually introduced like a lot of problems when I introduce procedures. Okay."
7829060,7837380," So imagine that I have, uh, fourth mode while dupe, uh, less than 10. And we just do some stuff in here."
7837380,7846180," Right. Uh, imagine that this thing inside of the procedure, right. Uh, F in something like this."
7846180,7854260," And imagine that you call this procedure several times. So on the first call, you visited do twice."
7854260,7858580," And on the second call, you visited do second time."
7860580,7866180," So like you also keep repeating that process and this actually creates a lot of problems. So,"
7866180,7873860," uh, when I keep track of whether I visited do, I also keep track whether I visited it by a particular"
7873860,7880900," call path. So the execution path that led to the, to that do is part of the key that I used to keep"
7880900,7887060," track of whether I visited that do or not. So as you can see, this entire stuff became even more"
7887060,7892740," complicated, but now again, we don't have to do that. So that means I can just simplify that because we're"
7892740,7898660," never going to have different execution paths that led to the same do, uh, because we don't go inside"
7898660,7904500," of the procedures anymore. So that simplifies everything. Uh, so we have visited do, right."
7904500,7911140," And the key of visit do is a call path. So I can replace it with the OP address. There we go."
7911140,7918180," So let's actually go through the, uh, compilation errors. So context doesn't have this stuff. Uh,"
7918180,7925620," all right. So this is the call, uh, path. So instead of call path, I can just use CTX IP, um,"
7930660,7951700," do we do anything else? Uh, missing positional. Okay. So this is another thing."
7951700,7973540," Uh, so this is the contracts. So program contracts, uh, the fuck is this? Uh, and then we have to provide"
7973540,7981060," the pro contracts. There we go. We're almost there. Hopefully, uh, used to. Okay. So everything type"
7981060,7986820," checks. All right. So let's try to run this entire thing. Invalid argument to type for plus separate way."
7986820,7993940," Did it freaking just worked first time again? Disgusting. Okay. So"
7997700,8003460," really it, it just freaking worked, uh, invalid expected int or pointer, but we'll click. Okay."
8003460,8009780," So I'm going to remove that stuff and okay. Yes, of course, uh, we need to re-implement return."
8009780,8013540," We need to re-implement return. This is very important. Um,"
8013540,8022260," this is almost the last thing that we need to check, I think,"
8022260,8027540," because after that, we also need to check the end of the execution, right? We need to check the end of the"
8027540,8035380," execution. Um, so how are we going to do that? So let me take a look at the original implementation"
8035380,8048660," of OP type return. Uh, uh, uh, uh, OP type correct. So what did we have in here is we just pop"
8048660,8055780," the return stack and continue the execution, but this is not what we need to do. This is definitely not"
8055780,8062260," what we need to do. What we need to do in here is take a look at the current stack"
8062260,8070260," and just check that it has the same outputs as in the contract. So outs, uh, copy."
8070260,8078260," Oh, we already have outputs, so we don't have to do anything. So this is going to be while"
8078900,8084260," the length of the CTX stack is greater than zero and length of the..."
8084260,8097620," Yeah, that's fine. Uh, it's kind of the same code as for the type, uh, check contract or something, except..."
8101220,8107140," Can I just reuse that shit? But it's requires kind of a different contract."
8107140,8111140," Huh."
8111140,8121460," Can I just reuse that? So intra token. Okay. So that's fine. OP token. So here is the current context."
8122900,8133300," Um, and the contract in this case is going to be... So inside of the contract, um, I'm using only INS and..."
8133300,8138820," INS and outputs and for the stack..."
8138820,8146260," Uh-huh. So here, by the way, this stack is incorrect. I have to use the... I don't know. It's fine."
8148740,8150420," Uh-huh. I'm just thinking..."
8150420,8154820," How can it be done?"
8154820,8166820," Right. Because in that case, the outputs become the inputs, right, for the return."
8166820,8175060," So I think the type checking of this thing should be slightly different."
8177620,8184180," I think we should pass the only INS, but not OUT, because in the contract..."
8184180,8186580," Well, in the contract OUT, we still use them."
8186580,8191060," We still use them."
8191060,8196900," This one is really strange, but I think I should be able to do that."
8196900,8201780," Um, all right. OP type"
8204020,8215060," return. So in that case, contract INS are the context OUT, but the OUT is nothing. We don't output"
8215060,8215540," anything."
8215540,8219300," And that is basically it."
8219300,8225540," After that, we want to pop that context from the context, right? So this is going to be"
8226100,8233620," context. Uh, pop. And we continue the execution, right? So the output becomes the expected inputs of"
8233620,8235460," the contract. So that creates a new contract."
8235460,8243700," Shit. I like that. So that's a very interesting way of doing that. And handle data on the stack."
8244500,8249460," Uh, okay. All right. So that's cool. And it printed"
8251060,8258820," actually one, which is not correct by the way. Something is screwed up completely."
8258820,8265140," All right. That's, that's cool. So we have two things in here."
8266660,8275940," Um, oh yeah, it's duplicated. Uh, okay. So it's summed up two numbers, duplicated that one number"
8275940,8284260," and just printed one and then it returned. Okay. That's actually correct. Almost."
8284260,8294020," Um, but if I print twice, not enough arguments for the print. Okay. That's very strange. Okay. Something"
8294020,8301140," went wrong. Uh, so yes. Oh my God. I'm already streaming for two and half of an hour."
8301140,8312260," All right. Let me, let me see. Um, of course I'm already tired. I'm kind of tired."
8312260,8322900," Let me do the following thing. I'm going to do assert false and I'm going to print the current context."
8322900,8326260," I just want to see what's the state of the current context and whatnot."
8326260,8333780," So in the current context, what do we have? Uh, what do we have in the current context? So this is going"
8333780,8344660," to be this thing. So this is the stack. Uh, and then we have IP six and outs. This is the expected outs."
8345780,8353780," Uh, all right. So we have two of these things, right? We have two of these things classic. Oh,"
8353780,8354420," shit. I see."
8354420,8361460," But is it classic bug? I don't think it's a classic bug."
8362980,8368340," I don't think so because we're popping the context out. So, and if we forgot to do"
